date_str,source,url,themes,locations,persons,organizations,tone,translation_info,full_text
20260211181500,vanityfair.it,https://www.vanityfair.it/article/francia-per-rilanciare-la-natalita-il-governo-manda-una-lettera-a-tutti-i-29enni-con-informazioni-sulla-fertilita,GENERAL_GOVERNMENT;EPU_POLICY;EPU_POLICY_GOVERNMENT;TAX_FNCACT;TAX_FNCACT_CITIZENS;TAX_ETHNICITY;TAX_ETHNICITY_FRENCH;TAX_WORLDLANGUAGES;TAX_WORLDLANGUAGES_FRENCH;GENERAL_HEALTH;MEDICAL;TAX_DISEASE;TAX_DISEASE_INFERTILITY;TAX_FNCACT_EXECUTIVE;SOC_EXPRESSREGRET;TAX_FNCACT_CHILDREN;USPEC_POLICY1;EPU_POLICY_POLICY;TAX_FNCACT_MINISTER;UNGP_FORESTS_RIVERS_OCEANS;TAX_DISEASE_SYNDROME;TAX_DISEASE_DISEASES;WB_1406_DISEASES;WB_621_HEALTH_NUTRITION_AND_POPULATION;UNGP_HEALTHCARE;TAX_DISEASE_ENDOMETRIOSIS;SCIENCE;SOC_INNOVATION;TAX_FNCACT_WOMEN;,1#France#FR#FR#46#2#FR,,,-0.555555555555556,srclc:ita;eng:GT-ITA 1.0,"Nessuno dovrà più dire: «Se lo avessi saputo». Dopo l’estate, tutti i cittadini francesi di 29 anni riceveranno una lettera dal governo con informazioni «mirate, equilibrate e scientificamente fondate» sulla salute sessuale e riproduttiva. L’iniziativa rientra nel nuovo piano nazionale contro l’infertilità, appena presentato dall’esecutivo guidato da Emmanuel Macron, e l’obiettivo è evitare «rimpianti futuri», offrendo strumenti per compiere scelte consapevoli, ma senza alcuna pressione sociale o indicazione su quando o se avere figli.
«La politica non deve dire se bisogna avere figli o a che età», ha chiarito la ministra della Salute Stéphanie Rist durante la presentazione del piano. La comunicazione includerà dati e spiegazioni sulla fertilità maschile («anche gli uomini hanno un orologio biologico») e femminile, sulle possibilità di contraccezione e sulle opzioni di preservazione della fertilità, tra cui l’autoconservazione dei gameti e il congelamento degli ovociti. Il testo definitivo è ancora in fase di elaborazione, ma il ministero sottolinea che la lettera ricorderà come la fertilità sia una responsabilità condivisa tra uomini e donne e che il congelamento degli ovociti non rappresenti una «soluzione miracolosa», ma una possibilità tra le altre.
L’infertilità in Francia riguarda oggi circa 3,3 milioni di persone, secondo un rapporto governativo del 2022. Per affrontare concretamente il problema, il piano prevede anche l’espansione dell’accesso al congelamento degli ovociti: oggi in Francia i centri autorizzati sono circa 40, il ministero punta ad arrivare a 70 entro entro il 2028. Saranno autorizzate decine di nuove strutture, anche private, garantendo che le procedure restino gratuite e fuori dalle logiche di mercato.
Tra le altre misure, particolare attenzione sarà dedicata alla sindrome dell’ovaio policistico, disturbo comune che può compromettere la fertilità femminile e che finora è stato poco considerato, mentre altre patologie come l’endometriosi sono già oggetto di programmi specifici. Il piano include anche la ricerca sugli effetti di esposizioni ambientali e tossiche, come i perturbatori endocrini. La fertilità sarà una priorità nei bandi di ricerca e innovazione dedicati alla salute delle donne, per migliorare conoscenze e strumenti di intervento."
20260216220000,secoloditalia.it,https://www.secoloditalia.it/2026/02/addio-a-robert-duvall-icona-del-cinema-che-credeva-nei-valori-tradizionali-e-repubblicani/,TAX_POLITICAL_PARTY;TAX_POLITICAL_PARTY_REPUBLICANS;USPEC_POLITICS_GENERAL1;TAX_FNCACT;TAX_FNCACT_ACTOR;WB_2670_JOBS;WB_696_PUBLIC_SECTOR_MANAGEMENT;WB_2048_COMPENSATION_CAREERS_AND_INCENTIVES;WB_723_PUBLIC_ADMINISTRATION;WB_724_HUMAN_RESOURCES_FOR_PUBLIC_SECTOR;MEDIA_MSM;CRISISLEX_CRISISLEXREC;CRISISLEX_T03_DEAD;TAX_FNCACT_ACTRESS;TAX_FNCACT_CANDIDATE;TAX_FNCACT_FATHER;TAX_MILITARY_TITLE;TAX_MILITARY_TITLE_ADMIRAL;TAX_FNCACT_ADMIRAL;TAX_DISEASE;TAX_DISEASE_FLU;EPU_CATS_NATIONAL_SECURITY;TAX_DISEASE_CHOREA;MILITARY;WB_1467_EDUCATION_FOR_ALL;WB_2132_APPRENTICESHIP;WB_470_EDUCATION;WB_1484_EDUCATION_SKILLS_DEVELOPMENT_AND_LABOR_MARKET;ENV_COAL;MARITIME;TAX_FNCACT_MAN;TAX_FNCACT_CHILD;LEADER;TAX_FNCACT_POLITICIAN;TAX_FNCACT_SUPPORTER;TAX_POLITICAL_PARTY_REPUBLICAN;TAX_FNCACT_WOMEN;TAX_WORLDLANGUAGES;TAX_WORLDLANGUAGES_LATIN;TAX_FNCACT_DANCER;TAX_FNCACT_CHILDREN;TAX_DISEASE_INFERTILITY;TAX_FNCACT_DIRECTOR;TAX_WORLDMAMMALS;TAX_WORLDMAMMALS_HUMAN;CRISISLEX_T11_UPDATESSYMPATHY;,"1#Argentina#AR#AR#-34#-64#AR;2#California, United States#US#USCA#36.17#-119.746#CA",america latin,party republican,5.6047197640118,srclc:ita;eng:GT-ITA 1.0,"Aveva 95 anni
Addio a Robert Duvall, icona del cinema che credeva nei valori tradizionali e repubblicani
L'attore premio Oscar si è spento nella sua casa di San Diego. Fra le sue interpretazioni indimenticabili, il consigliori del Padrino e il tenente colonnello Kilgore di Apocalypse Now
È morto all’età di 95 anni Robert Duvall, icona del cinema americano e attore dalla presenza magnetica. Duvall ha recitato in pellicole che appartengono alla storia del cinema come Il Padrino e Apocalypse Now, spesso con ruoli secondari che ha saputo comunque rendere immortali con la sua interpretazione. “Bob”, come lo chiamavano familiari e amici, nel corso della sua lunghissima e proficua carriera, ha ricevuto sei candidature, vincendo la statuetta nel 1983 per Tender mercies – Un tenero ringraziamento.
Addio a Robert Duvall
L’attore si è spento nella sua casa di San Diego, in California. La notizia della morte è stata data dalla moglie, l’attrice Luciana Pedraza, attraverso un commovente post su Facebook: «Circondato dall’amore, domenica 15 febbraio abbiamo detto addio al mio amato marito, prezioso amico e uno dei più grandi attori del nostro tempo. Bob si è spento serenamente a casa sua, circondato dall’affetto e dal conforto dei familiari».
Sei candidature all’Oscar, una vittoria, quattro Golden Globe
Candidato all’Oscar per Il padrino, Apocalypse now, Il grande Santini, L’apostolo, A Civil Action e The Judge, Duvall ha inoltre vinto quattro Golden Globe, due Emmy, uno Screen Actors Guild Award e un Bafta.
La fede nei valori tradizionali
Nato il 5 gennaio 1931 a San Diego, è cresciuto in una famiglia dalle forti tradizioni. Suo padre, William Howard Duvall, era un ammiraglio della Marina statunitense, mentre sua madre, Mildred Virginia Hart, si dilettava come attrice. L’influenza paterna lo porterà a servire il proprio Paese durante la guerra di Corea, dal 1953 al 1954, esperienza che segnerà il giovane Robert e contribuirà a modellare la profondità psicologica che contraddistinguerà i suoi futuri personaggi sul grande schermo.
Dopo l’esercito, Duvall si trasferisce a New York per studiare recitazione alla Playhouse School of Theatre, dove stringe amicizia con Dustin Hoffman, James Caan e Gene Hackman. Qui inizia un lungo apprendistato sui palcoscenici di Broadway e Off-Broadway, dove costruisce la sua reputazione di attore capace di muoversi con naturalezza tra ruoli drammatici intensi e personaggi complessi. Il suo debutto avviene nel 1952 al Gateway Playhouse di Long Island e, dopo una pausa forzata dal servizio militare, torna al teatro con una serie di interpretazioni memorabili, tra cui Eddie Carbone in Uno sguardo dal ponte di Arthur Miller, ruolo che definirà in seguito il «catalizzatore della sua carriera».
Da “Il buio oltre la siepe” alla consacrazione con “Il Padrino”
Duvall fa il suo ingresso nel cinema nel 1962 con Il buio oltre la siepe di Robert Mulligan, interpretando un giovane uomo mentalmente instabile, per poi essere consacrato dieci anni dopo dal Padrino nel ruolo di Tom Hagen, consigliori e figlio adottivo di Don Vito Corleone. Da lì in poi è storia del cinema.
L’impegno politico e filantropico
All’impegno professionale, Duvall ha affiancato anche quello politico come sostenitore del Partito Repubblicano – appoggiando figure come George W. Bush, Rudy Giuliani, John McCain e Mitt Romney – e quello filantropico con la fondazione nel 2011, insieme alla moglie Luciana Pedraza, del Robert Duvall Children’s Fund per aiutare famiglie in Argentina e il sostegno a Pro Mujer, organizzazione dedicata alle donne più povere dell’America Latina.
Quattro matrimoni, nessun figlio
Duvall si è sposato quattro volte: con la ballerina Barbara Benjamin dal 1964 al 1975; con l’attrice Gail Youngs dal 1982 al 1986; poi con la ballerina Sharon Brophy dal 1991 al 1996. Nel 1997 iniziò una relazione con l’attrice argentina Luciana Pedraza che ha sposato nel 2005. Nonostante i quattro matrimoni, non ha mai avuto figli e, secondo quanto dichiarato nel 2007 dall’attore, la probabile causa sarebbe stata una sua infertilità. Tra i suoi amici più stretti figurano James Caan e Francis Ford Coppola, che testimoniano la sua capacità di creare legami duraturi basati sul rispetto e sull’arte condivisa.
Il ricordo della moglie: «Per il mondo era l’attore da Oscar, per me era tutto»
«Per il mondo, era un attore premiato con l’Oscar, un regista, un narratore. Per me – ha scritto ancora la moglie sui social – era semplicemente tutto. La sua passione per la sua arte era pari solo al suo profondo amore per i personaggi, per un buon pasto e per l’arte di intrattenere in salotto. In ciascuno dei suoi numerosi ruoli, Bob si è dato completamente ai personaggi e alla verità dell’animo umano che incarnavano. Così facendo, lascia a ciascuno di noi qualcosa di duraturo e indimenticabile. Grazie per gli anni di supporto che gli avete dimostrato e per averci concesso il tempo e l’intimità necessari per celebrare i ricordi che lascia dietro di sé»."
20260212104500,tech.everyeye.it,https://tech.everyeye.it/notizie/oggi-darwin-day-giornata-dedicata-padre-biologia-moderna-859178.html,TAX_FNCACT;TAX_FNCACT_FATHER;WB_2433_CONFLICT_AND_VIOLENCE;WB_2465_REVOLUTIONARY_VIOLENCE;WB_2432_FRAGILITY_CONFLICT_AND_VIOLENCE;WB_2462_POLITICAL_VIOLENCE_AND_WAR;WB_1921_PRIVATE_SECTOR_DEVELOPMENT;WB_405_BUSINESS_CLIMATE;WB_2531_INSPECTIONS_LICENSING_AND_PERMITS;WB_2530_BUSINESS_ENVIRONMENT;UNGP_FORESTS_RIVERS_OCEANS;SCIENCE;TAX_ETHNICITY;TAX_ETHNICITY_BLACKS;TAX_FNCACT_SCIENTIST;RELIGION;TAX_WORLDMAMMALS;TAX_WORLDMAMMALS_HUMAN;TAX_ETHNICITY_ENGLISH;TAX_WORLDLANGUAGES;TAX_WORLDLANGUAGES_ENGLISH;TAX_FNCACT_BIOLOGIST;TAX_FNCACT_GEOLOGIST;WB_566_ENVIRONMENT_AND_NATURAL_RESOURCES;WB_590_ECOSYSTEMS;TAX_FNCACT_PALEONTOLOGIST;TAX_FNCACT_MAN;AGRICULTURE;TAX_FNCACT_FARMERS;TAX_DISEASE;TAX_DISEASE_INFERTILITY;GENERAL_HEALTH;MEDICAL;TAX_RELIGION;TAX_RELIGION_CHURCH;MEDIA_MSM;TAX_FNCACT_MONK;TAX_ETHNICITY_GERMAN;TAX_WORLDLANGUAGES_GERMAN;,1#Germany#GM#GM#51.5#10.5#GM,,,3.48837209302326,srclc:ita;eng:GT-ITA 1.0,
20260212121500,d.repubblica.it,https://d.repubblica.it/beauty/skincare/2026/02/12/news/dermaplaning_pelle_controindicazioni-425149434/,CRISISLEX_CRISISLEXREC;TAX_FNCACT;TAX_FNCACT_WOMEN;TAX_DISEASE;TAX_DISEASE_INFLAMMATION;GENERAL_HEALTH;MEDICAL;TAX_FNCACT_DOCTOR;TAX_FNCACT_SPECIALIST;WB_644_NUTRITION;WB_621_HEALTH_NUTRITION_AND_POPULATION;CRISISLEX_C03_WELLBEING_HEALTH;KILL;TAX_DISEASE_BACTERIAL;TAX_DISEASE_BACTERIAL_INFECTIONS;TAX_DISEASE_HYPERSENSITIVITY;TAX_DISEASE_DERMATITIS;WB_1428_INJURY;WB_1406_DISEASES;WB_1427_NON_COMMUNICABLE_DISEASE_AND_INJURY;TAX_DISEASE_INFERTILITY;WB_2024_ANTI_CORRUPTION_AUTHORITIES;WB_696_PUBLIC_SECTOR_MANAGEMENT;WB_831_GOVERNANCE;WB_832_ANTI_CORRUPTION;WB_2026_PREVENTION;AFFECT;CRISISLEX_C07_SAFETY;,,,,-3.76914016489988,srclc:ita;eng:GT-ITA 1.0,"Victoria Beckham, Gwyneth Paltrow, Kim Kardashian. Se anche loro lo fanno, verrebbe da pensare che sia una buona idea. Il dermaplaning, raccontato da celebrità e influencer come il segreto per una pelle subito più luminosa e levigata, ha ormai conquistato social e red carpet. Un gesto veloce, apparentemente innocuo, che promette risultati immediati e che consiste nel radere il viso con una lama molto affilata (non una semplice lametta) per eliminare la peluria fine e, con essa, le cellule morte dello strato più superficiale della pelle. Tuttavia, come spesso accade con i trend virali, dietro l'effetto wow si nasconde una realtà meno patinata.
Accanto ai racconti entusiasti delle star, sui social stanno emergendo sempre più testimonianze di segno opposto che ne sottolineano i rischi. Le ricerche di termini come “regret dermaplaning” o “dermaplaning horror stories” sono in costante aumento. Donne comuni mostrano tagli, rossori, infiammazioni persistenti e persino peggioramenti dell'acne. “Nato come procedura dermatologica professionale, oggi il dermaplaning viene spesso presentato sui social come un gesto semplice, veloce e alla portata di tutte, capace di regalare una pelle immediatamente liscia e luminosa. Video virali, influencer e tutorial fai-da-te mostrano lame che scorrono sul viso con apparente facilità, trasformando un atto medico-estetico in una pratica di routine domestica”, ci spiega Laura Mazzotta, medico estetico specialista in Igiene Preventiva e Nutrizione Clinica presso Poliambulatorio Aesthe Medica Ferrara.
Dietro questa rappresentazione banalizzata si nasconde una realtà ben più complessa. “È sempre più frequente imbattersi in pazienti che arrivano in ambulatorio con segni evidenti di un dermaplaning eseguito in modo improprio: piccoli tagli che non cicatrizzano, irritazioni persistenti, riacutizzazioni acneiche, infezioni batteriche o follicoliti, ipersensibilità cutanea improvvisa. Storie che, per chi le vive sulla propria pelle, assumono davvero i contorni di un ‘racconto horror’, lontano anni luce dalle promesse patinate viste online. Il problema non è il trattamento in sé, ma il modo in cui viene proposto, eseguito e compreso”, prosegue l'esperta. La pelle del viso non è una semplice superficie, ma un organo vivo, che funge da barriera, difesa immunitaria e regolazione. “Intervenire su di essa con strumenti affilati senza una reale conoscenza dell'anatomia cutanea, dello stato della pelle e delle eventuali controindicazioni può trasformare un gesto estetico in un danno dermatologico”, prosegue l'esperta.
I benefici del dermaplaning
Il dermaplaning può funzionare, ma non per tutti e non a lungo. “Uno degli errori più comuni è considerare il dermaplaning un trattamento dai benefici universali. Dal punto di vista medico si tratta invece di un’esfoliazione meccanica superficiale, con effetti limitati e temporanei, spesso amplificati dalla comunicazione sociale. Il principale beneficio è una maggiore luminosità, dovuta alla rimozione dello strato corneo e non a un reale miglioramento strutturale, motivo per cui l'effetto tende a svanire in poche settimane. La temporanea alterazione della barriera cutanea facilita l'assorbimento dei cosmetici, ma rende anche la pelle più sensibile e reattiva. Il dermaplaning può migliorare solo irregolarità molto superficiali e non è efficace su cicatrici profonde, rughe marcate o macchie strutturate. Può essere preso in considerazione solo in pelli normali o secche, non sensibili e prive di infiammazioni, mentre in caso di acne, rosacea, dermatiti o pelle reattiva può risultare inutile o addirittura dannoso”, commenta Mazzotta.
Rischi e possibili effetti collaterali
“Eseguito senza un'adeguata valutazione clinica o con tecnica scorretta, può causare microtagli e abrasioni che compromettono la barriera cutanea, favorendo infezioni. Sono frequenti anche irritazione persistente, rossore e bruciore, dovuti alla maggiore reattività della pelle dopo la rimozione dello strato corneo, con possibile evoluzione in dermatite irritativa. Il trattamento è controindicato in presenza di acne attiva, poiché il passaggio della lama può diffondere l'infiammazione, peggiorare le lesioni e aumentare il rischio di cicatrici o macchie post-infiammatorie. Sebbene meno comuni, le infezioni cutanee sono possibili, soprattutto in assenza di adeguate norme di sterilità, e possono richiedere terapie specifiche. Dopo il dermaplaning aumenta inoltre la fotosensibilità, con un rischio più elevato di discromie se non si utilizza una corretta protezione solare. La prevenzione dei rischi si basa su un'attenta selezione delle pazienti, sull'esclusione delle controindicazioni, sull'uso di strumenti sterili, su una tecnica appropriata e su una corretta gestione del post-trattamento”, afferma il medico estetico.
I rischi del fai-da-te
Negli ultimi anni, il dermaplaning fai-da-te è cresciuto grazie a prodotti online e ai social. “A casa mancano la valutazione clinica della pelle, la sterilità degli strumenti e la competenza tecnica, aumentando rischi di infezioni, microlesioni e danni alla barriera cutanea. Anche la gestione post-trattamento è spesso inadeguata, favorendo irritazioni e discromie. Per questi motivi molti professionisti sconsigliano il fai-da-te, privilegiando la sicurezza della pelle rispetto al risultato estetico immediato”, specifica il medico estetico.
Durata del dermaplaning
“Il trattamento agisce solo sugli strati superficiali dell'epidermide, offrendo un effetto levigante e illuminante temporaneo, legato ai normali tempi di rinnovamento cutaneo (circa 28 giorni). Non stimola collagene o elastina, né modifica in modo strutturale la pelle. Ripeterlo troppo spesso può indebolire la barriera cutanea, aumentando il rischio di irritazioni o infezioni. In genere non è consigliato più di una volta ogni 4–6 settimane, con intervalli maggiori per pelli sensibili o mature. Il post-trattamento è fondamentale. La pelle, più vulnerabile, necessita di prodotti lenitivi e riparatori e l'uso costante di una protezione solare. Il dermaplaning, va comunque inserito in una strategia di cura della pelle più ampia e personalizzata”, conclude Mazzotta."
20260213103000,larena.it,https://www.larena.it/rubriche/salute-e-benessere/nutrire-il-corpo-abitare-la-donna-in-zai-una-serata-di-ascolto-a-cura-1.12923961,TAX_FNCACT;TAX_FNCACT_WOMAN;TAX_DISEASE;TAX_DISEASE_PREGNANCY;TAX_DISEASE_INFERTILITY;TAX_DISEASE_MENOPAUSE;WB_845_LEGAL_AND_REGULATORY_FRAMEWORK;WB_696_PUBLIC_SECTOR_MANAGEMENT;WB_1024_PUBLIC_INTERNATIONAL_LAW;WB_1026_TREATIES;WB_962_INTERNATIONAL_LAW;CRISISLEX_C02_NEEDSPROVIDE_FOOD;CRISISLEX_T06_SUPPLIES;GENERAL_HEALTH;WB_644_NUTRITION;WB_621_HEALTH_NUTRITION_AND_POPULATION;KILL;TAX_DISEASE_ENDOMETRIOSIS;TAX_DISEASE_SYNDROME;IDEOLOGY;TAX_FNCACT_PHYSICIAN;TAX_FNCACT_BIOLOGIST;TAX_FNCACT_NUTRITIONIST;MEDICAL;TAX_DISEASE_DISEASES;WB_1406_DISEASES;UNGP_HEALTHCARE;WB_2670_JOBS;WB_2769_JOBS_STRATEGIES;WB_2840_INTEGRATION;WB_2836_MIGRATION_POLICIES_AND_JOBS;UNGP_FORESTS_RIVERS_OCEANS;MANMADE_DISASTER_IMPLIED;TAX_WORLDMAMMALS;TAX_WORLDMAMMALS_HUMAN;TAX_DISEASE_WOUNDS;WB_1921_PRIVATE_SECTOR_DEVELOPMENT;WB_405_BUSINESS_CLIMATE;WB_2531_INSPECTIONS_LICENSING_AND_PERMITS;WB_2530_BUSINESS_ENVIRONMENT;TAX_FNCACT_JUDGE;,,,,-0.191204588910134,srclc:ita;eng:GT-ITA 1.0,"Essere donna non è una condizione da gestire, ma una storia che si scrive nel corpo, giorno dopo giorno. Una storia fatta di trasformazioni, cicli, passaggi delicati e potenti insieme: fertilità, gravidanza, allattamento, infertilità, menopausa, malattia. Eppure, troppo spesso, il corpo femminile viene trattato come un meccanismo da aggiustare, da riportare in norma, da far funzionare.
Da questa consapevolezza nasce “Nutrire il Corpo. Abitare la Donna”, l’incontro in programma venerdì 13 febbraio 2026, dalle 20.30, presso il salone di San Zeno alla Zai (1° piano), in via Righi 2 a Verona. Una serata dedicata all’alimentazione, ai cicli di vita e alla salute femminile, che propone un cambiamento di sguardo: dal controllo all’ascolto, dalla prestazione alla cura.
«Il corpo non è un insieme di funzioni da correggere, ma una storia che chiede di essere ascoltata. L’alimentazione diventa cura quando sa stare dentro questa storia.» Non uno slogan, ma il cuore dell’iniziativa.
Per una donna, il rapporto con il cibo non è mai neutro. È intrecciato all’identità, all’immagine di sé, alle aspettative, alla storia personale. È relazione. È memoria. È spesso anche colpa. La serata nasce dalla necessità di liberare la nutrizione da una logica giudicante, che aggiunge pressione a corpi già sotto stress, e di restituirle la sua funzione più autentica: essere alleata della vita che una persona sta attraversando.
Condizioni come l’endometriosi, la sindrome dell’ovaio policistico, gli squilibri ormonali o le alterazioni del microbiota non chiedono soltanto indicazioni alimentari corrette. Chiedono tempo, continuità, fiducia, alleanza. E chiedono anche di smontare alcune false credenze molto diffuse: che mangiando “bene” si guarisca automaticamente, che stare male sia una colpa personale, che il proprio corpo sia sbagliato. La nutrizione, quando è davvero curante, non promette soluzioni rapide, ma restituisce possibilità.
A guidare la serata sarà Eliana Amato, biologa nutrizionista ed esperta in naturopatia olistica, ospite esterna dell’incontro. Il suo intervento intreccerà nutrizione, salute femminile e vissuto personale, affrontando le diverse fasi della vita della donna, le patologie più diffuse, il ruolo del microbiota, l’integrazione e i limiti delle risposte “veloci” che spesso semplificano eccessivamente esperienze complesse.
Il programma della serata prevede un tempo iniziale di accoglienza, per entrare nel clima dell’incontro, seguito dall’intervento tematico e da uno spazio di risonanza e condivisione, in cui dare parola alle domande, ai vissuti e alle esperienze legate al rapporto con il corpo e il cibo. La conclusione lascerà spazio al confronto diretto con l’ospite.
Al centro della proposta c’è una visione profondamente umana: il corpo femminile non è un ostacolo al percorso di vita, ma parte integrante della sua vocazione. Le diverse stagioni biologiche non interrompono l’identità, ma la trasformano e la approfondiscono. Rileggere la propria storia corporea, anche nei limiti e nelle ferite, permette di riconoscere un filo unitario che non è quello della performance, ma quello della cura nel tempo.
“Nutrire il Corpo. Abitare la Donna” è un invito rivolto a chi sente il bisogno di un linguaggio nuovo sulla salute femminile, capace di accompagnare senza giudicare e di sostenere senza correggere. Perché quando il corpo viene davvero ascoltato, non chiede perfezione, chiede presenza."
20260213210000,nuovosud.it,https://www.nuovosud.it/articoli/304708-cronaca-ragusa/ragusa-piove-allospedale-giovanni-paolo-ii-lallarme-del-sindacato,GENERAL_HEALTH;MEDICAL;SOC_POINTSOFINTEREST;SOC_POINTSOFINTEREST_HOSPITAL;CRISISLEX_C03_WELLBEING_HEALTH;WB_137_WATER;UNGP_FORESTS_RIVERS_OCEANS;TAX_DISEASE;TAX_DISEASE_EMERGENCIES;EPU_ECONOMY_HISTORIC;TAX_FNCACT;TAX_FNCACT_MIDWIFE;WB_641_REPRODUCTIVE_AND_MATERNAL_HEALTH;WB_621_HEALTH_NUTRITION_AND_POPULATION;WB_639_REPRODUCTIVE_MATERNAL_AND_CHILD_HEALTH;WB_1455_MIDWIVES;TAX_FNCACT_SECRETARY;WB_2024_ANTI_CORRUPTION_AUTHORITIES;WB_696_PUBLIC_SECTOR_MANAGEMENT;WB_831_GOVERNANCE;WB_832_ANTI_CORRUPTION;WB_2026_PREVENTION;USPEC_POLICY1;TAX_DISEASE_INFERTILITY;,,joseph savage;john paul,,-3.94088669950739,srclc:ita;eng:GT-ITA 1.0,"Ragusa, piove all'ospedale Giovanni Paolo II: l'allarme del sindacato Nursind
Ancora infiltrazioni d’acqua piovana all’ospedale Giovanni Paolo II di Ragusa e scatta la chiusura dei locali dove si trovano le sale operatorie del blocco parto e il corridoio dove si svolgono le attività ambulatoriali di otorinosenologia, ginecologia e ortopedia. Il sindacato Nursind spiega che “per fortuna la riapertura è avvenuta nel giro di 24 ore, ma quanto accaduto, oltre a generare disagi organizzativi, solleva importanti questioni legate alla manutenzione delle strutture ospedaliere e alla gestione delle emergenze tecniche in ambito sanitario. Il trasferimento dell’attività operatoria ostetrica in una delle sale operatorie chirurgiche – prosegue il segretario territoriale del Nursind, Giuseppe Savasta – comporta inevitabili ripercussioni sull’organizzazione ospedaliera. Gli interventi programmati vengono ripianificati, con possibili allungamenti delle liste d’attesa. Eppure anche se come sindacato avevamo già lanciato l’allarme qualche settimana fa, sulle grosse problematiche strutturali dei vari presidi ospedalieri, non riscontriamo a tutt’oggi alcuna attività di prevenzione da parte della Direzione generale. Le normative vigenti in materia di sicurezza sanitaria impongono standard rigorosi per le sale operatorie, in termini di sterilità, controllo dell’aria e integrità strutturale. Anche una semplice infiltrazione può alterare tali parametri, rendendo obbligatoria la sospensione dell’attività fino al completo ripristino delle condizioni previste”."
