date_str,source,url,themes,locations,persons,organizations,tone,translation_info,full_text
20260218083000,zazoom.it,https://www.zazoom.it/2026-02-18/decreto-flussi-click-day-per-13-600-lavoratori-domestici/18676856/,TAX_FNCACT;TAX_FNCACT_WORKERS;MEDIA_MSM;EPU_ECONOMY_HISTORIC;TAX_FNCACT_EMPLOYERS;WB_2690_CATEGORIES_OF_EMPLOYMENT;WB_2670_JOBS;WB_2689_JOBS_DIAGNOSTICS;WB_2704_EMPLOYER;TAX_FNCACT_CANDIDATE;TAX_FNCACT_CAREGIVERS;SOC_AGINGPOPULATION;WB_621_HEALTH_NUTRITION_AND_POPULATION;WB_1448_DEMOGRAPHIC_CHANGE;WB_643_AGING_POPULATION;ECON_UNIONS;USPEC_POLICY1;EPU_ECONOMY;TOURISM;WB_825_TOURISM;WB_1921_PRIVATE_SECTOR_DEVELOPMENT;WB_346_COMPETITIVE_INDUSTRIES;WB_818_INDUSTRY_POLICY_AND_REAL_SECTORS;WB_135_TRANSPORT;WB_1801_ROAD_TRANSPORT;WB_164_MODES_OF_TRANSPORT;GENERAL_GOVERNMENT;RECRUITMENT;,1#Italy#IT#IT#42.833333#12.833333#IT,,ministry the,0.91324200913242,srclc:ita;eng:GT-ITA 1.0,"Decreto flussi click day per 13.600 lavoratori domestici
Il decreto flussi ha portato all’apertura del click day per 13.600 lavoratori domestici, un’opportunità che interessa un settore da 17 miliardi di euro. Oggi, 18 febbraio 2026, i datori di lavoro possono candidarsi online per assumere colf e badanti, in una gara che si preannuncia intensa. La piattaforma resterà attiva fino a esaurimento delle quote, e questa misura mira a regolare l’ingresso di lavoratori stranieri in modo più rapido ed efficace.
Click Day per 13.600 Colf: Un Settore da 17 Miliardi alla Ricerca di Stabilità. Oggi, 18 febbraio 2026, apre la finestra online per l’assunzione di 13.600 lavoratori domestici stranieri in Italia. L’iniziativa, parte di un piano triennale, mira a rispondere alla crescente domanda di assistenza familiare in un Paese caratterizzato da un invecchiamento della popolazione e da una spesa per il lavoro di cura stimata a 17 miliardi di euro nel 2024. Tuttavia, associazioni di categoria e sindacati sottolineano come questa procedura, pur necessaria, non sia sufficiente a risolvere le problematiche strutturali di un settore cruciale per l’economia nazionale.🔗 Leggi su Ameve.eu
Decreto flussi, click day per 13.600 lavoratori domestici: il settore vale 17 miliardiIl decreto flussi ha aperto oggi il click day per 13.
Decreto Flussi 2026, parte il click day per i lavoratori subordinati non stagionali: ecco come inviare le domandeOggi inizia il click day per i lavoratori subordinati non stagionali, dopo che il Ministero ha aperto ufficialmente le iscrizioni per il 2026.
Leggi altri contenuti disponibili per approfondire la notizia o scorri a sinistra ← per la prossima news.Argomenti discussi: Decreto Flussi 2026, oggi click day per i lavoratori stagionali del turismo: come fare; Colf e badanti, click day 2026 il 18 febbraio: 13.600 posti disponibili ma ci sono 49.000 domande già pre-caricate, come funziona; Lavoratori domestici stranieri: 18 febbraio ultimo click day del 2026; Decreto Flussi 2026: il 16 febbraio è il click day per l’autotrasporto.
Decreto Flussi 2026, oggi click day per colf e badanti: come fareCome stabilito nel provvedimento approvato dal Parlamento lo scorso novembre, quest'anno è previsto l'ingresso di 13.600 lavoratori subordinati non stagionali nell’ambito dell’assistenza familiare, ch ... tg24.sky.it
Decreto flussi, click day per 13.600 lavoratori domestici: il settore vale 17 miliardiParte il piano triennale del decreto flussi per il lavoro domestico. Savia: La regolarità è un pilastro per l’economia della cura. Ecco come ... quifinanza.it
Click day 18 febbraio per assunzione di colf e badanti extra-UE secondo le quote del Decreto Flussi 2026. Procedura, lavoratori ammessi e istruzioni di domanda. facebook
Scatta il 18 febbraio il click day per il lavoro non stagionale, compresa l'assunzione di colf e badanti. Per questi ultimi le quote previste dal decreto Flussi 13.000 - Leggi e prassi / Pubblico, Ministero degli Interni x.com"
20260218060000,zazoom.it,https://www.zazoom.it/2026-02-18/senza-sanita-integrativa-7-milioni-di-visite-in-piu-allanno-per-il-ssn/18676524/,GENERAL_HEALTH;MEDICAL;MEDIA_MSM;WB_1305_HEALTH_SERVICES_DELIVERY;WB_621_HEALTH_NUTRITION_AND_POPULATION;CRISISLEX_C03_WELLBEING_HEALTH;TAX_FNCACT;TAX_FNCACT_SPECIALIST;WB_2024_ANTI_CORRUPTION_AUTHORITIES;WB_696_PUBLIC_SECTOR_MANAGEMENT;WB_840_JUSTICE;WB_2025_INVESTIGATION;WB_831_GOVERNANCE;WB_832_ANTI_CORRUPTION;WB_1014_CRIMINAL_JUSTICE;WB_2026_PREVENTION;SOC_AGINGPOPULATION;WB_1448_DEMOGRAPHIC_CHANGE;WB_643_AGING_POPULATION;UNGP_FORESTS_RIVERS_OCEANS;EDUCATION;SOC_POINTSOFINTEREST;SOC_POINTSOFINTEREST_SCHOOL;WB_1614_NUTRITIONAL_PROGRAMS;WB_1609_FOOD_AND_IN_KIND_TRANSFERS;WB_1616_SUPPLEMENTARY;WB_1466_SOCIAL_ASSISTANCE;WB_697_SOCIAL_PROTECTION_AND_LABOR;WB_1973_FINANCIAL_RISK_REDUCTION;WB_435_AGRICULTURE_AND_FOOD_SECURITY;WB_337_INSURANCE;WB_1967_AGRICULTURAL_RISK_AND_SECURITY;EPU_ECONOMY_HISTORIC;TAX_FNCACT_DOCTOR;USPEC_POLICY1;EPU_ECONOMY;TRANSPARENCY;TAX_DISEASE;TAX_DISEASE_FATIGUE;CRISISLEX_CRISISLEXREC;,,joseph bell,contract collective national supplementary;a new negotiable health;health system;health service,4.375,srclc:ita;eng:GT-ITA 1.0,"Senza sanità integrativa 7 milioni di visite in più all’anno per il Ssn
Ogni anno, senza la sanità integrativa, il Sistema sanitario nazionale dovrebbe gestire circa sette milioni di visite mediche, esami e prestazioni specialistiche in più. Questa situazione si tradurrebbe in un carico maggiore per le strutture pubbliche, che già affrontano lunghe liste d’attesa. Un esempio concreto è il caso di molte cliniche private che offrono servizi di diagnostica avanzata, riducendo così la pressione sui reparti pubblici.
Senza la sanità integrativa, 7 milioni di visite, accertamenti e prestazioni di alta diagnostica ricadrebbero ogni anno sul Servizio sanitario nazionale. Un dato significativo che sarà al centro della tavola rotonda promossa da Casagit Salute e Pmi Salute, ‘La psicologia dell’invecchiamento tra clinica, prevenzione e qualità della vita’. L’evento – previsto per il 23 febbraio alle 11 – sarà ospitato dalla sede romana di Casagit Salute. L’incontro nasce per affrontare una delle sfide decisive dei prossimi decenni: l’invecchiamento della popolazione e l a sostenibilità del sistema di welfare sanitario. 🔗 Leggi su Lapresse.it
L'allarme di Gioffré e Campana sulla sanità: ""Tra un anno Calabria senza più servizio pubblico""Un allarme preoccupante sulla sanità calabrese emerge dalle parole di Santo Gioffré e Giuseppe Campana, che denunciano un progressivo impoverimento dei servizi pubblici.
Sanità integrativa per il personale scolastico: firmato il CCNI definitivo, ma resta l’incognita sui tempiÈ stato firmato il Contratto Collettivo Nazionale Integrativo (CCNI) che prevede l’introduzione di un’assicurazione sanitaria integrativa per il personale scolastico.
Leggi altri contenuti disponibili per approfondire la notizia o scorri a sinistra ← per la prossima news.Argomenti discussi: Senza sanità integrativa 7 milioni di visite in più all’anno per il Ssn; Assicurazione sanitaria per il personale scolastico, avviate le procedure. Ecco per cosa si potrà usare e per cosa non si potrà usare. Elenco completo; Ccnl Carta industria. Rinnovo; Serenis Medicina: un medico a disposizione per 24/7 365 giorni l’anno.
Senza sanità integrativa 7 milioni di visite in più all’anno per il SsnIl 23 febbraio l’evento che analizzerà il contributo della sanità integrativa alla tenuta del Ssn. lapresse.it
Sanità integrativa ed economia sociale: è il tempo della responsabilità condivisaIl Secondo pilastro vale tra i 4,5 e i 5 miliardi di euro annui: una massa critica che impone regole, trasparenza e responsabilità nella costruzione insieme al servizio sanitario pubblico di un sist ... ilsole24ore.com
Mobilità nel SSN: regole più chiare, tempi certi. Il nuovo CCNL Sanità 2022–2024 rafforza trasparenza e tutele per chi chiede il trasferimento tra Aziende ed Enti. Bandi annuali obbligatori Nessun nuovo periodo di prova Priorità per esigenze famili facebook
“Spesa sanitaria stabile sul Pil, ma il #Ssn fatica a recuperare”, l’allarme della Corte dei conti quotidianosanita.it/studi-e-analis… x.com"
20260218024500,padovanews.it,https://www.padovanews.it/2026/02/18/biroccio-gsk-italia-rafforzare-immunizzazione-anti-rsv-in-adulti-e-priorita/,HEALTH_VACCINATION;WB_642_CHILD_HEALTH;WB_1459_IMMUNIZATIONS;WB_621_HEALTH_NUTRITION_AND_POPULATION;WB_639_REPRODUCTIVE_MATERNAL_AND_CHILD_HEALTH;UNGP_HEALTHCARE;GENERAL_HEALTH;MEDICAL;UNGP_FORESTS_RIVERS_OCEANS;WB_137_WATER;WATER_SECURITY;UNGP_CLEAN_WATER_SANITATION;TAX_FNCACT;TAX_FNCACT_CHILDREN;WB_1609_FOOD_AND_IN_KIND_TRANSFERS;WB_1620_ELDERLY;WB_1466_SOCIAL_ASSISTANCE;WB_1618_FOOD_DISTRIBUTION;WB_697_SOCIAL_PROTECTION_AND_LABOR;SOC_AGINGPOPULATION;WB_1448_DEMOGRAPHIC_CHANGE;WB_643_AGING_POPULATION;WB_2432_FRAGILITY_CONFLICT_AND_VIOLENCE;WB_1305_HEALTH_SERVICES_DELIVERY;GENERAL_GOVERNMENT;USPEC_POLITICS_GENERAL1;EPU_POLICY;EPU_POLICY_CONGRESS;WB_2024_ANTI_CORRUPTION_AUTHORITIES;WB_696_PUBLIC_SECTOR_MANAGEMENT;WB_831_GOVERNANCE;WB_832_ANTI_CORRUPTION;WB_2026_PREVENTION;EPU_CATS_MIGRATION_FEAR_FEAR;KILL;CRISISLEX_C03_WELLBEING_HEALTH;TAX_DISEASE;TAX_DISEASE_ASTHMA;TAX_CHRONICDISEASE;TAX_CHRONICDISEASE_ASTHMA;,"4#Rome, Lazio, Italy#IT#IT07#41.9#12.4833#-126693;1#Italy#IT#IT#42.833333#12.833333#IT",,health service;reuters,0.316455696202532,srclc:ita;eng:GT-ITA 1.0,
20260217080000,askanews.it,https://askanews.it/2026/02/17/cina-nello-show-tv-di-capodanno-protagonisti-i-robot-umanoidi/,MEDIA_MSM;TAX_ETHNICITY;TAX_ETHNICITY_CHINESE;TAX_WORLDLANGUAGES;TAX_WORLDLANGUAGES_CHINESE;EPU_ECONOMY_HISTORIC;KILL;TAX_FNCACT;TAX_FNCACT_CHILDREN;MOVEMENT_GENERAL;PROTEST;TAX_FNCACT_COMEDIAN;TAX_WORLDMAMMALS;TAX_WORLDMAMMALS_HUMAN;TAX_FNCACT_ASSISTANT;WB_2670_JOBS;WB_2769_JOBS_STRATEGIES;WB_2840_INTEGRATION;WB_2836_MIGRATION_POLICIES_AND_JOBS;MANMADE_DISASTER_IMPLIED;ECON_STOCKMARKET;GEN_HOLIDAY;SOC_AGINGPOPULATION;WB_621_HEALTH_NUTRITION_AND_POPULATION;WB_1448_DEMOGRAPHIC_CHANGE;WB_643_AGING_POPULATION;,"1#China#CH#CH#35#105#CH;4#Rome, Lazio, Italy#IT#IT07#41.9#12.4833#-126693;4#Beijing, Beijing, China#CH#CH22#39.9289#116.388#-1898541",,,5.5045871559633,srclc:ita;eng:GT-ITA 1.0,"Roma, 17 feb. (askanews) – Uno spettacolo impressionante: il Gala della Festa di Primavera della televisione di Stato cinese CCTV, lo show più seguito dell’anno nel Paese che celebra l’inizio del nuovo anno lunare, ha avuto come protagonisti abilissimi robot umanoidi potenziati con l’intelligenza artificiale, dando fiato alle ambizioni tecnologiche della Cina e mostrando al mondo una progressione fortissima in questo settore da parte di Pechino.
Durante il gala sono stati presentati i robot di punta di alcuni dei campioni nazionali nel settore dei robot umanoidi. Tra questi Unitree, Noetix e Galbot.
La vetrina è stata la migliore: lo show è seguito da centinaia di milioni di spettatori ed è il principale spettacolo della televisione nazionale, oggi moltiplicato anche dalla seguente diffusione sui social di spezzoni e brani dello spettacolo.
I primi sketch del programma hanno avuto come protagonisti i robot umanoidi: oltre una dozzina di macchine Unitree ha eseguito sequenze di arti marziali con spade e bastoni accanto a bambini, includendo movimenti complessi e dimostrando capacità di coordinamento e di recupero dopo cadute.
In un altro segmento, quattro robot Noetix hanno recitato in uno sketch comico con attori umani, mentre i robot MagicLab hanno danzato sincronizzati durante la canzone “We Are Made in China”.
Lo spettacolo ha inoltre mostrato l’assistente di intelligenza artificiale Doubao di ByteDance, sottolineando l’integrazione tra robotica e software avanzato nella strategia industriale cinese.
La forte attenzione verso i robot umanoidi coincide con i piani di quotazione in borsa di diversi produttori, tra cui Unitree e AgiBot, e con l’accelerazione degli investimenti in intelligenza artificiale durante le festività del capodanno lunare.
Pechino punta sulla robotica e sull’automazione per sostenere la produttività in un contesto di rapido invecchiamento della popolazione. Secondo stime del settore, la Cina ha rappresentato circa il 90% dei 13mila robot umanoidi consegnati globalmente lo scorso anno, con vendite previste in forte aumento nel 2026."
20260217203000,notizie.tiscali.it,https://notizie.tiscali.it/salute/articoli/biroccio-gsk-italia-rafforzare-immunizzazione-anti-rsv-in-adulti-a-priorita-00002/,HEALTH_VACCINATION;WB_642_CHILD_HEALTH;WB_1459_IMMUNIZATIONS;WB_621_HEALTH_NUTRITION_AND_POPULATION;WB_639_REPRODUCTIVE_MATERNAL_AND_CHILD_HEALTH;UNGP_HEALTHCARE;GENERAL_HEALTH;MEDICAL;UNGP_FORESTS_RIVERS_OCEANS;WB_137_WATER;WATER_SECURITY;UNGP_CLEAN_WATER_SANITATION;TAX_FNCACT;TAX_FNCACT_CHILDREN;WB_1609_FOOD_AND_IN_KIND_TRANSFERS;WB_1620_ELDERLY;WB_1466_SOCIAL_ASSISTANCE;WB_1618_FOOD_DISTRIBUTION;WB_697_SOCIAL_PROTECTION_AND_LABOR;SOC_AGINGPOPULATION;WB_1448_DEMOGRAPHIC_CHANGE;WB_643_AGING_POPULATION;WB_2432_FRAGILITY_CONFLICT_AND_VIOLENCE;WB_1305_HEALTH_SERVICES_DELIVERY;GENERAL_GOVERNMENT;USPEC_POLITICS_GENERAL1;EPU_POLICY;EPU_POLICY_CONGRESS;WB_2024_ANTI_CORRUPTION_AUTHORITIES;WB_696_PUBLIC_SECTOR_MANAGEMENT;WB_831_GOVERNANCE;WB_832_ANTI_CORRUPTION;WB_2026_PREVENTION;EPU_CATS_MIGRATION_FEAR_FEAR;KILL;CRISISLEX_C03_WELLBEING_HEALTH;TAX_DISEASE;TAX_DISEASE_ASTHMA;TAX_CHRONICDISEASE;TAX_CHRONICDISEASE_ASTHMA;,"1#Italy#IT#IT#42.833333#12.833333#IT;4#Rome, Lazio, Italy#IT#IT07#41.9#12.4833#-126693",,reuters health;health service,0.314465408805032,srclc:ita;eng:GT-ITA 1.0,
20260217203000,ilcittadinoonline.it,https://www.ilcittadinoonline.it/cronaca/provincia/longevita-benessere-e-cultura-se-ne-parla-a-san-gimignano/,APPOINTMENT;SCIENCE;WB_621_HEALTH_NUTRITION_AND_POPULATION;WB_1448_DEMOGRAPHIC_CHANGE;WB_643_AGING_POPULATION;GENERAL_HEALTH;MEDICAL;LEGISLATION;EPU_POLICY;EPU_POLICY_LAW;USPEC_POLICY1;TAX_FNCACT;TAX_FNCACT_SCHOLARS;TAX_FNCACT_REPRESENTATIVES;EPU_ECONOMY_HISTORIC;EDUCATION;TAX_FNCACT_PROFESSOR;SOC_POINTSOFINTEREST;SOC_POINTSOFINTEREST_UNIVERSITY;CRISISLEX_C07_SAFETY;SOC_AGINGPOPULATION;TAX_WORLDBIRDS;TAX_WORLDBIRDS_WARBLER;TAX_FNCACT_COORDINATOR;TAX_RELIGION;TAX_RELIGION_CATHOLIC;TAX_FNCACT_EPIDEMIOLOGIST;TAX_DISEASE;TAX_DISEASE_ALZHEIMERS;TAX_CHRONICDISEASE;TAX_CHRONICDISEASE_ALZHEIMERS;TAX_FNCACT_MANAGER;TAX_FNCACT_GENERAL_MANAGER;TAX_FNCACT_DIRECTOR;SOC_POINTSOFINTEREST_UNIVERSITIES;,"4#Milan, Lombardia, Italy#IT#IT09#45.4667#9.2#-121726;1#Italy#IT#IT#42.833333#12.833333#IT",,foundation museums siena;university of florence;university catholic;welfare center;foundation palace throttle;a center historical of gimignano;foundation cash;foundation territories;university of turin;museum of holy clear,0,srclc:ita;eng:GT-ITA 1.0,"Appuntamento venerdì 20 febbraio dalle ore 9 presso il Complesso museale di Santa Chiara con il convegno che unirà scienza e welfare culturale
SAN GIMIGNANO. Il rapporto fra scienza e welfare culturale per riflettere sulla longevità come una sfida culturale, sociale e collettiva che va oltre la questione biologica. Sarà questo il tema al centro del convegno “Scienza e Cultura. Vivere a lungo e in salute”, in programma venerdì 20 febbraio a San Gimignano, presso il Complesso museale di Santa Chiara, organizzato da Fondazione Musei Senesi insieme al Comune e ai Musei Civici di San Gimignano gestiti da Opera Laboratori. L’appuntamento si inserisce nel progetto “Conosco, Partecipo e Interpreto il Centro Storico di San Gimignano, Sito del Patrimonio Mondiale” finanziato nell’ambito della Legge 77/2006 dedicata ai siti Unesco, è realizzato in collaborazione con Fondazione Cassa Depositi e Prestiti e conta sul patrocinio di ICOM (International Council of Museum) Italia e ICOM Toscana.
Il programma e le voci dell’iniziativa. Il convegno prenderà il via alle ore 9 e proporrà una giornata di confronto fra ricerca scientifica, musei e politiche culturali per ripensare l’invecchiamento come risorsa e opportunità di benessere attraverso gli interventi di studiosi e studiose di rilievo internazionale, rappresentanti delle istituzioni e professionisti del settore culturale, scientifico e sociologico.
Dopo i saluti istituzionali della Regione Toscana, con l’assessora alla cultura Cristina Manetti, e del Comune di San Gimignano, con il sindaco Andrea Marrucci, il convegno entrerà nel vivo con Daniele Vignoli, professore ordinario di Demografia presso l’Università di Firenze che proporrà una lettura positiva e non allarmistica dell’invecchiamento della popolazione, e Laura Fratiglioni, Aging Research Center Karolinska Institutet, punto di riferimento mondiale per gli studi sull’invecchiamento attivo e in salute. Il ruolo dei musei e dei patrimoni culturali come strumenti di cura e benessere saranno invece i temi dell’intervento di Silvia Mascheroni, coordinatrice del gruppo di lavoro “Welfare culturale” ICOM Italia presso l’Università Cattolica di Milano. A chiudere la mattina sarà una tavola rotonda sulle buone pratiche e prospettive per il welfare culturale moderata da Carolina Taddei, coordinatrice della Fondazione Musei Senesi, con la partecipazione di Irene Balzani, gruppo di lavoro accessibilità ICOM Italia per la Fondazione Palazzo Strozzi; Giuseppe Costa, epidemiologo dell’Università di Torino e socio CCW, Cultural Welfare Centre; Cristina Bucci, del Sistema Musei Toscani per l’Alzheimer; Nicoletta Baracchini, direttore generale FTSA, Fondazione Territori Sociali Altavaldelsa; Marzia Pianigiani, per la Fondazione Musei Senesi, ed Elena Pianea, direttrice Beni, Istituzioni, Attività culturali della Regione Toscana.
Il convegno riprenderà alle ore 15 con l’intervento di Pierluigi Sacco, Università di Chieti-Pescara e CCW, Cultural Welfare Centre, che farà il punto sul rapporto attuale fra welfare culturale e politiche pubbliche. A seguire, sarà la volta di ‘Meet the expert’, con incontri per piccoli gruppi fra partecipanti e relatori previa registrazione sul sito di Fondazione Musei Senesi, e di un workshop creativo con attività per adulti sul tema UNESCO prima di lasciare spazio a interventi dal pubblico e conclusioni."
20260217203000,ilfattonisseno.it,https://www.ilfattonisseno.it/2026/02/biroccio-gsk-italia-rafforzare-immunizzazione-anti-rsv-in-adulti-e-priorita/,HEALTH_VACCINATION;WB_642_CHILD_HEALTH;WB_1459_IMMUNIZATIONS;WB_621_HEALTH_NUTRITION_AND_POPULATION;WB_639_REPRODUCTIVE_MATERNAL_AND_CHILD_HEALTH;UNGP_HEALTHCARE;GENERAL_HEALTH;MEDICAL;UNGP_FORESTS_RIVERS_OCEANS;WB_137_WATER;WATER_SECURITY;UNGP_CLEAN_WATER_SANITATION;TAX_FNCACT;TAX_FNCACT_CHILDREN;WB_1609_FOOD_AND_IN_KIND_TRANSFERS;WB_1620_ELDERLY;WB_1466_SOCIAL_ASSISTANCE;WB_1618_FOOD_DISTRIBUTION;WB_697_SOCIAL_PROTECTION_AND_LABOR;SOC_AGINGPOPULATION;WB_1448_DEMOGRAPHIC_CHANGE;WB_643_AGING_POPULATION;WB_2432_FRAGILITY_CONFLICT_AND_VIOLENCE;WB_1305_HEALTH_SERVICES_DELIVERY;GENERAL_GOVERNMENT;USPEC_POLITICS_GENERAL1;EPU_POLICY;EPU_POLICY_CONGRESS;WB_2024_ANTI_CORRUPTION_AUTHORITIES;WB_696_PUBLIC_SECTOR_MANAGEMENT;WB_831_GOVERNANCE;WB_832_ANTI_CORRUPTION;WB_2026_PREVENTION;EPU_CATS_MIGRATION_FEAR_FEAR;KILL;CRISISLEX_C03_WELLBEING_HEALTH;TAX_DISEASE;TAX_DISEASE_ASTHMA;TAX_CHRONICDISEASE;TAX_CHRONICDISEASE_ASTHMA;,"4#Rome, Lazio, Italy#IT#IT07#41.9#12.4833#-126693;1#Italy#IT#IT#42.833333#12.833333#IT",,health service;reuters,0,srclc:ita;eng:GT-ITA 1.0,"(Adnkronos) – ""La vaccinazione è uno degli strumenti di sanità pubblica più importanti di sempre, seconda solo all’acqua potabile per impatto sulla popolazione. In cinquant’anni ha salvato circa 150 milioni di vite. Dopo aver consolidato la protezione nei bambini, oggi la priorità si sposta sugli adulti e sugli anziani, perché la popolazione invecchia e le fragilità pesano sempre di più sul Servizio sanitario nazionale"". Lo ha dichiarato Antonino Biroccio, General Manager Gsk Italia, in occasione del congresso internazionale sull’Rsv, Resvinet, che si è tenuto a Roma. In questo contesto, l'azienda bio-farmaceutica Gsk, ha presentato alla comunità scientifica nuovi studi e nuovi dati che confermano il valore della prevenzione tramite il vaccino contro l’Rsv nell’adulto e nei fragili sia dal punto di vista clinico, che dal punto di vista socio-economico. ""Il vaccino contro l’Rsv – ha aggiunto Biroccio – si inserisce proprio in questa logica di maggiore tutela per anziani, persone con comorbidità e adulti che devono restare in salute. Tuttavia, in Italia la vaccinazione anti-Rsv non è ancora inserita nel calendario nazionale: questo è un elemento di preoccupazione, perché dovrebbe far parte del pacchetto di protezione dell’adulto fragile"". “Esistono dati solidi sull’impatto clinico: il vaccino Gsk contro l’Rsv mostra una riduzione delle ospedalizzazioni tra il 70% e l’85%. Considerando che ogni anno si registrano centinaia di migliaia di casi e 1.800 decessi correlati al virus, è evidente la necessità di un intervento strutturale. Inoltre, studi presentati al congresso evidenziano una riduzione di eventi cardiovascolari maggiori nei vaccinati e una diminuzione del rischio di riacutizzazioni del 74% nei pazienti con Bpco e del 61% in quelli con asma"". L’impatto di questa vaccinazione è anche socioeconomico: ""Investire un euro in vaccinazione può generare fino a tre euro di risparmio se si vaccinassero tutti gli over 75, e fino a otto euro nella fascia 60-74 anni ancora attiva. Quindi on è solo un beneficio clinico per il paziente, ma anche un vantaggio concreto per lo Stato"" ha concluso Biroccio.
—salutewebinfo@adnkronos.com (Web Info)
Biroccio (Gsk Italia): “Rafforzare immunizzazione anti-Rsv in adulti è priorità”
Mar, 17/02/2026 - 19:56
Condividi su:"
20260217194500,cn24tv.it,https://cn24tv.it/biroccio-gsk-italia-rafforzare-immunizzazione-anti-rsv-in-adulti-e-priorita/,HEALTH_VACCINATION;WB_642_CHILD_HEALTH;WB_1459_IMMUNIZATIONS;WB_621_HEALTH_NUTRITION_AND_POPULATION;WB_639_REPRODUCTIVE_MATERNAL_AND_CHILD_HEALTH;UNGP_HEALTHCARE;GENERAL_HEALTH;MEDICAL;UNGP_FORESTS_RIVERS_OCEANS;WB_137_WATER;WATER_SECURITY;UNGP_CLEAN_WATER_SANITATION;TAX_FNCACT;TAX_FNCACT_CHILDREN;WB_1609_FOOD_AND_IN_KIND_TRANSFERS;WB_1620_ELDERLY;WB_1466_SOCIAL_ASSISTANCE;WB_1618_FOOD_DISTRIBUTION;WB_697_SOCIAL_PROTECTION_AND_LABOR;SOC_AGINGPOPULATION;WB_1448_DEMOGRAPHIC_CHANGE;WB_643_AGING_POPULATION;WB_2432_FRAGILITY_CONFLICT_AND_VIOLENCE;WB_1305_HEALTH_SERVICES_DELIVERY;GENERAL_GOVERNMENT;USPEC_POLITICS_GENERAL1;EPU_POLICY;EPU_POLICY_CONGRESS;WB_2024_ANTI_CORRUPTION_AUTHORITIES;WB_696_PUBLIC_SECTOR_MANAGEMENT;WB_831_GOVERNANCE;WB_832_ANTI_CORRUPTION;WB_2026_PREVENTION;EPU_CATS_MIGRATION_FEAR_FEAR;KILL;CRISISLEX_C03_WELLBEING_HEALTH;TAX_DISEASE;TAX_DISEASE_ASTHMA;TAX_CHRONICDISEASE;TAX_CHRONICDISEASE_ASTHMA;,"4#Rome, Lazio, Italy#IT#IT07#41.9#12.4833#-126693;1#Italy#IT#IT#42.833333#12.833333#IT",,health service;reuters,0.314465408805032,srclc:ita;eng:GT-ITA 1.0,
