date_str,source,url,themes,locations,persons,organizations,tone,translation_info,full_text
20260217121500,cittametropolitana.fi.it,http://met.cittametropolitana.fi.it/news.aspx?n=397904,CRIME_ILLEGAL_DRUGS;UNGP_FORESTS_RIVERS_OCEANS;GENERAL_HEALTH;MEDICAL;USPEC_POLITICS_GENERAL1;APPOINTMENT;TAX_WORLDLANGUAGES;TAX_WORLDLANGUAGES_FARSI;MOVEMENT_GENERAL;MEDIA_MSM;POLITICAL_TURMOIL;WB_678_DIGITAL_GOVERNMENT;WB_694_BROADCAST_AND_MEDIA;WB_133_INFORMATION_AND_COMMUNICATION_TECHNOLOGIES;WB_2024_ANTI_CORRUPTION_AUTHORITIES;WB_696_PUBLIC_SECTOR_MANAGEMENT;WB_831_GOVERNANCE;WB_832_ANTI_CORRUPTION;WB_2026_PREVENTION;LEADER;TAX_FNCACT;TAX_FNCACT_MAYOR;SOC_AGINGPOPULATION;WB_621_HEALTH_NUTRITION_AND_POPULATION;WB_1448_DEMOGRAPHIC_CHANGE;WB_643_AGING_POPULATION;EDUCATION;SOC_POINTSOFINTEREST;SOC_POINTSOFINTEREST_UNIVERSITIES;,"1#Italy#IT#IT#42.833333#12.833333#IT;4#Valdarno, Toscana, Italy#IT#IT16#43.75#11.25#-131633",,committee of florence;health florence southeast,2.66990291262136,srclc:ita;eng:GT-ITA 1.0,"Prosegue a Pelago il percorso di SaluteDì – Giornate di promozione della salute per la terza età, il progetto promosso dal Comune di Pelago in collaborazione con UISP Comitato di Firenze – Delegazione Valdisieve e Società della Salute Fiorentina Sud Est, dedicato alla diffusione di stili di vita sani e alla promozione dell’invecchiamento attivo.
Il primo appuntamento del progetto è stato il laboratorio pratico-esperienziale “Come non farsi male da soli”, dedicato ai corretti movimenti nei gesti quotidiani e alla consapevolezza dei propri limiti fisici: un momento partecipato che ha segnato l’avvio di un percorso più ampio di iniziative rivolte al benessere della persona.
Il calendario entrerà nel vivo con l’arrivo della primavera, quando prenderanno il via le Passeggiate di Benessere, appuntamenti gratuiti all’aria aperta pensati per promuovere uno stile di vita attivo e offrire occasioni di incontro e partecipazione alla comunità.
L’importanza di percorsi come SaluteDì si inserisce in un contesto demografico nazionale in rapido cambiamento: secondo i dati più recenti, in Italia oltre il 24% della popolazione ha più di 65 anni, pari a oltre 14 milioni di persone, con una crescita significativa degli over 80 e un indice di invecchiamento particolarmente elevato anche nelle regioni del Centro-Nord e nei comuni di dimensioni medio-piccole. Un quadro che rende sempre più centrale la promozione di iniziative dedicate al benessere e alla prevenzione.
Le passeggiate, in programma sabato 28 marzo a Nipozzano, sabato 11 aprile a Ferrano e sabato 23 maggio a San Francesco, sono aperte a tutta la cittadinanza su iscrizione. Saranno percorsi accessibili pensati per favorire la più ampia partecipazione, con momenti di approfondimento dedicati al benessere e alla prevenzione.
«SaluteDì rappresenta un’opportunità concreta per costruire comunità attraverso il movimento e la condivisione, favorendo stili di vita sani e attivi – dichiara il Sindaco di Pelago Nicola Povoleri - In un momento storico in cui l’invecchiamento della popolazione è sempre più evidente, crediamo sia fondamentale costruire iniziative che mettano al centro le persone, promuovendo autonomia, relazioni e qualità della vita».
Il progetto si sviluppa grazie alla collaborazione con numerose realtà associative e sociali del territorio, tra cui Croce Azzurra di Pontassieve, Misericordia di Pontassieve, Anteas Valdisieve, Caritas Interparrocchiale di Pelago, Diacceto, Paterno, Ferrano, S. Francesco e Palaie, SPI CGIL Valdisieve, FNP CISL Pensionati Val di Sieve Valdarno, Auser Pontassieve, Sezione Soci Coop Valdisieve e LUVV – Libera Università Valdisieve e Valdarno, con l’obiettivo di diffondere una cultura della prevenzione attraverso iniziative gratuite, accessibili e diffuse nelle diverse frazioni del Comune.
Per partecipare è necessario compilare il modulo online disponibile al seguente link:
https://forms.gle/r7fypZ3KaQ9x2dFHA oppure contattando la Segreteria del Sindaco del Comune di Pelago al numero 055 8327363."
20260219073000,trevisotoday.it,https://www.trevisotoday.it/attualita/treviso-over-65-aumento-anziani-19-febbraio-2026.html,EDUCATION;TAX_FNCACT;TAX_FNCACT_PROFESSOR;TAX_FNCACT_COORDINATOR;WB_1609_FOOD_AND_IN_KIND_TRANSFERS;WB_1620_ELDERLY;WB_1466_SOCIAL_ASSISTANCE;WB_1618_FOOD_DISTRIBUTION;WB_697_SOCIAL_PROTECTION_AND_LABOR;SOC_AGINGPOPULATION;WB_621_HEALTH_NUTRITION_AND_POPULATION;WB_1448_DEMOGRAPHIC_CHANGE;WB_643_AGING_POPULATION;,"4#Veneto, Veneto, Italy#IT#IT20#45.6989#12.2256#109677;1#Italy#IT#IT#42.833333#12.833333#IT",,center studies administrative,-0.719424460431655,srclc:ita;eng:GT-ITA 1.0,"Inverno demografico e denatalità: «Nel 2030 gli Over 65 saranno il 28% della popolazione»
Le stime del Centro Studi Marca Trevigiana evidenziano il calo degli Under 14 (-1,5%) e della popolazione in età lavorativa (-2,2%). Crescono invece vecchiaia e indice di dipendenza. Della Pietra: «Serve una programmazione immediata»
La popolazione residente in provincia di Treviso è destinata a ridursi e invecchiare in modo significativo nei prossimi anni. A confermarlo oggi sono le previsioni demografiche elaborate dal portale ""MoMa - Monitor della Marca"" gestito dal Centro Studi Amministrativi per la visualizzazione di dati e analisi relativi ai comuni sulla base dei numeri Istat, riferiti in questo caso allo scenario più probabile al 2030. Gli indici delineano un quadro strutturale in profonda trasformazione, in linea con le tendenze regionali e nazionali.
I NUMERI
Il professor Daniele Marini, coordinatore scientifico del progetto Mo.Ma., sottolinea come le previsioni indichino da un lato un progressivo ridimensionamento della popolazione più giovane. La quota dei giovani Under 14 è destinata a diminuire in modo significativo entro il 2030: in Italia passerà dall’11,9% registrato nel 2024 al 10,7%, in Veneto scenderà dall’11,8% al 10,5%, mentre nella provincia di Treviso il calo sarà ancora più evidente, con una riduzione dal 12,2% al 10,7% (-1,5%). Parallelamente, si assisterà a una contrazione della popolazione in età lavorativa, compresa tra i 15 e i 64 anni. A livello nazionale questa fascia della popolazione passerà dal 63,4% del 2024 al 61,5% nel 2030; in Veneto dal 63,3% al 61,1%. Nella Marca dal 63,5% al 61,3% (-2,2%). Dall’altro lato, crescerà in modo marcato la popolazione anziana, con aumento dell’indice di vecchiaia. La quota degli Over 65 salirà in Italia dal 24,7% al 27,8%, in Veneto dal 24,9% al 28,4% e nella provincia di Treviso dal 24,3% al 28,0% entro il 2030. Il rapporto tra popolazione non attiva – giovani e anziani – e popolazione in età lavorativa crescerà in Italia dal 57,8% al 62,6%, in Veneto dal 57,9% al 63,6% e nella provincia di Treviso dal 57,4% al 63,1%, segnalando un carico sempre più rilevante sulla componente attiva della popolazione. Alla base di questo andamento si collocano principalmente il forte calo della natalità, il miglioramento delle condizioni di vita e della sopravvivenza, che contribuisce all’invecchiamento della popolazione, e flussi migratori che, pur incidendo parzialmente sul riequilibrio demografico, non risultano sufficienti a compensare la diminuzione delle nascite.
IL CONVEGNO
Invecchiamento della popolazione, servizi socioassistenziali e inverno demografico sono alcuni dei temi che saranno approfonditi in occasione del convegno “Ritorno al domani. Strategie e processi di sviluppo nella Marca Trevigiana” organizzato dal Centro Studi della Marca Trevigiana all’Auditorium Sant’Artemio della Provincia di Treviso nella mattinata di martedì 3 marzo.
IL COMMENTO
«I numeri che emergono dalle nostre analisi - conclude Marco Della Pietra, presidente del Centro Studi Marca Trevigiana - indicano con chiarezza che il territorio deve prepararsi fin da ora a gestire una popolazione sempre più anziana e una base attiva sempre più ridotta. Rafforzare la rete delle RSA, potenziare i servizi di assistenza domiciliare e investire nella sanità territoriale non è più una scelta rinviabile, ma una necessità urgente. Senza una programmazione tempestiva e coordinata, il rischio è quello di trovarsi ad affrontare, tra pochi anni, una vera e propria emergenza sociale legata alla terza età».
TrevisoToday è anche su Mobile! Scarica l’App per rimanere sempre aggiornato."
20260219074500,piacenzasera.it,https://www.piacenzasera.it/2026/02/immigrati-e-lavoro-limpatto-sul-mercato-piacentino-e-la-sfida-della-societa-multietnica/633240/,IMMIGRATION;TAX_FNCACT;TAX_FNCACT_IMMIGRANTS;WB_855_LABOR_MARKETS;WB_697_SOCIAL_PROTECTION_AND_LABOR;WB_696_PUBLIC_SECTOR_MANAGEMENT;WB_840_JUSTICE;TAX_FNCACT_WORKERS;LEADER;TAX_FNCACT_POLITICIAN;UNGP_FORESTS_RIVERS_OCEANS;WB_2736_RETURNS_TO_WORK;WB_2670_JOBS;WB_2689_JOBS_DIAGNOSTICS;WB_2738_LABOR_EARNINGS;WB_2745_JOB_QUALITY_AND_LABOR_MARKET_PERFORMANCE;WB_2748_EMPLOYMENT;WB_678_DIGITAL_GOVERNMENT;WB_694_BROADCAST_AND_MEDIA;WB_133_INFORMATION_AND_COMMUNICATION_TECHNOLOGIES;MEDIA_MSM;WB_615_GENDER;TAX_ETHNICITY;TAX_ETHNICITY_ITALIAN;TAX_WORLDLANGUAGES;TAX_WORLDLANGUAGES_ITALIAN;WB_135_TRANSPORT;EPU_ECONOMY_HISTORIC;TAX_FNCACT_EMPLOYEES;UNGP_CRIME_VIOLENCE;EDUCATION;SOC_POINTSOFINTEREST;SOC_POINTSOFINTEREST_SCHOOLS;SOC_AGINGPOPULATION;WB_621_HEALTH_NUTRITION_AND_POPULATION;WB_1448_DEMOGRAPHIC_CHANGE;WB_643_AGING_POPULATION;RETIREMENT;EPU_ECONOMY;WB_471_ECONOMIC_GROWTH;WB_856_WAGES;WB_1654_ACTIVE_LABOR_MARKET_POLICIES;WB_1467_EDUCATION_FOR_ALL;WB_470_EDUCATION;WB_2131_EMPLOYABILITY_SKILLS_AND_JOBS;WB_1484_EDUCATION_SKILLS_DEVELOPMENT_AND_LABOR_MARKET;SCIENCE;SOC_INNOVATION;SOC_POINTSOFINTEREST_SCHOOL;SOC_POINTSOFINTEREST_UNIVERSITY;EXTREMISM;TERROR;ARMEDCONFLICT;CRISISLEX_CRISISLEXREC;,1#Italy#IT#IT#42.833333#12.833333#IT,,,-0.584795321637427,srclc:ita;eng:GT-ITA 1.0,"Immigrati e lavoro, l’impatto sul mercato piacentino e la sfida della società multietnica
Più informazioni su
Il rapporto congiunturale n. 48 di “Piacenz@, Economia, Lavoro e Società” ha presentato un’analisi approfondita sull’evoluzione del mercato del lavoro sul territorio piacentino realizzato da Vittorio Silva. E’ una ricerca andata troppo presto in archivio, che vale la pena rispolverare per rendere giustizia della presenza dei lavoratori stranieri e del loro contributo alla ricchezza del nostro territorio, fatta oggetto dei soliti luoghi comuni sui pericoli costituiti da tale presenza e sulle visibili conseguenze che avrebbe l’idea di remigrazione, che viene a fasi alterne anche a chi, pur avendo bisogno di tali collaborazioni, non rinuncia a speculazioni, perolpiù mediatiche, per lucrare qualche consenso politico.
I dati confermano un mercato del lavoro in evoluzione caratterizzato da una crescita robusta, ma anche da importanti trasformazioni demografiche, retributive e professionali. L’occupazione cresce più della media nazionale e regionale: un incremento degli occupati pari al 6%, dopo un recupero più lento post covid, e coinvolge un po’ tutte le fasce di età, con un risultato particolarmente positivo tra gli under 24. Gli attivi sono più di 141.000, portando per la prima volta il tasso di attività piacentino in linea con la media europea. A Piacenza crescono sia il lavoro a tempo pieno sia quello part-time, i lavoratori a tempo determinato superano la media nazionale; il lavoro dipendente si consolida, ma la provincia presenta una quota inferiore di laureati rispetto ai valori nazionale e regionale. Questo dato si riflette sulla composizione delle professioni: gli occupati con ruoli di alta qualificazione risultano 6 punti in meno della media nazionale e 8 di quella regionale. La retribuzione lorda mensile è in linea con quella nazionale, ma inferiore al valore regionale; permangono però significativi divari di genere, di provenienza e di età. La crescita degli occupati è trainata esclusivamente dalla componente straniera (+47%), mentre gli occupati italiani registrano un calo del 2%. Nel 2024 gli stranieri rappresentavano il 21% degli occupati, mentre i nati all’estero costituiscono il 30% della forza lavoro locale, un contributo fondamentale soprattutto in settori come trasporto e magazzinaggio (nel settore della logistica si arriva al 50%), alberghi e ristoranti e altri servizi collettivi e personali. I lavoratori stranieri sono più presenti nel settore dei dipendenti (88%) e percepiscono in media il 66% della retribuzione degli italiani. Nonostante le criticità, il livello di soddisfazione lavorativa, dunque anche degli stranieri, è elevato: voto medio 7,6 su 10, con oltre il 90% degli intervistati che attribuisce un giudizio pari o superiore a 6.
Come si vede, è inutile spaventare con la “sostituzione etnica”: ritornare allo status quo ante non è più possibile, a rischio la chiusura delle scuole per il calo demografico, l’invecchiamento della popolazione con aggravi sul piano del welfare e del sistema pensionistico. Il vero problema, quindi, è quello della costruzione di una società multietnica, non far finta di nulla da parte delle amministrazioni locali in attesa che le cose vadano a posto da sole. Occorre l’elaborazione di una strategia di relazioni sociali, non riferite soltanto ai servizi di prima necessità; per il rapporto di medio termine del Comune di Piacenza, gli stranieri sono un problema di welfare e non di sviluppo. Il confronto fra i dati di crescita economica, del calo dei laureati e delle retribuzioni degli stranieri, segnala il rischio di un progressivo arretramento di una città nella quale la popolazione italiana, e quindi anche il mercato del lavoro connesso, subiscono un progressivo invecchiamento, senza che i nuovi lavoratori vengano opportunamente formati per l’elevazione delle loro competenze e l’avvistamento di nuove professioni. Questi sono soggetti che hanno deciso di rimanere sul nostro territorio e dunque è necessario siano loro a contribuire all’innovazione del nostro sistema; la scuola provvede già egregiamente al lavoro sui giovani, occorre che l’università e più in generale una formazione permanente, ancora tutta da costruire, siano in grado di accompagnare questi nuovi lavoratori, i quali mentre qualificano la loro professionalità acquisiscano anche una nuova cittadinanza.
Piacenza ha bisogno di rielaborare la propria identità in una prospettiva multiculturale, deve essere l’impegno a preparare la prossima amministrazione, i convegni estremisti non faranno altro che produrre macerie che rimarranno in carico a chi vorrà continuare a viverci.
Gian Carlo Sacchi
Più informazioni su
Accedi o registrati per commentare questo articolo.
L'email è richiesta ma non verrà mostrata ai visitatori. Il contenuto di questo commento esprime il pensiero dell'autore e non rappresenta la linea editoriale di PiacenzaSera, che rimane autonoma e indipendente. I messaggi inclusi nei commenti non sono testi giornalistici, ma post inviati dai singoli lettori che possono essere automaticamente pubblicati senza filtro preventivo. I commenti che includano uno o più link a siti esterni verranno rimossi in automatico dal sistema."
20260219164500,italiaoggi.it,https://www.italiaoggi.it/economia-e-politica/attualita/litalia-si-conferma-prima-per-longevita-84-anni-ma-fino-a-che-eta-si-vive-bene-rig4ojgp,WB_621_HEALTH_NUTRITION_AND_POPULATION;WB_1448_DEMOGRAPHIC_CHANGE;WB_643_AGING_POPULATION;GENERAL_HEALTH;MEDICAL;WB_1305_HEALTH_SERVICES_DELIVERY;TAX_ETHNICITY;TAX_ETHNICITY_ITALIAN;TAX_WORLDLANGUAGES;TAX_WORLDLANGUAGES_ITALIAN;TAX_FNCACT;TAX_FNCACT_DOCTORS;CRISISLEX_C03_WELLBEING_HEALTH;WB_2666_LIFE_EXPECTANCY;UNGP_FORESTS_RIVERS_OCEANS;EPU_CATS_MIGRATION_FEAR_FEAR;TAX_DISEASE;TAX_DISEASE_OVERWEIGHT;WB_1406_DISEASES;WB_1435_OBESITY;WB_1427_NON_COMMUNICABLE_DISEASE_AND_INJURY;TAX_FNCACT_CHILD;WB_695_POVERTY;WB_2024_ANTI_CORRUPTION_AUTHORITIES;WB_696_PUBLIC_SECTOR_MANAGEMENT;WB_831_GOVERNANCE;WB_832_ANTI_CORRUPTION;WB_2026_PREVENTION;TAX_FNCACT_MINISTER;CONSTITUTIONAL;WB_1921_PRIVATE_SECTOR_DEVELOPMENT;WB_405_BUSINESS_CLIMATE;WB_2531_INSPECTIONS_LICENSING_AND_PERMITS;WB_2530_BUSINESS_ENVIRONMENT;EDUCATION;DELAY;TAX_ECON_PRICE;TAX_FNCACT_CITIZENS;USPEC_POLICY1;EPU_POLICY;EPU_POLICY_SPENDING;KILL;WB_1331_HEALTH_TECHNOLOGIES;WB_2453_ORGANIZED_CRIME;WB_1350_PHARMACEUTICALS;WB_2433_CONFLICT_AND_VIOLENCE;WB_2432_FRAGILITY_CONFLICT_AND_VIOLENCE;WB_2456_DRUGS_AND_NARCOTICS;CRISISLEX_CRISISLEXREC;CRISISLEX_T02_INJURED;CRISISLEX_T03_DEAD;GENERAL_GOVERNMENT;EPU_POLICY_GOVERNMENT;LEGISLATION;EPU_POLICY_LAW;EPU_POLICY_REFORM;TAX_FNCACT_CITIZEN;SOC_POINTSOFINTEREST;SOC_POINTSOFINTEREST_HOSPITAL;MANMADE_DISASTER_IMPLIED;TAX_DISEASE_DISEASES;UNGP_HEALTHCARE;SOC_CHRONICDISEASE;IDEOLOGY;EPU_ECONOMY_HISTORIC;EPU_CATS_HEALTHCARE;WB_2670_JOBS;WB_2769_JOBS_STRATEGIES;WB_2840_INTEGRATION;WB_2836_MIGRATION_POLICIES_AND_JOBS;TAX_DISEASE_CANCER;WB_1431_CANCER;HEALTH_VACCINATION;SOC_POINTSOFINTEREST_HOSPITALS;SCIENCE;SOC_INNOVATION;TAX_WORLDMAMMALS;TAX_WORLDMAMMALS_HUMAN;POVERTY;TAX_FNCACT_WOMEN;TAX_FNCACT_SENATOR;USPEC_POLITICS_GENERAL1;SOC_AGINGPOPULATION;,1#Sweden#SW#SW#62#15#SW;1#Italy#IT#IT#42.833333#12.833333#IT,,health service;union european;foundation subsidiarity,0.942587832047986,srclc:ita;eng:GT-ITA 1.0,"L’Italia si conferma prima per longevità: 84 anni. Ma fino a che età si vive bene?
Il ministro Schillaci: «Ridurre la pressione della burocrazia e puntare sulla qualità del servizio al cittadino». «È urgente, commenta Beatrice Lorenzin, occuparci seriamente dell'invecchiamento della popolazione»
L’Italia invecchia, si vive di più, ma si vive bene solo fino a circa 70 anni. Si vive meglio e più a lungo al Nord, mentre al Sud si accentuano i problemi che caratterizzano gran parte del sistema sanitario italiano: tempi di attesa troppo lunghi, servizi pubblici insufficienti e troppa burocrazia che fa scappare i medici che studiano in Italia all’estero.
L'Italia continua a presentare una speranza di vita alla nascita superiore agli 84,1 anni, dato che la colloca per longevità all'apice della classifica dell'Unione europea insieme alla Svezia (dati Ocse 2025, relazione Country Health Profile 2024). Ma se si guarda alla speranza di vita in buona salute, questa si ferma intorno ai 69,1 anni, con un decremento di circa 1 anno rispetto all'anno precedente (Istat 2024, ricerca Benessere Equo e Sostenibile su dati 2023). Lo dice il “Rapporto sussidiarietà e salute” della Fondazione Sussidiarietà.
Al nord si vive fino a cinque anni di più
In fatto di longevità emerge che le differenze territoriali superano i quattro o cinque anni tra Nord e Sud dell'Italia e che circa il 40% degli indicatori relativi alla salute (fissati dall'obiettivo o Goal 3 dell'Agenda 2030) mostra un andamento negativo rispetto all'anno precedente, ""con peggioramenti che riguardano aspetti di benessere, come sovrappeso infantile, disuguaglianze nell'accesso e debolezza delle misure di prevenzione"", aspetti che a detta dei curatori del Rapporto suggeriscono che la qualità della vita possa subire ulteriori pressioni nei prossimi anni.
Il ministro della sanità, Orazio Schillaci, su questo punto ha commentato: ""In un Paese come il nostro è impensabile che l'aspettativa di vita dipenda dal cap di residenza. L'accesso alle cure e l'universalità del nostro Servizio sanitario nazionale sono valori fondanti riportati nell'articolo 32 della Costituzione che poi finisce, e questo lo ricordano spesso in pochi, che lo Stato si deve occupare soprattutto dei più deboli e dei più fragili"".
Che relazione c’è tra titolo di studio e speranza di vita?
Nel Rapporto c'è anche la relazione tra salute e titolo di studio, ed è indicata come molto significativa, visto che i tassi di mortalità evitabile per 10 mila residenti sono 39,6 per chi è privo di titolo di studio o con licenza elementare; 33,5 per chi ha conseguito la licenza media; 26,4 per chi possiede il diploma; 20,3 per coloro che hanno una laurea o un titolo di studio superiore.
Il problema di chi rinuncia alle cure
C'è poi il capitolo accesso alle cure e rinuncia. La difficoltà di accesso alle cure è infatti il primo indicatore con cui il Rapporto misura ""l'erosione dell'universalismo"", un universalismo ""che esiste sulla carta ma non nell'esperienza, con disuguaglianze che si accentuano per reddito, area geografica e profili di bisogno sostanziale"". Secondo i dati disponibili, circa il 9-10% della popolazione ha dichiarato di aver rinunciato o rinviato cure necessarie per motivi economici, lunghe attese o difficoltà di accesso, e questa quota supera il 20% tra le fasce socio-economicamente più svantaggiate. Uno dei punti critici per il 73% degli italiani è legato ai tempi di attesa. E ancora: solo 6 delle 10 visite più comuni vengono effettuate nei tempi, mentre per gli esami sono 8 su 20.
Tempi di attesa con conformi alle diagnosi precoci
La copertura dei servizi “core” è formalmente al 100%, ma solo il 48% degli utenti si dichiara soddisfatto della qualità, secondo la Relazione annuale Cnel 2025, contro il 52% medio OCSE (Government at a Glance 2025).
Il Rapporto sulla sussidiarietà evidenzia forti divari regionali: posti letto tra 33 e 45 ogni 10 mila abitanti, differenze su Lea, personale e tecnologie. La mobilità sanitaria dal Sud al Nord pesa sui cittadini e rende la salute un diritto variabile: l’8,6% delle famiglie affronta costi insostenibili. La spesa a carico dei nuclei sale al 25,7% nel 2023 (dal 18,6% nel 1980), mentre la quota pubblica scende al 61,1%. Ridurre del 10% la spesa sanitaria è associato a 44 decessi in più ogni 10 mila pazienti; investire il 10% in più in farmaci e controlli pre-evento può evitare fino a 2.500 morti l’anno.
Schillaci, Governo al lavoro con la legge delega sul Ssn
Riformare i modelli organizzativi nella sanità, riducendo la pressione della burocrazia e puntando invece ad avere più attenzione alla qualità del servizio al cittadino. Lo ha detto il ministro della Salute, Orazio Schillaci, intervenendo alla presentazione del Rapporto dalla Fondazione Sussidiarietà. Schillaci ha aggiunto che nella legge delega approvata sull'assistenza ospedaliera e territoriale ""diamo spazio al tema dell'accreditamento con regole condivise e uniformi con l'obiettivo di diminuire la burocrazia e avere più attenzione alla qualità"". Il ministro condivide la necessità di rivedere e integrare i servizi del Ssn, ma ammette che questo compito è più complesso rispetto a quando è nato il Servizio ssanitario nazionale, ""perché influenzato da un andamento demografico rallentato, dalla prevalenza di patologie croniche, da una società spesso caratterizzata da ipermedicalizzazione"". Il titolare del ministero ha evidenziato che i principi della sussidiarietà, soprattutto quella orizzontale, costituiscono il ""metodo con cui assicurare i valori fondanti del sistema universalistico"". Una delle cose che Schillaci ha evidenziato è quella di “valorizzare il contributo della società e del Terzo settore"".
Il valore delle Case di comunità
Nelle case di comunità, ""i cittadini devono trovare non solo prestazioni sanitarie ma risposte ai bisogni sociali grazie all'integrazione di più soggetti, incluso il Terzo settore"" e, prosegue il ministro, “abbiamo incrementato le risorse per popolare queste strutture con professionalità necessarie ai nuovi compiti (250 milioni di euro per il 2025 e 350 dal 2026). L’obiettivo di queste strutture è quello di promuovere la salute per orientare la popolazione sana verso stili di vita corretti, partecipazione agli screening oncologici e alle attività vaccinali.
Nuove tariffe per le prestazioni di ricovero
Dopo oltre un decennio, ha anche detto Orazio Schillaci, “stiamo aggiornando le tariffe di ricovero, di riabilitazione e ambulatoriali, per le quali a regime, nel 2027, saranno finalizzati quasi due miliardi di euro"". Inoltre, con la legge delega sulla riorganizzazione dell'assistenza ospedaliera e territoriale è prevista, ha ricordato, una ""rete di ospedali di terzo livello che possano diventare da un lato il motore dell'innovazione e della ricerca; dall'altro possano essere considerati hub di reti di patologia e centri di riferimento nella costruzione di reti ospedaliere che si differenziano per ruolo, missione, risposta ai bisogni conservando un approccio integrato"".
Lorenzin: “Evidenti le criticità del sistema sanitario”
""Il rapporto evidenzia in modo tangibile, con dati di evidenza scientifica, tutte le criticità del sistema sanitario italiano: dalla crisi del capitale umano - medici, infermieri e operatori sanitari in fuga verso l'estero - alla necessità di rafforzare la centralità del territorio e una nuova sussidiarietà di comunità; dalla rinuncia alle cure per 6 milioni di persone alla crescente povertà sanitaria, specie per donne e persone fragili; fino alla fuga verso il privato per chi può permetterselo. Dobbiamo frenare un modello consumistico e il progressivo scivolamento verso un assetto di tipo americano, che rischia di erodere i principi di equità e universalismo"". Lo ha dichiarato la senatrice del Pd ed ex ministro della Salute Beatrice Lorenzin. È urgente, continua l’ex ministra, occuparci seriamente dell'invecchiamento della popolazione, con un cambio di paradigma che sposti l'attenzione dalla singola prestazione alla presa in carico della persona.
(riproduzione riservata)"
