date_str,source,url,themes,locations,persons,organizations,tone,translation_info,full_text
20260213020000,interris.it,https://www.interris.it/copertina/testimonianza-malattia/,CRISISLEX_C03_WELLBEING_HEALTH;WB_2432_FRAGILITY_CONFLICT_AND_VIOLENCE;GENERAL_HEALTH;TAX_FNCACT;TAX_FNCACT_BISHOP;TAX_FNCACT_ASSISTANT;EDUCATION;SOC_POINTSOFINTEREST;SOC_POINTSOFINTEREST_UNIVERSITY;TAX_RELIGION;TAX_RELIGION_CATHOLIC;TAX_WORLDMAMMALS;TAX_WORLDMAMMALS_LION;AFFECT;TAX_WORLDLANGUAGES;TAX_WORLDLANGUAGES_SAMARITAN;TAX_WORLDMAMMALS_HUMAN;TAX_RELIGION_CHURCH;WB_1921_PRIVATE_SECTOR_DEVELOPMENT;WB_405_BUSINESS_CLIMATE;WB_2531_INSPECTIONS_LICENSING_AND_PERMITS;WB_2530_BUSINESS_ENVIRONMENT;SOC_POINTSOFINTEREST_UNIVERSITIES;TAX_FNCACT_POPE;TAX_FNCACT_MANAGER;TAX_FNCACT_GENERAL_MANAGER;LEADER;TAX_FNCACT_PRESIDENT;USPEC_POLITICS_GENERAL1;TAX_ETHNICITY;TAX_ETHNICITY_FRENCH;TAX_WORLDLANGUAGES_FRENCH;TAX_FNCACT_VICE_PRESIDENT;MANMADE_DISASTER_IMPLIED;SOC_POINTSOFINTEREST_SCHOOL;MEDICAL;WB_1331_HEALTH_TECHNOLOGIES;WB_1350_PHARMACEUTICALS;WB_621_HEALTH_NUTRITION_AND_POPULATION;TAX_FNCACT_DIRECTOR;SOC_POINTSOFINTEREST_HOSPITAL;CRISISLEX_T11_UPDATESSYMPATHY;TAX_FNCACT_FATHER;TAX_FNCACT_FOUNDER;TAX_FNCACT_STUDENTS;TAX_FNCACT_PROFESSOR;TAX_FNCACT_CHILDREN;TAX_DISEASE;TAX_DISEASE_INFERTILITY;,"4#Rome, Lazio, Italy#IT#IT07#41.9#12.4833#-126693;1#Italy#IT#IT#42.833333#12.833333#IT",francis brown;a bishop giuliodori;sacred heart;daniele piacenza,a dean the school;department development human;institution scientific international paul;institution gm;a mission;a school;institute scientific international;institute gm;surgery university catholic;foundation twins;foundation polyclinic university august twins;institute scientific international paul you;association tennis;university catholic,1.64569215876089,srclc:ita;eng:GT-ITA 1.0,"Una testimonianza di fede di pazienti nell’ambito del progetto sociale “Non lasciamo nessuno solo” realizzato in collaborazione con Tennis & Friends. Con un racconto autobiografico sul tema della fragilità e su come la diagnosi di una malattia costringa a rivalutare i legami personali. Il vescovo Claudio Giuliodori, assistente ecclesiastico generale dell’Università Cattolica del Sacro Cuore approfondisce il messaggio inviato da Leone XIV per la Giornata mondiale del malato. “Il brano del Samaritano è forse tra i testi più commentati e meditati- osserva il presule-.ha voluto ritornare su questa pagina evangelica per tre ragioni: porci di fronte la bellezza della carità, che illumina l’umanità; non perdere di vista la dimensione sociale della compassione, elemento che non ci vede nell’indifferenza ma nel processo, appunto, del compatire e del sostenerci reciprocamente, soprattutto in questo tempo di grande malessere per la società. L’attenzione al bisogno dei sofferenti”: nel suo messaggio Leone XIV, prosegue monsignor Giuliodori, “custodisce il lasciato preziosissimo di Francesco con riferimento all’enciclica Fratelli tutti, il cui secondo capitolo è dedicato proprio alla figura del Samaritano con valenza universale per ogni essere umano”. L’altro testo di rimando è “la Dilexi te, in cui emerge quell’amore rivolto ai più fragili con passaggi declinati nel contesto della malattia. Tre sono le parti da evidenziare. Il dono dell’incontro, in cui riscoprire il senso e il valore della prossimità, seguendo l’esempio di Cristo. La missione condivisa nella cura dei malati, ossia l’organizzazione sociale della carità. In questo luogo attuiamo insieme un’azione ecclesiale. L’amore per Dio, che ci permette di incontrarci con noi stessi e con il fratello. Qui, dove c’è piena cura del prossimo senza fare selezione di alcun malato, affidiamo il nostro operato alla protezione della Vergine Maria”.
Progetto sociale
L’iniziativa è stata promossa dalla Fondazione Gemelli insieme all’Università Cattolica del Sacro Cuore, campus di Roma e all’Istituto G. Toniolo di Studi Superiori e si inserisce nel progetto sociale “Non lasciamo nessuno solo”. All’evento hanno preso parte i vertici della Fondazione Policlinico Universitario Agostino Gemelli IRCCS, il direttore generale Daniele Piacentini, il presidente Daniele Franco e il vicepresidente Giuseppe Fioroni nonché vicepresidente dell’Istituto G. Toniolo. E il preside della Facoltà di Medicina e chirurgia dell’Università Cattolica del Sacro Cuore Alessandro Sgambato. E’ stato proiettato presso la Sala Medicinema, il film “Cosa sarà” (2020) con l’intervento del regista Francesco Bruni. A seguire il dibattito sul tema dell’umanizzazione della cura attraverso l’arte cinematografica con la partecipazione della direttrice di Ematologia e di cellule staminali emopoietiche Simona Sica, della responsabile SITRA Carmen Nuzzo, dell’assistente spirituale del Gemelli don Nunzio Currao, e della responsabile Medicinema Lazio Marina Morra. Racconta il regista Bruni: “Sono stato anch’io un paziente del Gemelli nel 2018 e in quella occasione sono venuto a conoscenza dell’esistenza di questa sala cinematografica all’interno dell’ospedale. Quando sono guarito ho girato il film ‘Cosa sarà‘ dove il mio alter ego è un regista che presenta il suo film proprio qui a MediCinema. Sono venuto io personalmente a presentarlo ai pazienti del Gemelli e per me è una grande emozione”.
Testimonianza
“Si rinnova il senso profondo della nostra missione: cioè di prenderci cura delle persone, e soprattutto di quelle più fragili che si confrontano con la malattia”, spiega Daniele Piacentini ringraziando tutto il personale sanitario per quello che ogni giorno fa proprio per testimoniare questa missione e questo modo concreto di affrontare il percorso di cura dei pazienti. Aggiunge Piacentini: “Il Papa ci ricorda la parabola del Buon Samaritano, ponendo al centro il valore della compassione come dimensione essenziale della cura. Ecco, una compassione che non deve rimanere sentimento ma deve essere un segno concreto di prossimità, di vicinanza, di responsabilità della presa in carico del paziente in tutto il suo percorso”. Evidenzia Giuseppe Fioroni ha commentato: ”Non lasciare solo nessuno indica un punto di arrivo e di nuova partenza di come vogliamo concepire la nostra Università Cattolica nell’ambito della formazione e il nostro Policlinico dal punto di vista della cura e dell’assistenza. Significa garantire le cure migliori a tutti soprattutto a quelli indigenti e fragili: questa è la nostra missione che ci rende unici come ospedale. Il Santo Padre oggi in questa particolare giornata dedicata ai malati, ci ricorda che dobbiamo amare portando il dolore dell’altro cioè avere compassione e offrire sempre un messaggio di speranza e una dimensione umana alle persone che soffrono per la malattia”. La Facoltà di Medicina e Chirurgia dell’Università Cattolica “è nata per volere del fondatore Padre Agostino Gemelli per formare professionisti della salute che sappiano prendersi cura del malato vedendo in esso un fratello da assistere, proprio sulla base dei valori che ci ispira il Vangelo. Ed è quello che noi cerchiamo di insegnare tutti i giorni ai nostri studenti”, sottolinea il professor Alessandro Sgambato. Momento clou dell’evento è stato la donazione da parte dell’Associazione “Tennis and Friends, Salute e Sport” con il suo presidente e fondatore Giorgio Meneschincheri di un ecografo multidisciplinare al Centro di Medicina per la Procreazione Naturale dell’Istituto Scientifico Internazionale Paolo VI-ISI.
Prendersi cura
Due coppie, una in attesa di un bimbo da poche settimane e un’altra che ha già tre figli adolescenti entrambe seguite presso il Centro di Medicina per la Procreazione Naturale ISI, hanno testimoniato come grazie a metodiche naturali per la regolazione della natalità e a soluzioni naturali alla sterilità di coppia hanno realizzato un sogno che sembrava impossibile. Giorgio Meneschincheri ha ricordato che Tennis & Friends quest’anno ha compiuto 15 anni, come l’Istituto Scientifico Internazionale che ne compie 25 e come sia stato un onore per la sua associazione supportare l’ISI e il Centro di Procreazione attraverso la donazione dell’ecografo, che supporterà le attività clinico-diagnostiche del Centro. Afferma il presidente della Fondazione Policlinico Universitario Agostino Gemelli IRCCS Daniele Franco: “Uno dei modi in cui il Gemelli si prende cura delle persone è anche quello di aiutare le coppie nelle loro scelte di avere figli. Lo fa attraverso l’Istituto Scientifico Internazionale Paolo VI, attivo dal 2000. Voglio ringraziare l’Associazione Tennis & Friends per il dono di questo ecografo, che aiuterà l’attività dell’Istituto e per le coppie che hanno difficoltà ad avere figli, in un Paese come l’Italia che sta assistendo a una caduta della natalità di dimensioni epocali”."
20260213053000,zazoom.it,https://www.zazoom.it/2026-02-13/inverno-demografico-piu-morti-che-nascite/18643848/,KILL;CRISISLEX_CRISISLEXREC;CRISISLEX_T02_INJURED;CRISISLEX_T03_DEAD;MEDIA_MSM;CRISISLEX_T01_CAUTION_ADVICE;MOVEMENT_GENERAL;AFFECT;TAX_FNCACT;TAX_FNCACT_WOMEN;WB_855_LABOR_MARKETS;WB_697_SOCIAL_PROTECTION_AND_LABOR;TAX_ETHNICITY;TAX_ETHNICITY_FRENCH;TAX_WORLDLANGUAGES;TAX_WORLDLANGUAGES_FRENCH;TAX_DISEASE;TAX_DISEASE_INFERTILITY;UNGP_FORESTS_RIVERS_OCEANS;USPEC_POLITICS_GENERAL1;TAX_FNCACT_COMMUNIST;TAX_ETHNICITY_CHINESE;TAX_WORLDLANGUAGES_CHINESE;EPU_ECONOMY;EPU_ECONOMY_HISTORIC;SLFID_ECONOMIC_DEVELOPMENT;MEDICAL;TAX_FNCACT_DIOCESAN;,"1#Italy#IT#IT#42.833333#12.833333#IT;1#China#CH#CH#35#105#CH;1#France#FR#FR#46#2#FR;4#Ascoli Piceno, Marche, Italy#IT#IT10#42.85#13.5667#-110789",,,-3.5377358490566,srclc:ita;eng:GT-ITA 1.0,
