date_str,source,url,themes,locations,persons,organizations,tone,translation_info,full_text
20260220030000,zazoom.it,https://www.zazoom.it/2026-02-20/sanita-italiana-sicilia-propone-innovazione-e-digitale-per-il-futuro/18690014/,GENERAL_HEALTH;MEDICAL;TAX_ETHNICITY;TAX_ETHNICITY_ITALIAN;TAX_WORLDLANGUAGES;TAX_WORLDLANGUAGES_ITALIAN;SCIENCE;SOC_INNOVATION;MEDIA_MSM;TAX_FNCACT;TAX_FNCACT_COMMISSIONER;WB_1305_HEALTH_SERVICES_DELIVERY;WB_621_HEALTH_NUTRITION_AND_POPULATION;SOC_POINTSOFINTEREST;SOC_POINTSOFINTEREST_HOSPITALS;TAX_FNCACT_DOCTORS;CRISISLEX_C03_WELLBEING_HEALTH;UNGP_FORESTS_RIVERS_OCEANS;GENERAL_GOVERNMENT;EPU_POLICY;EPU_POLICY_GOVERNMENT;SOC_AGINGPOPULATION;WB_1448_DEMOGRAPHIC_CHANGE;WB_643_AGING_POPULATION;WB_696_PUBLIC_SECTOR_MANAGEMENT;WB_2048_COMPENSATION_CAREERS_AND_INCENTIVES;WB_723_PUBLIC_ADMINISTRATION;WB_724_HUMAN_RESOURCES_FOR_PUBLIC_SECTOR;WB_2089_ETHICS_AND_CODES_OF_CONDUCT;EPU_ECONOMY_HISTORIC;SOC_POINTSOFINTEREST_HOSPITAL;MANMADE_DISASTER_IMPLIED;TAX_FNCACT_CITIZENS;LEADER;TAX_FNCACT_PRESIDENT;USPEC_POLITICS_GENERAL1;CRISISLEX_C07_SAFETY;TAX_DISEASE;TAX_DISEASE_WOUNDS;SHORTAGE;WB_1973_FINANCIAL_RISK_REDUCTION;WB_435_AGRICULTURE_AND_FOOD_SECURITY;WB_337_INSURANCE;WB_1967_AGRICULTURAL_RISK_AND_SECURITY;,"4#Palermo, Sicilia, Italy#IT#IT15#38.1167#13.3667#-123798;1#Italy#IT#IT#42.833333#12.833333#IT;5#Sicily, Sicilia, Italy#IT#IT15#37.75#14.25#-129695",,health italian;pharaohs middle of debate on health italian;health service national;foundation security,5.20094562647754,srclc:ita;eng:GT-ITA 1.0,"Sanità italiana | Sicilia propone innovazione e digitale per il futuro
L’Assessore Faraoni ha annunciato che la Sicilia punta sull’innovazione digitale per migliorare i servizi sanitari. La causa è la necessità di rispondere alle crescenti richieste di assistenza e di alleggerire i tempi di attesa. La regione ha già avviato progetti di telemedicina e sistemi informativi più efficienti, coinvolgendo ospedali e medici di base. Faraoni ha sottolineato l’importanza di investire in tecnologia per garantire cure più rapide e accessibili. La proposta si inserisce nel dibattito nazionale sulla modernizzazione del sistema sanitario.
L’Assessore Faraoni al Centro del Dibattito sulla Sanità Italiana: Un Appello per Innovazione e Sostenibilità. L’assessore regionale alla Salute della Sicilia, Daniela Faraoni, ha ottenuto un ampio consenso per il suo intervento al convegno nazionale “Governare il futuro del SSN”, tenutosi a Cernobbio il 19 febbraio 2026. L’evento, che ha riunito figure chiave del governo e gli assessori regionali alla Salute di tutta Italia, ha rappresentato un momento cruciale per delineare le strategie future del Servizio Sanitario Nazionale, affrontando sfide complesse come l’invecchiamento della popolazione e l’innovazione tecnologica.🔗 Leggi su Ameve.eu
Leggi anche: Innovazione digitale, Ferrara avanza nella classifica italiana: bene l’amministrazione
Sanità e futuro: quando l’etica incontra l’innovazioneL’articolo esplora il dialogo tra etica e innovazione nel settore sanitario, evidenziando come le strutture ospedaliere stiano evolvendo per integrare criteri di sostenibilità sociale, economica e ambientale.
Vedi altri contenuti disponibili per approfondire la notizia o scorri a sinistra ← per la prossima news.Argomenti discussi: In Sicilia oltre un milione di cittadini rinuncia alle cure; Salute mentale, in Sicilia numeri posti letto per ricoveri tra i più elevati in Italia; Sanità allo sbando, Catanzaro: Ennesima prova del fallimento del governo - AgrigentoNotizie; Intramoenia e liste d’attesa, la proposta FNOMCeO per tutelare i cittadini CLICCA PER IL VIDEO.
Forum Mediterraneo. Giannotti: La Sicilia può offrire molto alla sanità italianaIl presidente della Fondazione Sicurezza in Sanità spiega le ragioni che lo hanno convinto a partecipare all’organizzazione del Forum Mediterraneo a Palermo: Qui da quattro anni si sta giocando una ... quotidianosanita.it
La sanità italiana che resiste, nonostante tuttoUn popolo che invecchia, ma che invecchia bene. Un sistema sanitario che, nonostante le ferite, la cronica carenza di personale e un finanziamento pubblico più basso rispetto ad altri grandi big ... ilfoglio.it
Nasce Matrice, la newsletter mensile di TrendSanità sulla sanità italiana Gratuita, su LinkedIn Prima uscita: 28 febbraio Iscriviti ora prima del lancio lnkd.in/dAD4Vn2H #PoliticaSanitaria #Newsletter #Sanità x.com
Exor esce anche dalla sanità privata italiana con la cessione di Lifenet Healthcare alla compagnia assicurativa torinese facebook"
20260220193000,ansa.it,https://www.ansa.it/ansacom/notizie/canale_saluteebenessere/next/2026/02/20/crescono-cronicita-e-non-autosufficienza-mutue-a-fianco-del-servizio-sanitario-2_a0c8e47d-983e-4f00-a3ba-0cb55e760258.html,GENERAL_HEALTH;MEDICAL;WB_1305_HEALTH_SERVICES_DELIVERY;WB_621_HEALTH_NUTRITION_AND_POPULATION;SOC_AGINGPOPULATION;WB_1448_DEMOGRAPHIC_CHANGE;WB_643_AGING_POPULATION;CRISISLEX_CRISISLEXREC;CRISISLEX_T01_CAUTION_ADVICE;SHORTAGE;USPEC_POLICY1;EPU_ECONOMY;EPU_ECONOMY_HISTORIC;EDUCATION;SOC_POINTSOFINTEREST;SOC_POINTSOFINTEREST_UNIVERSITIES;WB_2670_JOBS;WB_2769_JOBS_STRATEGIES;WB_2840_INTEGRATION;WB_2836_MIGRATION_POLICIES_AND_JOBS;EPU_CATS_HEALTHCARE;TAX_FNCACT;TAX_FNCACT_CITIZENS;TAX_FNCACT_WORKERS;TAX_FNCACT_TEMPORARY_WORKERS;RURAL;LEADER;TAX_FNCACT_PRESIDENT;USPEC_POLITICS_GENERAL1;TAX_WORLDLANGUAGES;TAX_WORLDLANGUAGES_LOMBARD;TAX_DISEASE;TAX_DISEASE_ADHESIONS;,"1#Italy#IT#IT#42.833333#12.833333#IT;4#Rome, Lazio, Italy#IT#IT07#41.9#12.4833#-126693",matthew spano,federation tuscan;a bank;banks credit;federation lombard;foundation of credit cooperative millennium;health service health,5.48628428927681,srclc:ita;eng:GT-ITA 1.0,"Se hai scelto di non accettare i cookie di profilazione e tracciamento, puoi aderire all’abbonamento ""Consentless"" a un costo molto accessibile, oppure scegliere un altro abbonamento per accedere ad ANSA.it.
Ti invitiamo a leggere le Condizioni Generali di Servizio, la Cookie Policy e l'Informativa Privacy.
In evidenza
In evidenza
ANSAcom
ANSAcom - In collaborazione con NeXt
In Italia vivono 24 milioni di malati cronici e circa 4 milioni di persone non autosufficienti. Numeri destinati a crescere ulteriormente come conseguenza dell'invecchiamento della popolazione: se già oggi gli ultra-65enni rappresentano quasi il 25% della popolazione (circa 14 milioni), nel 2050 si prevede che rappresenteranno il 35% facendo crescere il bisogno di salute. A questa esplosione di domanda, però, non corrisponde una risposta pubblica sufficiente, con il risultato di alimentare il ""razionamento sanitario implicito"". È il tema al centro dal Rapporto ""Quando i soldi non bastano - Il razionamento sanitario in Italia: la situazione degli ultimi sei anni"", realizzato da NeXt Economia e Università di Roma Tor Vergata in collaborazione con Acli e Caf Acli, che sarà presentato a Roma il 23 febbraio alla Camera. In questo scenario, secondo il rapporto, decisiva diventa la ""sanità di territorio"" che vede lavorare assieme reti locali, servizi di prossimità e forme di integrazione tra attori pubblici, privati e del Terzo Settore. A supportare questo modello, una forma di intervento proposta è quella delle mutue socio sanitarie, che accompagnano i cittadini nell'accesso alle prestazioni sanitarie private, integrando l'offerta del servizio sanitario si rivolgono anche a chi è privo di altre coperture, come lavoratori precari, anziani e famiglie a basso reddito.
Tra gli esempi citati dal rapporto quello delle mutue socio sanitarie promosse dalle Banche di Credito Cooperativo e Casse Rurali.
""Il modello delle Mutue Bcc, associazioni mutualistiche locali promosse e sostenute dalle Banche di Credito Cooperativo ed associate al consorzio Comipa si fonda sull'obiettivo di offrire un supporto accessibile e di prossimità ai vari bisogni - inclusi quelli sanitari - delle comunità di riferimento. Per un intervento a tutto tondo che nasce dal basso e si basa sulla logica solidaristica e cooperativa"", spiega Alessandro Azzi, presidente della Federazione Lombarda delle Bcc e della Fondazione del Credito Cooperativo Tertio Millennio Ets.
""Il progetto 'Una Banca Una Mutua' in collaborazione con Comipa, testimonia l'impegno delle BCC associate a contribuire a soddisfare bisogni primari che emergono nelle nostre comunità locali"", aggiunge Matteo Spanò, presidente della Federazione Toscana Bcc. ""In Toscana abbiamo 10 Mutue, promosse e sostenute da altrettante Bcc. Ogni Mutua opera a favore dei propri associati in ambito sanitario, sociale, di sostegno alla famiglia, educativo, culturale e ricreativo. Dal 2019 ad oggi la crescita costante delle adesioni e dei servizi offerti confermano il successo di un modello che è mutualistico, solidaristico e punta sul fare comunità"", conclude Spanò.
ANSAcom - In collaborazione con NeXt
Ultima ora"
20260220200000,ansa.it,https://www.ansa.it/abruzzo/notizie/2026/02/20/lombardo-uil-dialogo-per-colmare-divario-tra-zone-interne-e-costiere_5fb8b169-cd3b-4789-9e46-fe9317cb2fa9.html,MARITIME;GENERAL_GOVERNMENT;USPEC_POLITICS_GENERAL1;EPU_POLICY;EPU_POLICY_CONGRESS;NATURAL_DISASTER;NATURAL_DISASTER_EARTHQUAKE;CRISISLEX_T01_CAUTION_ADVICE;TAX_ECON_PRICE;USPEC_POLICY1;EPU_UNCERTAINTY;UNGP_FORESTS_RIVERS_OCEANS;TAX_ETHNICITY;TAX_ETHNICITY_ITALIAN;TAX_WORLDLANGUAGES;TAX_WORLDLANGUAGES_ITALIAN;TAX_FNCACT;TAX_FNCACT_COORDINATOR;EPU_ECONOMY_HISTORIC;SOC_AGINGPOPULATION;WB_621_HEALTH_NUTRITION_AND_POPULATION;WB_1448_DEMOGRAPHIC_CHANGE;WB_643_AGING_POPULATION;SHORTAGE;WB_695_POVERTY;TAX_FNCACT_SECRETARY;TAX_FNCACT_SECRETARY_GENERAL;TAX_WORLDLANGUAGES_LOMBARD;WB_2670_JOBS;WB_2890_AFFIRMATIVE_ACTION;WB_2889_MINORITIES_AND_DISENFRANCHISED_GROUPS_AND_JOBS;WB_2884_INCLUSIVE_JOBS;,1#Italy#IT#IT#42.833333#12.833333#IT,michele lombard;francis marrelli,,-2.57234726688103,srclc:ita;eng:GT-ITA 1.0,"Si è svolta oggi all'Aquila
l'ultima tappa delle prime assemblee congressuali territoriali
della Uil. Eletti i 31 delegati provinciali che a maggio
parteciperanno al XII Congresso regionale. Uno dei temi
principali del dibattito è stato il processo di ricostruzione
post sisma che, secondo il sindacato confederale, ha subito
un'accelerazione negli ultimi anni, anche se restano penalizzati
gli edifici pubblici, con interventi che procedono con più
lentezza, spesso aggravati dall'aumento dei costi dei materiali.
In questa incertezza si inserisce, però, un traguardo
importante: la designazione dell'Aquila a Capitale italiana
della cultura 2026.
""È un'opportunità concreta di rilancio economico, turistico e
occupazionale - ha detto il coordinatore territoriale Luigi Di
Donato -. La cultura può diventare un volano di sviluppo, capace
di generare lavoro nei settori dello spettacolo,
dell'accoglienza, dei servizi, dell'artigianato e dell'industria
creativa. Ma anche in questo caso serve responsabilità. La
capitale della cultura non deve essere un evento temporaneo,
bensì l'inizio di una strategia strutturale"".
Sulle aree interne, poi, secondo la Uil si gioca una delle
sfide più delicate. Spopolamento, invecchiamento della
popolazione, carenza di servizi accentuano le disuguaglianze
territoriali. Dall'Aquila, provincia che più soffre queste
condizioni, il segretario generale Uil Abruzzo, Michele
Lombardo, ha lanciato l'idea degli Stati generali delle aree
interne, ""una grande discussione che possa portare tutti gli
attori del territorio, dalle istituzioni alle parti sociali, a
mettere in pratica un'azione positiva e propositiva per avviare
un processo virtuoso nelle zone più disagiate. Dobbiamo far in
modo che il disequilibrio causato dalla dicotomia tra aree
interne e aree costiere possa essere colmato, all'Aquila così
come in tutte le altre province abruzzesi"".
Hanno partecipato all'incontro anche il segretario
provinciale Cgil L'Aquila, Francesco Marrelli, e il responsabile
territoriale Cisl L'Aquila, Giampaolo Biondi.
Riproduzione riservata © Copyright ANSA"
20260220190000,quotidianopiemontese.it,https://www.quotidianopiemontese.it/2026/02/20/pet-therapy-ri-animali-ospedale-di-rivoli/,GENERAL_HEALTH;MEDICAL;SOC_POINTSOFINTEREST;SOC_POINTSOFINTEREST_HOSPITAL;CRISISLEX_C03_WELLBEING_HEALTH;TAX_FNCACT;TAX_FNCACT_PILOT;CRISISLEX_C07_SAFETY;TAX_DISEASE;TAX_DISEASE_INFERTILITY;TAX_FNCACT_COMMISSIONER;USPEC_POLICY1;WB_1614_NUTRITIONAL_PROGRAMS;WB_1609_FOOD_AND_IN_KIND_TRANSFERS;WB_1615_THERAPEUTIC;WB_1466_SOCIAL_ASSISTANCE;WB_697_SOCIAL_PROTECTION_AND_LABOR;TAX_FNCACT_MANAGER;TAX_FNCACT_GENERAL_MANAGER;UNGP_FORESTS_RIVERS_OCEANS;TAX_WORLDMAMMALS;TAX_WORLDMAMMALS_DOGS;LEADER;TAX_FNCACT_PRESIDENT;USPEC_POLITICS_GENERAL1;,"1#Mauritius#MP#MP#16#146#MP;5#Piedmont, Piemonte, Italy#IT#IT12#45#8#-124710",,,3.56164383561644,srclc:ita;eng:GT-ITA 1.0,"SaluteTorino
La Pet Therapy “Ri-Animali” dell’ospedale di Rivoli riconosciuto come best practice a livello regionale
Si tratta di un’esperienza particolare nel panorama sanitario, sia per la stabilità nel tempo sia per il contesto clinico in cui viene applicata: la terapia intensiva
RIVOLI – Il progetto “Ri-Animali”, che ha introdotto gli Interventi Assistiti con Animali (IAA) nel reparto di Rianimazione dell’ospedale di Rivoli, è stato riconosciuto dalla Regione Piemonte come modello strutturale e buona pratica a livello regionale. L’iniziativa, avviata in via sperimentale nel reparto diretto da Michele Grio, supera così la fase pilota e potrà contare su un finanziamento dedicato che ne garantisce la continuità operativa.
Si tratta di un’esperienza particolare nel panorama sanitario, sia per la stabilità nel tempo sia per il contesto clinico in cui viene applicata: la terapia intensiva. Il consolidamento del progetto è stato possibile grazie a un monitoraggio scientifico durato oltre un anno. I dati raccolti hanno evidenziato la sicurezza biologica del protocollo adottato: la presenza degli animali non ha determinato alcun incremento delle infezioni ospedaliere, confermando la compatibilità degli IAA con gli elevati standard di sterilità richiesti in rianimazione.
«Con questo progetto – dichiara l’assessore regionale Maurizio Marrone, assessore alle Politiche sociali della Regione Piemonte – siamo orgogliosi di potenziare le azioni di pet therapy nel reparto di terapia intensiva dell’ospedale di Rivoli. In questo campo Aslan è una garanzia, avendo già dimostrato come gli interventi assistiti con gli animali producano un oggettivo beneficio di carattere terapeutico per i pazienti».
Soddisfazione è stata espressa anche dal Direttore Generale dell’ASL TO3 Giovanni La Valle: «Il passaggio di “Ri-Animali” a best practice regionale premia una visione che coniuga l’alta tecnologia salvavita con l’empatia assistenziale. I risultati scientifici confermano che questa sinergia rappresenta un elemento importante nel percorso di recupero neuro-cognitivo dei pazienti e per il benessere del nostro personale».
Dal punto di vista clinico, l’interazione con i cani coinvolti nel progetto – Cecilia, presente fin dall’avvio dell’iniziativa, e Woody, inserito più recentemente – si è rivelata un supporto nella modulazione dello stress e uno stimolo motorio utile soprattutto nella fase di svezzamento dalla ventilazione meccanica.
Il cosiddetto “modello Rivoli”, sviluppato in collaborazione con l’Associazione Aslan e con la presidente Antonia Tarantini, recentemente nominata componente effettivo della Commissione regionale per gli Interventi Assistiti con Animali, viene ora indicato come riferimento sul territorio piemontese per l’applicazione degli IAA anche nei contesti ospedalieri ad alta complessità.
Iscriviti al canale Quotidiano Piemontese su WhatsApp, segui la nostra pagina Facebook e continua a leggere Quotidiano Piemontese"
20260220100000,borsaitaliana.it,https://www.borsaitaliana.it/borsa/notizie/radiocor/economia/dettaglio/sanita--schillaci-investire-sul-personale-migliora-qualita--cure-a-cittadini-nRC_20022026_1017_253545056.html,GENERAL_HEALTH;MEDICAL;EPU_CATS_HEALTHCARE;TAX_FNCACT;TAX_FNCACT_CITIZENS;LEGISLATION;EPU_POLICY;EPU_POLICY_LAW;UNGP_FORESTS_RIVERS_OCEANS;CRISISLEX_C03_WELLBEING_HEALTH;TAX_FNCACT_MINISTER;TAX_FNCACT_VICTIMS;CRISISLEX_CRISISLEXREC;CRISISLEX_T08_MISSINGFOUNDTRAPPEDPEOPLE;TAX_FNCACT_DOCTORS;WB_1305_HEALTH_SERVICES_DELIVERY;WB_621_HEALTH_NUTRITION_AND_POPULATION;SOC_AGINGPOPULATION;WB_1448_DEMOGRAPHIC_CHANGE;WB_643_AGING_POPULATION;SCIENCE;SOC_INNOVATION;WB_1331_HEALTH_TECHNOLOGIES;WB_1350_PHARMACEUTICALS;SHORTAGE;TAX_WORLDMAMMALS;TAX_WORLDMAMMALS_HUMAN;CRISISLEX_C07_SAFETY;EPU_POLICY_REFORM;WB_2670_JOBS;USPEC_UNCERTAINTY1;WB_1467_EDUCATION_FOR_ALL;WB_470_EDUCATION;WB_2131_EMPLOYABILITY_SKILLS_AND_JOBS;WB_1484_EDUCATION_SKILLS_DEVELOPMENT_AND_LABOR_MARKET;TAX_FNCACT_NURSES;,"4#Rome, Lazio, Italy#IT#IT07#41.9#12.4833#-126693",,health service;federation the;health care,-0.374531835205992,srclc:ita;eng:GT-ITA 1.0,"Sanita': Schillaci, investire sul personale migliora qualita' cure a cittadini
(Il Sole 24 Ore Radiocor) - Roma, 20 feb - 'Con la legge di bilancio abbiamo dato un segnale forte di attenzione al personale con risorse per nuove assunzioni e per ridurre il ricorso al precariato, abbattere le liste d'attesa e rendere i carichi di lavoro piu' sostenibili. Investire sulle persone e' il modo migliore per investire sulla qualita' delle cure ai pazienti'. Cosi' il ministro della Salute Orazio Schillaci intervenuto alla VI Giornata nazionale del personale sanitario, in ricordo delle vittime del Covid e organizzata a Roma dalla Fnomceo, la Federazione degli Ordini dei medici e degli odontoiatri. 'Negli ultimi anni - ha detto - il nostro Servizio sanitario nazionale ha affrontato prove durissime e oggi si confronta con sfide decisive: l'invecchiamento della popolazione, la complessita' dei bisogni assistenziali, l'innovazione tecnologica e le sfide legate alla medicina territoriale: sfide che per essere vinte richiedono il superamento della carenza di personale e interventi anche sui percorsi formativi per rendere i professionisti piu' adatti alla medicina che rapidamente cambia. Per questo abbiamo avviato un percorso impegnativo di riforme e di rafforzamento strutturale a partire dal capitale umano - ha ricordato -: lo abbiamo fatto non solo con piu' risorse per i rinnovi contrattuali ma anche intervenendo sulla sicurezza con una riforma delle professioni sanitarie attesa da tempo e che punta a potenziare il Ssn contrastando la carenza di personale e ad aggiornare le competenze ridefinendo la formazione, anche degli infermieri su cui c'e' particolare carenza e per cui abbiamo introdotto tre nuove lauree magistrali a indirizzo clinico'.
bag.
Gli ultimi video Radiocor
(RADIOCOR) 20-02-26 10:17:50 (0253)SAN 5 NNNN"
