date_str,source,url,themes,locations,persons,organizations,tone,translation_info,full_text
20260219201500,torinoggi.it,https://www.torinoggi.it/2026/02/19/leggi-notizia/argomenti/sanita-5/articolo/asl-to3-la-terapia-intensiva-oltre-la-tecnica-il-progetto-ri-animali-con-aslan-diventa-best-prac.html,MEDICAL;GENERAL_HEALTH;NATURAL_DISASTER;NATURAL_DISASTER_DROWN;TAX_WORLDMAMMALS;TAX_WORLDMAMMALS_HUMAN;SOC_POINTSOFINTEREST;SOC_POINTSOFINTEREST_HOSPITAL;CRISISLEX_C03_WELLBEING_HEALTH;TAX_FNCACT;TAX_FNCACT_CRITIC;TAX_FNCACT_PILOT;TAX_FNCACT_MANAGER;TAX_FNCACT_GENERAL_MANAGER;LEADER;TAX_FNCACT_PRESIDENT;USPEC_POLITICS_GENERAL1;TAX_FNCACT_REPRESENTATIVE;KILL;UNGP_FORESTS_RIVERS_OCEANS;USPEC_POLICY1;WB_2670_JOBS;WB_2769_JOBS_STRATEGIES;WB_2840_INTEGRATION;WB_2836_MIGRATION_POLICIES_AND_JOBS;WB_1614_NUTRITIONAL_PROGRAMS;WB_1609_FOOD_AND_IN_KIND_TRANSFERS;WB_1615_THERAPEUTIC;WB_1466_SOCIAL_ASSISTANCE;WB_697_SOCIAL_PROTECTION_AND_LABOR;TAX_DISEASE;TAX_DISEASE_INFERTILITY;TAX_DISEASE_PATHOGENS;CRISISLEX_C07_SAFETY;SURVEILLANCE;TAX_FNCACT_DOCTORS;TAX_FNCACT_VETERINARIANS;ALLIANCE;EPU_CATS_MIGRATION_FEAR_FEAR;TAX_WORLDMAMMALS_DOG;WB_566_ENVIRONMENT_AND_NATURAL_RESOURCES;WB_590_ECOSYSTEMS;TAX_FNCACT_DOCTOR;WB_2024_ANTI_CORRUPTION_AUTHORITIES;WB_696_PUBLIC_SECTOR_MANAGEMENT;WB_831_GOVERNANCE;WB_832_ANTI_CORRUPTION;WB_2026_PREVENTION;EPU_UNCERTAINTY;TAX_WORLDMAMMALS_GOLDEN_RETRIEVER;WB_1921_PRIVATE_SECTOR_DEVELOPMENT;WB_405_BUSINESS_CLIMATE;WB_2531_INSPECTIONS_LICENSING_AND_PERMITS;WB_2530_BUSINESS_ENVIRONMENT;TAX_FNCACT_VETERAN;TAX_FNCACT_PASTOR;TAX_ETHNICITY;TAX_ETHNICITY_AUSTRALIAN;MARITIME_INCIDENT;MARITIME;MANMADE_DISASTER_IMPLIED;,"1#Australia#AS#AS#-25#135#AS;1#Mauritius#MP#MP#16#146#MP;5#Piedmont, Piemonte, Italy#IT#IT12#45#8#-124710",,care alliance therapeutic;health piedmont;commission for the interventions,3.00261096605744,srclc:ita;eng:GT-ITA 1.0,"In un contesto sanitario dove l'alta complessità tecnologica rischia spesso di sovrastare la componente umana della cura, la S.C. Anestesia e Rianimazione dell'Ospedale di Rivoli, diretto dal primario Dott. Michele Grio, segna un punto di svolta. Il progetto ""Ri-Animali"", nato come coraggiosa sperimentazione per introdurre gli Interventi Assistiti con Animali (IAA) nel reparto più critico dell'ospedale, supera la fase pilota e si consolida come modello strutturale, forte di un finanziamento specifico erogato dalla Regione Piemonte. Questo riconoscimento istituzionale non è solo un atto amministrativo, ma la certificazione di una visione: quella sostenuta fin dagli esordi dal Direttore Generale dell'ASL TO3, Dott. Giovanni La Valle, convinto che l'eccellenza medica debba necessariamente coniugare le più avanzate tecnologie life-saving con una profonda empatia assistenziale.
PRESTIGIO ISTITUZIONALE E CONTINUITÀ OPERATIVA
A garantire l'eccellenza delle procedure è la partnership consolidata con l'Associazione Aslan. In questa nuova fase, il progetto acquisisce un ulteriore valore aggiunto grazie al ruolo della Dott.ssa Antonia Tarantini, Presidente di Aslan, recentemente nominata Componente effettivo della Commissione per gli Interventi Assistiti con Animali della Regione Piemonte come rappresentante degli enti. Questo incarico proietta il ""Modello Rivoli"" in una dimensione di riferimento regionale, allineando le procedure locali ai più alti standard normativi.
SECONDA INAUGURAZIONE ALLA PRESENZA DELL'ASSESSORE MARRONE
In questo importante traguardo c’è stata la partecipazione dell’Assessore regionale alle Politiche Sociali e dell’integrazione socio-sanitaria, Maurizio Marrone, a testimonianza del valore sociale e dell'impatto trasversale che il ""Modello Rivoli"" riveste per l'intero sistema di welfare e cura della Regione Piemonte che dichiara “Con questo progetto siamo orgogliosi di potenziare le azioni di pet therapy nel reparto di terapia intensiva dell’ospedale di Rivoli. In questo campo Aslan è una garanzia, avendo già dimostrato come gli interventi assistiti con gli animali producano un oggettivo beneficio di carattere terapeutico per i pazienti”.
IL PROTOCOLLO ""ZERO RISCHI"": LA VALIDAZIONE SCIENTIFICA
Il rinnovo del progetto poggia su basi scientifiche solide, frutto di oltre un anno di rigoroso monitoraggio ""bed-side"". La sfida principale era dimostrare la compatibilità tra la presenza di animali e i severi standard di sterilità di una Terapia Intensiva. I dati raccolti sono inequivocabili e disarmano ogni scetticismo: non si è registrato alcun aumento delle infezioni nosocomiali né alcuna variazione qualitativa nella tipologia dei patogeni isolati in reparto. Questo risultato conferma la totale sicurezza biologica del protocollo applicato. La sorveglianza igienicosanitaria, gestita in stretta sinergia tra medici veterinari e personale ospedaliero, ha dimostrato che è possibile umanizzare le cure intensive senza comprometterne la sicurezza clinica, rendendo gli IAA una pratica sicura anche nei setting più delicati.
DALLA CURA ALL'ALLEANZA TERAPEUTICA: IL RAZIONALE CLINICO
L'ingresso dell'équipe a quattro zampe nel reparto risponde a precisi obiettivi neuro-cognitivi e psicologici, andando ben oltre il semplice supporto emotivo. L'interazione con l'animale agisce come potente modulatore dello stress, favorendo la riduzione dell'ansia e della percezione del dolore nei pazienti. Particolarmente rilevante è l'impatto sui pazienti in fase di weaning respiratorio (svezzamento dalla ventilazione meccanica), per i quali la presenza del cane funge da stimolo cognitivo e motorio fondamentale per il recupero. Il beneficio si estende in modo circolare all'intero ecosistema della Rianimazione: per lo staff medico e infermieristico, l'interazione rappresenta un essenziale momento di decompressione emotiva, utile alla prevenzione del burnout professionale. Parallelamente, il progetto rafforza l'alleanza terapeutica con i familiari, che percepiscono l'ambiente come più accogliente, riducendo le tensioni legate alle lunghe attese e all'incertezza clinica.
CECILIA: IL PILASTRO DELLA CONTINUITÀ
Se il progetto oggi è una realtà consolidata, lo si deve in gran parte a Cecilia, una splendida Golden Retriever che da un anno varca regolarmente le soglie della Rianimazione di Rivoli. Cecilia non è solo una ""co-terapeuta"", ma il vero pilastro della continuità operativa: con la sua estrema mitezza e la sua esperienza, ha accompagnato decine di pazienti nel delicato percorso di svezzamento dalla ventilazione meccanica. Il suo lavoro costante ha permesso di affinare i protocolli di interazione, rendendola un punto di riferimento insostituibile non solo per i degenti, ma per l'intera équipe medica che in lei vede una collega a tutti gli effetti.
UN PASSAGGIO DI TESTIMONE: L’EREDITÀ DI NOAH E L'ARRIVO DI WOODY
Il rilancio del progetto si lega al ricordo di Noah, il Golden Retriever colonna portante della fase pionieristica, recentemente scomparso, che ha lasciato un'impronta indelebile nella storia del reparto. Oggi, a raccogliere questa importante eredità e ad affiancare la veterana Cecilia, arriva Woody, un Pastore Australiano di 8 anni. Insieme, Cecilia e Woody garantiranno la prosecuzione di quel ""ponte affettivo"" fondamentale per il recupero neuro-cognitivo dei pazienti, confermando il ""Modello Rivoli"" come eccellenza e riferimento per l'intera Sanità piemontese
In Breve
venerdì 20 febbraio
giovedì 19 febbraio
mercoledì 18 febbraio
Che tempo fa
Rubriche
Accadeva un anno fa
Attualità
Moncalieri"
20260219201500,zazoom.it,https://www.zazoom.it/2026-02-19/allarme-listeria-non-mangiatele-scatta-il-ritiro-urgente-dai-supermercati-italiani-i-lotti/18689188/,TAX_ETHNICITY;TAX_ETHNICITY_ITALIAN;TAX_WORLDLANGUAGES;TAX_WORLDLANGUAGES_ITALIAN;MEDIA_MSM;GENERAL_HEALTH;MEDICAL;TAX_FNCACT;TAX_FNCACT_AUTHORITIES;CRISISLEX_CRISISLEXREC;EPU_POLICY;EPU_POLICY_AUTHORITIES;EPU_CATS_MIGRATION_FEAR_FEAR;USPEC_POLICY1;EPU_POLICY_SPENDING;CRISISLEX_T11_UPDATESSYMPATHY;TAX_ETHNICITY_BLACK;TAX_DISEASE;TAX_DISEASE_SALMONELLA;TAX_FOODSTAPLES;TAX_FOODSTAPLES_EGGS;TAX_DISEASE_POISONING;TAX_DISEASE_FOOD_POISONING;WB_180_FOOD_SAFETY;WB_2988_FOOD_POISONING;WB_435_AGRICULTURE_AND_FOOD_SECURITY;WB_1054_FOOD_BORNE_DISEASES;WB_1967_AGRICULTURAL_RISK_AND_SECURITY;SOC_AGINGPOPULATION;WB_621_HEALTH_NUTRITION_AND_POPULATION;WB_1448_DEMOGRAPHIC_CHANGE;WB_643_AGING_POPULATION;,1#Italy#IT#IT#42.833333#12.833333#IT,,,-7.83289817232376,srclc:ita;eng:GT-ITA 1.0,"Allarme listeria non mangiatele Scatta il ritiro urgente dai supermercati italiani | i lotti
Un richiamo urgente riguarda alcuni lotti di alimenti dopo che è stata trovata la presenza di listeria. La causa è l’identificazione di un’eventuale contaminazione nei prodotti alimentari venduti nei supermercati italiani. Le autorità sanitarie hanno deciso di ritirare immediatamente le confezioni sospette, che sono state già distribuite in diverse regioni. Le catene di negozi stanno rimuovendo gli articoli dai scaffali e invitano i clienti a controllare le date di scadenza. La preoccupazione cresce tra i consumatori che temono di averli già acquistati.
È uno di quei messaggi che nessuno vorrebbe leggere dopo aver fatto la spesa: un avviso secco, che mette in allerta e fa scattare subito la domanda più semplice (e più inquietante): “Ce l’ho anche io in frigo?”. In queste ore, l’attenzione si concentra su alcuni prodotti amatissimi, spesso protagonisti di cene veloci e aperitivi improvvisati. Il punto è che non si parla di un difetto qualunque o di un’etichetta sbagliata: qui entra in gioco un rischio microbiologico segnalato nero su bianco. E quando compaiono certe parole, la prudenza diventa l’unica strada. Il richiamo che fa scattare l’allarme: cosa sta succedendo.🔗 Leggi su Caffeinamagazine.it
“Rischio salmonella, non mangiatele”. Allarme nei supermercati italiani: scatta subito il ritiroNei supermercati italiani scatta il ritiro immediato di alcune uova fresche.
“Contaminato, non lo mangiate”. Scatta il ritiro dai supermercati italiani: l’allarmeUn lotto di pesto alla genovese è stato ritirato dai supermercati Coop in Italia a causa di un sospetto rischio microbiologico.
Vedi altri contenuti disponibili per approfondire la notizia o scorri a sinistra ← per la prossima news.Allarme listeria, ritirato salame nostrano con aglioÈ stato disposto il richiamo di un lotto di salame nostrano con aglio dai supermercati Pam. Il motivo? Possibile presenza del batterio Listeria monocytogenes. Un caso tutt’altro che isolato, ... dilei.it
In Europa aumentano le gravi intossicazioni alimentari da Listeria, allarme delle autorità UEI casi gravi di intossicazione alimentare legati al batterio Listeria sono aumentati in Europa lo scorso anno, probabilmente spinti da cambiamenti nelle diete e dall'invecchiamento della popolazione, ... it.euronews.com
Allerta alimentare # Listeria nel salame: prodotto richiamato e supermercati coinvolti Fate attenzione se lo avete acquistato: non mangiatelo e restituitelo **Pam Panorama** ha segnalato il [richiamo](https://www.pampanorama.it/richiami/salame-nostrano-con- facebook"
20260219181500,pianetagenoa1893.net,https://www.pianetagenoa1893.net/ultimora/linchiesta-horror-sulle-violenze-iraniane-manifestanti-uccisi-e-colpiti-nelle-parti-vitali/,WB_2024_ANTI_CORRUPTION_AUTHORITIES;WB_696_PUBLIC_SECTOR_MANAGEMENT;WB_840_JUSTICE;WB_2025_INVESTIGATION;WB_831_GOVERNANCE;WB_832_ANTI_CORRUPTION;WB_1014_CRIMINAL_JUSTICE;WB_2433_CONFLICT_AND_VIOLENCE;WB_2432_FRAGILITY_CONFLICT_AND_VIOLENCE;UNGP_CRIME_VIOLENCE;PROTEST;KILL;CRISISLEX_T03_DEAD;AFFECT;GENERAL_HEALTH;MEDICAL;CRISISLEX_C03_WELLBEING_HEALTH;TAX_WORLDMAMMALS;TAX_WORLDMAMMALS_CAT;TAX_WORLDMAMMALS_DRILL;SOC_POINTSOFINTEREST;SOC_POINTSOFINTEREST_HOSPITAL;URBAN;TAX_FNCACT;TAX_FNCACT_VICTIMS;CRISISLEX_CRISISLEXREC;CRISISLEX_T08_MISSINGFOUNDTRAPPEDPEOPLE;TAX_DISEASE;TAX_DISEASE_WOUNDS;TAX_FNCACT_DOCTORS;CRISISLEX_C04_LOGISTICS_TRANSPORT;TAX_FNCACT_MAN;TAX_DISEASE_TRAUMA;CRISISLEX_T11_UPDATESSYMPATHY;TAX_FNCACT_WOMAN;WOUND;CRISISLEX_T02_INJURED;ARREST;SOC_GENERALCRIME;CRISISLEX_C07_SAFETY;TAX_FNCACT_DOCTOR;MED_EMERGENCYROOM;TAX_RELIGION;TAX_RELIGION_ISLAMIC;ARMEDCONFLICT;EPU_CATS_NATIONAL_SECURITY;TAX_FNCACT_CONSULTANT;WB_1428_INJURY;WB_1406_DISEASES;WB_621_HEALTH_NUTRITION_AND_POPULATION;WB_1427_NON_COMMUNICABLE_DISEASE_AND_INJURY;TAX_DISEASE_INFERTILITY;TAX_DISEASE_IMPOTENCE;TAX_FNCACT_SURGEON;MANMADE_DISASTER_IMPLIED;DISABILITY;WB_1458_HEALTH_PROMOTION_AND_DISEASE_PREVENTION;WB_635_PUBLIC_HEALTH;WB_1464_HEALTH_OF_THE_DISABLED;TAX_FNCACT_CHILDREN;TAX_WEAPONS;TAX_WEAPONS_GUNS;WB_1609_FOOD_AND_IN_KIND_TRANSFERS;WB_1620_ELDERLY;WB_1466_SOCIAL_ASSISTANCE;WB_1618_FOOD_DISTRIBUTION;WB_697_SOCIAL_PROTECTION_AND_LABOR;TAX_WORLDMAMMALS_BEAR;SOC_POINTSOFINTEREST_HOSPITALS;USPEC_POLICY1;EPU_POLICY;EPU_POLICY_POLICY;WB_1331_HEALTH_TECHNOLOGIES;WB_1350_PHARMACEUTICALS;,"4#Pasdaran, Kohgiluyeh Va Buyer A?Mad, Iran#IR#IR05#30.635#51.8051#-3073976;1#United Kingdom#UK#UK#54#-4#UK;1#Iran#IR#IR#32#53#IR",,reuters,-6.12959719789842,srclc:ita;eng:GT-ITA 1.0,
20260219183000,cittametropolitana.fi.it,http://met.cittametropolitana.fi.it/news.aspx?n=398008,UNGP_FORESTS_RIVERS_OCEANS;TAX_FNCACT;TAX_FNCACT_REPRESENTATIVES;TAX_RELIGION;TAX_RELIGION_CHURCH;TAX_ETHNICITY;TAX_ETHNICITY_ITALIAN;TAX_WORLDLANGUAGES;TAX_WORLDLANGUAGES_ITALIAN;WB_2432_FRAGILITY_CONFLICT_AND_VIOLENCE;WB_1160_SHOCKS_AND_VULNERABILITY;WB_695_POVERTY;ARMEDCONFLICT;TAX_FNCACT_CITIZENS;SOC_AGINGPOPULATION;WB_621_HEALTH_NUTRITION_AND_POPULATION;WB_1448_DEMOGRAPHIC_CHANGE;WB_643_AGING_POPULATION;EPU_ECONOMY;EPU_ECONOMY_HISTORIC;ECON_UNIONS;EDUCATION;WB_470_EDUCATION;SOC_POINTSOFINTEREST;SOC_POINTSOFINTEREST_SCHOOL;,"4#Livorno, Toscana, Italy#IT#IT16#43.55#10.3167#-120258;1#Italy#IT#IT#42.833333#12.833333#IT;5#Emilia-Romagna, Emilia-Romagna, Italy#IT#IT05#44.75#11#-117029;4#Rome, Lazio, Italy#IT#IT07#41.9#12.4833#-126693",,,-1.02669404517454,srclc:ita;eng:GT-ITA 1.0,"Anci Toscana
«Piccoli Comuni, presidi strategici della Toscana diffusa»
cIn Toscana qui vivono 271.064 persone, pari al 7,4% del totale
«I piccoli Comuni rappresentano una componente strategica della nostra regione, che dobbiamo preservare e tutelare dai fenomeni di spopolamento e abbandono». È il commento di Marco Ermini, sindaco di Castiglion Fibocchi, che oggi ha preso parte proprio agli Stati generali dei piccoli Comuni a Roma. Presenti all’incontro, insieme ai rappresentanti di Anci Toscana, quelli di altri Comuni della regione, fra i quali: Lucignano (Arezzo); San Godenzo (Firenze); Suvereto (Livorno); Careggine, Gallicano, Pescaglia, San Romano in Garfagnana e Stazzema per la provincia di Lucca; Castellina Marittima, Chianni, Fauglia, Guardistallo, Santa Luce per la provincia di Pisa; Abetone Cutigliano e Chiesina Uzzanese per la zona pistoiese; Casole d'Elsa e Cetona per l’area senese.
In Toscana, su un totale di 273 Comuni, se ne contano circa 118 con meno di 5.000 abitanti e 21 con meno di 1.000 abitanti. Secondo l’ultimo dossier Anci, elaborato su dati Istat, in Toscana sono 271.064 le persone residenti nei piccoli Comuni (pari al 7,4% della popolazione totale). Guardando al quadro nazionale, rispetto ad altre regioni italiane, il dato è contenuto: la Toscana risulta al penultimo posto per incidenza della popolazione residente nei piccoli Comuni, preceduta da Lazio ed Emilia-Romagna (entrambe al 7,6%) e seguita dalla Puglia (5,6%). Il tema resta però centrale nella lotta allo spopolamento delle aree interne e nel generale sforzo per mantenere presidi strategici nella Toscana Diffusa.
Sebbene la condizione di “piccolo Comune” non coincida automaticamente con quella di fragilità, i dati mostrano criticità rilevanti. Assumendo come riferimento i risultati dell’Indice di Fragilità Comunale (Icf), indicatore multidimensionale elaborato da Istat che misura la vulnerabilità dei Comuni italiani sintetizzando rischi naturali/antropici, fattori demo-sociali ed economici, in Toscana sono 15 i piccoli Comuni (12,6% del totale, per una popolazione di 34.244 abitanti) esposti a livello di rischio massimo o molto alto; 13 sono invece esposti a livelli minimi o molto bassi (10,9% del totale, per 27.803 abitanti).
«Quello dello spopolamento dei piccoli Comuni è un tema che racchiude le sfide di una gestione in cui le risorse sono limitate e la necessità di garantire servizi si scontra con organici ridotti e iter sempre più articolati – afferma Jessica Pasquini, sindaca di Suvereto -. Gestire un piccolo Comune vuol dire avere un rapporto diretto con i cittadini e confrontarsi ogni giorno con esigenze sempre più complesse: dall’invecchiamento della popolazione alla cura del territorio fino alla digitalizzazione dei servizi. Tutto questo avviene con risorse economiche limitate, pur dovendo rispettare gli stessi obblighi amministrativi previsti per le realtà più grandi. Anche quando si riescono a intercettare finanziamenti importanti, come quelli del Pnrr, per realizzare progetti efficaci servono risorse più stabili e strutturate, sia economiche che professionali».
Importante, in questo senso, anche fare squadra. In Toscana si registrano 22 Unioni dei Comuni (5,1% sul totale) che gestiscono diverse funzioni/servizi in funzione associata. Ampiamente gestita in forma associata è la funzione di Protezione Civile ma anche lo Sportello unico attività produttive, la funzione di Istruzione e servizi scolastici e quello di Statistica.
19/02/2026 17.14
Anci Toscana"
