date_str,source,url,themes,locations,persons,organizations,tone,translation_info,full_text
20260212211500,euronews.com,https://it.euronews.com/2026/02/12/la-francia-cerca-piu-figli-con-assegni-da-250-euro-e-congedo-parentale-molti-restano-scett,TAX_FNCACT;TAX_FNCACT_CHILDREN;GENERAL_GOVERNMENT;EPU_POLICY;EPU_POLICY_GOVERNMENT;TAX_FNCACT_CITIZENS;TAX_ETHNICITY;TAX_ETHNICITY_FRENCH;TAX_WORLDLANGUAGES;TAX_WORLDLANGUAGES_FRENCH;UNGP_FORESTS_RIVERS_OCEANS;TAX_DISEASE;TAX_DISEASE_INFERTILITY;CRISISLEX_T11_UPDATESSYMPATHY;KILL;CRISISLEX_CRISISLEXREC;CRISISLEX_T02_INJURED;CRISISLEX_T03_DEAD;USPEC_POLICY1;EPU_POLICY_POLICY;TAX_FNCACT_CHILD;LEADER;TAX_FNCACT_PRESIDENT;USPEC_POLITICS_GENERAL1;TAX_FNCACT_WOMAN;PROTEST;STRIKE;TAX_FNCACT_DIRECTOR;WB_336_NON_BANK_FINANCIAL_INSTITUTIONS;WB_1920_FINANCIAL_SECTOR_DEVELOPMENT;WB_612_HOUSING_FINANCE;WB_332_CAPITAL_MARKETS;ECON_INTEREST_RATES;WB_1921_PRIVATE_SECTOR_DEVELOPMENT;WB_405_BUSINESS_CLIMATE;WB_2531_INSPECTIONS_LICENSING_AND_PERMITS;WB_2530_BUSINESS_ENVIRONMENT;CRISISLEX_C07_SAFETY;EPU_CATS_ENTITLEMENT_PROGRAMS;EPU_POLICY_BUDGET;TAX_FNCACT_FATHER;ECON_TAXATION;EPU_POLICY_TAX;EPU_CATS_TAXES;TAX_FNCACT_ECONOMIST;EDUCATION;TAX_FNCACT_TEACHER;TAX_FNCACT_ECONOMISTS;SCIENCE;TAX_ECON_PRICE;ECON_INFLATION;WB_1104_MACROECONOMIC_VULNERABILITY_AND_DEBT;WB_442_INFLATION;UNEMPLOYMENT;WB_2745_JOB_QUALITY_AND_LABOR_MARKET_PERFORMANCE;WB_2670_JOBS;WB_2689_JOBS_DIAGNOSTICS;WB_2747_UNEMPLOYMENT;UNGP_JOB_OPPORTUNITIES_EMPLOYMENT;WB_1467_EDUCATION_FOR_ALL;WB_470_EDUCATION;WB_2131_EMPLOYABILITY_SKILLS_AND_JOBS;WB_1484_EDUCATION_SKILLS_DEVELOPMENT_AND_LABOR_MARKET;RETIREMENT;WB_2748_EMPLOYMENT;IMMIGRATION;WB_2769_JOBS_STRATEGIES;WB_2837_IMMIGRATION;WB_2836_MIGRATION_POLICIES_AND_JOBS;EPU_CATS_MIGRATION_FEAR_MIGRATION;GENERAL_HEALTH;MEDICAL;EPU_CATS_HEALTHCARE;WB_696_PUBLIC_SECTOR_MANAGEMENT;WB_2048_COMPENSATION_CAREERS_AND_INCENTIVES;WB_723_PUBLIC_ADMINISTRATION;WB_724_HUMAN_RESOURCES_FOR_PUBLIC_SECTOR;TAX_FNCACT_WOMEN;TAX_ETHNICITY_PORTUGUESE;TAX_WORLDLANGUAGES_PORTUGUESE;TAX_FNCACT_AUTHORITIES;EPU_POLICY_AUTHORITIES;TAX_FNCACT_GUARD;WB_855_LABOR_MARKETS;WB_697_SOCIAL_PROTECTION_AND_LABOR;WB_2470_PEACE_OPERATIONS_AND_CONFLICT_MANAGEMENT;WB_2432_FRAGILITY_CONFLICT_AND_VIOLENCE;WB_2490_NATIONAL_PROTECTION_AND_SECURITY;EPU_CATS_NATIONAL_SECURITY;,"4#Paris, France (General), France#FR#FR00#48.8667#2.33333#-1456928;4#Vendee, France (General), France#FR#FR00#46.323#-0.961904#-1475349;1#France#FR#FR#46#2#FR;1#Greece#GR#GR#39#22#GR;1#Italy#IT#IT#42.833333#12.833333#IT;1#Portugal#PO#PO#39.5#-8#PO",,union european,1.25994694960212,srclc:ita;eng:GT-ITA 1.0,"Una commissione parlamentare propone un piano per rilanciare il tasso di natalità in Francia. La questione divide profondamente, sia gli esperti che l'opinione pubblica
Lucie ricorda l'imbarazzo che ha provato quando ha saputo che una lettera governativa sul declino della fertilità sarebbe stata presto inviata ai cittadini francesi di età superiore ai 29 anni.
In Francia il progetto è ancora in fase di preparazione e non è ancora stato reso pubblico, ma ha già suscitato aspre critiche. ""Ho trovato l'approccio estremamente maldestro e non è affatto il modo giusto per sensibilizzare l'opinione pubblica"", afferma la 27enne incontrata da Euronews.
Lucie vorrebbe avere dei figli un giorno, ma si sente frenata dalla sua vita quotidiana sotto pressione. ""Il problema va oltre l'infertilità. Stiamo lottando per trovare un posto dove vivere e arrivare a fine mese. Penso che scrivere una lettera per incoraggiarci ad avere figli sia spaventoso"".
Francia, lettera ai giovani per fare figli
Quello di Lucie è un sentimento ampiamente condiviso, in un momento in cui la Francia sta attraversando una svolta demografica senza precedenti.
Nel 2025, per la prima volta dalla Seconda Guerra Mondiale, il Paese ha registrato più morti che nascite. Secondo l'Institut national de la statistique et des études économiques (Insee), l'anno scorso sono nati 645mila bambini (contro gli oltre 850mila del 2010) e sono morti 651mila francesi.
È in questo contesto che una commissione d'inchiesta parlamentare sulle cause e le conseguenze del calo della natalità ha presentato mercoledì 37 proposte, chiedendo un ""big bang"" per la politica familiare.
""In Francia c'è un desiderio molto forte di bambini. L'obiettivo del nostro lavoro non è affatto quello di lanciare una sorta di ingiunzione pro-natalità, ma di sostenere i genitori che vogliono avere un figlio"", ha sottolineato Constance de Pélichy, deputata del gruppo misto Libertés, indépendants, outre-mer et territoires (Liot) e presidente della commissione, in un'intervista a Euronews.
Secondo diversi studi, i francesi desiderano in media 2-2,3 figli per donna, ben al di sopra del tasso di fertilità effettivo di 1,55 figli nel 2025 rispetto a una media di 1,38 figli per donna nell'Unione Europea.
Assistenza universale per ogni bambino e ripensamento del congedo parentale
La misura più eclatante delle 37 proposte è un ""assegno familiare universale"" di 250 euro al mese per figlio, versato dal primo figlio fino ai 20 anni, senza distinzione di reddito, in sostituzione di parte del sostegno esistente.
L'investimento è stimato in 10 miliardi di euro all'anno. Secondo il rapporto, questa importante revisione potrebbe avvenire entro il 2030. Si tratterebbe di un cambiamento importante, dato che attualmente gli assegni familiari vengono erogati a partire dal secondo figlio.
Per Jean-Philippe Vallat, direttore delle politiche familiari dell'Union nationale des associations familiales (Unaf), questo approccio è un passo nella giusta direzione: ""Siamo totalmente d'accordo con questo approccio. Il rapporto sottolinea gli ostacoli materiali e finanziari"".
È ""un approccio abbastanza universale che corrisponde ai problemi che i genitori condividono con noi da anni"", ha detto a Euronews Vallat.
Le conclusioni della commissione raccomandano anche un nuovo mutuo a tasso zero per l'acquisto o l'ampliamento della casa familiare ""per ogni nascita"", al fine di affrontare un ostacolo sempre più pesante, quello degli alloggi.
Si esorta anche ad aumentare il numero di soluzioni per l'assistenza all'infanzia pure quando le famiglie si affidano ad amici e parenti per integrare le soluzioni esistenti.
Il rapporto propone di creare un regime di congedo parentale unificato che consenta ai genitori di stare con il proprio figlio fino all'inizio della scuola materna, con un primo anno meglio compensato.
Dopo il congedo di maternità e paternità, quello parentale sarebbe pagato al 70 per cento dello stipendio per quattro mesi, e poi al 50 per sei mesi (fino al massimale della sicurezza sociale).
Constance de Pélichy, da parte sua, sostiene un ""congedo universale di nascita"" più breve e meglio retribuito, proponendo 38 settimane pagate all'80 per cento dello stipendio.
Quali sono le proposte in Francia per il sostegno alla natalità
Le proposte presentate sono lontane dal consenso dei francesi interpellati o degli esperti.
Lise, una donna di 30 anni, contestualizza i 250 euro, definiti appena ""il budget per i pannolini, quindi non contano nulla"". Anche Alexis, giovane padre di una bambina nella regione dellan Vandea, definisce le misure come ""meschine"".
""L'indennità di alloggio potrebbe essere una soluzione. Per quanto riguarda il congedo parentale, penso che anche quello sia buono... Ma in generale, dobbiamo rivedere l'intero sistema. Penso che ci siano troppe tasse ed è questo che ci impedisce di avere un secondo figlio oggi"", dice Alexis.
Per Pauline Rossi, economista e docente all'École Polytechnique, il piano probabilmente andrà a beneficio delle famiglie più privilegiate. ""Gli assegni familiari universali sono destinati a favorire le famiglie più ricche. Come economisti, cerchiamo di mirare all'obiettivo. L'universalità è l'opposto di una spesa pubblica efficiente"", spiega Rossi a Euronews.
A suo avviso, le politiche familiari hanno generalmente effetti limitati sul tasso di natalità. ""È più sul secondo o terzo figlio che la dimensione finanziaria entra davvero in gioco"", osserva Rossi.
I ricercatori sembrano d'accordo sul fatto che a pesare sulla decisione di fare figli siano soprattutto gli aiuti all'infanzia e gli asili nido. ""Ci sono proposte per un piano Marshall per l'assistenza all'infanzia, ma la questione dei costi rimane piuttosto imprecisa"", ha commentato a Euronews Vallat dell'Unaf.
In altre parole, lo Stato può talvolta influenzare una decisione di genitori già impegnati, ma ha più difficoltà a influenzare una coppia che ancora esita a passare da zero figli a uno.
A Parigi, Mélanie e Florian sono un caso emblematico. Lei vuole figli, lui no. Mélanie pensa che ""un'inflazione più bassa, una disoccupazione più bassa e una politica più stabile""sarebbero più decisivi per ripristinare la fiducia.
Florian, dal canto suo, preferisce misure ancora più concrete. ""Sarebbe meglio rendere gratuiti i pannolini e abbassare il prezzo degli asili nido"", pur ammettendo che questo non gli farebbe cambiare idea sull'avere bambini.
Dietro le tante testimonianze raccolte da Euronews, c'è una richiesta ricorrente. Per ""rilanciare"" le nascite, molti preferirebbero altre condizioni come meno inflazione, più posti di lavoro, stipendi migliori e prezzi più sopportabili nel quotidiano.
Perché il calo delle nascite è preoccupante
L'andamento demografico incide in prospettiva sul modello di welfare francese, come già per altri Paesi tra cui l'Italia.
""Il fatto che il tasso di natalità sia in calo è preoccupante per il finanziamento delle pensioni e della spesa pubblica"", sottolinea Pauline Rossi.
Oltre a questa pressione sulle finanze pubbliche, c'è anche la questione della forza lavoro. In alcuni settori già sotto pressione, una popolazione lavorativa più ridotta può rendere più difficili le assunzioni e pesare sulla crescita.
Gli esperti sottolineano, tuttavia, che anche la produttività, i tassi di occupazione, l'immigrazione e le politiche del lavoro potrebbero attutire l'impatto del calo demografico.
Per l'economista dell'École Polytechnique ""sono opzioni dolorose"". ""Si devono abbassare le pensioni di anzianità e ridurre il rimborso delle spese sanitarie, o si deve abbassare il livello della popolazione attiva, o si deve far lavorare le persone più a lungo"", spiega Rossi.
Cosa fanno gli altri Paesi europei?
La Francia non è un caso isolato. In tutta Europa, il calo del tasso di natalità sta alimentando il dibattito pubblico e spingendo i governi a introdurre una serie di misure, con risultati contrastanti.
Nel Regno Unito, il tasso di fertilità è sceso a 1,41-1,44 figli per donna entro il 2024-2025. In risposta a questo calo, il governo si è concentrato sull'accesso ai servizi per l'infanzia e al congedo parentale.
L'ultima misura è l'estensione del finanziamento pubblico per 30 ore di assistenza all'infanzia a settimana a partire dai nove mesi di età, per le famiglie che guadagnano meno di 100.000 sterline all'anno.
In Italia la situazione è particolarmente preoccupante. Nel 2024, il Paese ha registrato un nuovo minimo storico, con circa 370.000 nascite. La fertilità è scesa a 1,18 figli per donna, uno dei valori più bassi in Europa.
Le recenti misure sono volte principalmente a sostenere le famiglie esistenti, in particolare quelle numerose, piuttosto che a incoraggiare nuove nascite. Il governo ha stanziato 1 miliardo di euro per misure legate alla famiglia e alla natalità: esenzione dai contributi sociali, miglioramento del congedo parentale con un secondo mese pagato all'80 per cento e aumento del ""bonus maternità"" a 3.600 euro per le famiglie con un figlio di età inferiore ai 10 anni, secondo l'Osservatorio europeo sui sistemi e le politiche sanitarie.
Il Portogallo, invece, rappresenta un'eccezione. Nel 2025 il Paese ha registrato più di 87.700 nascite, il livello migliore degli ultimi dieci anni. Questa ripresa è fragile, però, visto il crescente ritardo nella nascita dei figli.
Le donne portoghesi hanno il primo figlio in media all'età di 30 anni, più di tre anni dopo rispetto a vent'anni fa. Con un tasso di fertilità di 1,44, il Portogallo rimane leggermente al di sopra della media europea. Il governo sostiene il tasso di natalità attraverso aiuti finanziari, indennità prenatali, aumento del congedo parentale e detrazioni fiscali fino a 900 euro per figlio.
In Grecia il governo ha annunciato un piano da 1,6 miliardi di euro lo scorso settembre per affrontare il declino demografico, concentrandosi su sgravi fiscali e altri incentivi finanziari per incoraggiare le nascite.
Con una fertilità di circa 1,4 figli per donna, le autorità mettono in guardia dai rischi per le pensioni, la salute, il mercato del lavoro e, più in generale, la sicurezza nazionale in un contesto geopolitico teso."
20260212221500,zazoom.it,https://www.zazoom.it/2026-02-12/francia-piano-per-il-futuro-sostegno-alla-fertilita-e-lotta-al-calo-delle-nascite-tra-i-giovani/18642644/,MEDIA_MSM;GENERAL_GOVERNMENT;EPU_POLICY;EPU_POLICY_GOVERNMENT;TAX_ETHNICITY;TAX_ETHNICITY_FRENCH;TAX_WORLDLANGUAGES;TAX_WORLDLANGUAGES_FRENCH;WB_696_PUBLIC_SECTOR_MANAGEMENT;WB_2048_COMPENSATION_CAREERS_AND_INCENTIVES;WB_723_PUBLIC_ADMINISTRATION;WB_724_HUMAN_RESOURCES_FOR_PUBLIC_SECTOR;TAX_ECON_PRICE;TAX_FNCACT;TAX_FNCACT_CHILDREN;USPEC_UNCERTAINTY1;TAX_FNCACT_EXECUTIVE;UNREST_BELLIGERENT;UNGP_FORESTS_RIVERS_OCEANS;GENERAL_HEALTH;MEDICAL;WB_621_HEALTH_NUTRITION_AND_POPULATION;WB_639_REPRODUCTIVE_MATERNAL_AND_CHILD_HEALTH;TAX_FOODSTAPLES;TAX_FOODSTAPLES_EGGS;WB_1453_CONTRACEPTIVES;WB_641_REPRODUCTIVE_AND_MATERNAL_HEALTH;WB_1452_FAMILY_PLANNING;CRISISLEX_CRISISLEXREC;LEGISLATION;EPU_POLICY_LAW;TAX_DISEASE;TAX_DISEASE_INFERTILITY;MILITARY;TAX_MILITARY_TITLE;TAX_MILITARY_TITLE_SOLDIERS;TAX_FNCACT_SOLDIERS;ARMEDCONFLICT;EPU_CATS_NATIONAL_SECURITY;TAX_FNCACT_WOMEN;LEADER;TAX_FNCACT_PRESIDENT;USPEC_POLITICS_GENERAL1;TAX_FNCACT_CITIZENS;WB_845_LEGAL_AND_REGULATORY_FRAMEWORK;WB_1024_PUBLIC_INTERNATIONAL_LAW;WB_1026_TREATIES;WB_962_INTERNATIONAL_LAW;,"1#France#FR#FR#46#2#FR;4#Moscow, Moskva, Russia#RS#RS48#55.7522#37.6156#-2960561;4#Paris, France (General), France#FR#FR00#48.8667#2.33333#-1456928",,initiative french,1.60965794768612,srclc:ita;eng:GT-ITA 1.0,
20260214144500,greenme.it,https://www.greenme.it/lifestyle/sai-cosa-compri/mele-un-mix-di-pesticidi-e-pfas-solo-il-7-dei-campioni-analizzati-ne-e-completamente-priva/,GENERAL_HEALTH;MEDICAL;TAX_FNCACT;TAX_FNCACT_DOCTOR;ALLIANCE;UNGP_FORESTS_RIVERS_OCEANS;CRISISLEX_C07_SAFETY;TAX_DISEASE;TAX_DISEASE_CONVENTIONAL;WB_178_PEST_MANAGEMENT;WB_174_CROP_PRODUCTION;WB_435_AGRICULTURE_AND_FOOD_SECURITY;WB_1949_CLIMATE_SMART_AGRICULTURE;WB_2914_PESTICIDES;TAX_FNCACT_CRITIC;TAX_FNCACT_CANDIDATES;IDEOLOGY;BAN;PROTEST;MOVEMENT_GENERAL;TAX_FNCACT_ACTIVIST;FOOD_SECURITY;WB_199_FOOD_SECURITY;WB_1967_AGRICULTURAL_RISK_AND_SECURITY;UNGP_AFFORDABLE_NUTRITIOUS_FOOD;EPU_POLICY;EPU_POLICY_REGULATORY;LEGISLATION;EPU_POLICY_LAW;TAX_DISEASE_INFERTILITY;TAX_DISEASE_CANCER;WB_1406_DISEASES;WB_1431_CANCER;WB_621_HEALTH_NUTRITION_AND_POPULATION;WB_1427_NON_COMMUNICABLE_DISEASE_AND_INJURY;CRISISLEX_CRISISLEXREC;TAX_FNCACT_AUTHORITIES;EPU_POLICY_AUTHORITIES;TAX_FNCACT_EXECUTIVE;TAX_FNCACT_DIRECTOR;TAX_FNCACT_EXECUTIVE_DIRECTOR;TAX_ETHNICITY;TAX_ETHNICITY_ITALIAN;TAX_WORLDLANGUAGES;TAX_WORLDLANGUAGES_ITALIAN;TAX_FNCACT_PEASANTS;TAX_FNCACT_CHILDREN;USPEC_POLITICS_GENERAL1;USPEC_POLICY1;EPU_POLICY_LEGISLATION;PRIVATIZATION;ECON_DEREGULATION;WB_728_PUBLIC_SERVICE_DELIVERY;WB_1283_PRIVATIZATION;WB_696_PUBLIC_SECTOR_MANAGEMENT;WB_723_PUBLIC_ADMINISTRATION;WB_721_STATE_OWNED_ENTERPRISES;EPU_ECONOMY_HISTORIC;AGRICULTURE;TAX_FNCACT_CITIZENS;WB_566_ENVIRONMENT_AND_NATURAL_RESOURCES;WB_590_ECOSYSTEMS;,1#Italy#IT#IT#42.833333#12.833333#IT,,countries union;authority european;commission european;union european,-5.15247108307045,srclc:ita;eng:GT-ITA 1.0,"Sai cosa c’è nelle mele che mangi ogni giorno? Cosa è emerso analizzando 59 campioni di tutta Europa
Indice
Il celebre detto “una mela al giorno toglie il medico di torno” merita oggi una rilettura più cauta, almeno alla luce dei risultati dell’ultimo rapporto pubblicato da PAN Europe, la coalizione che riunisce organizzazioni ambientaliste attive in numerosi Paesi dell’Unione. L’indagine, condotta su 59 campioni di mele provenienti da 13 Stati europei, Italia inclusa, restituisce un quadro che solleva interrogativi seri sulla sicurezza di uno dei frutti più consumati nel nostro Paese.
I dati parlano chiaro:
- L’85% delle mele convenzionali analizzate contiene residui di più pesticidi
- Solo il 7% dei campioni risulta completamente privo di tracce chimiche
Cosa è emerso dalle analisi sulle mele
L’aspetto più critico riguarda la natura delle sostanze individuate. Il 64% dei campioni analizzati in Europa presenta almeno un pesticida appartenente alla famiglia dei PFAS, le ormai celebri “sostanze chimiche eterne” che possiedono capacità di persistere nell’ambiente e di accumularsi negli organismi viventi per periodi molto lunghi.
A questo si aggiunge un altro dato rilevante: il 36% delle mele contiene pesticidi neurotossici, mentre il 71% mostra la presenza di sostanze classificate dall’Unione europea come “candidati alla sostituzione”, una categoria che include i principi attivi considerati più pericolosi e destinati, almeno sulla carta, a una progressiva eliminazione dal mercato.
Particolarmente diffusa risulta la presenza di Fludioxonil, rilevato in quasi il 40% dei campioni. Questo pesticida PFAS è stato riconosciuto dall’UE come interferente endocrino nel 2024 e avrebbe dovuto essere ritirato, ma la messa al bando resta bloccata da oltre un anno a causa delle resistenze degli Stati membri.
Il rischio dell’effetto cocktail
Secondo gli esperti, la criticità maggiore non riguarda la singola sostanza, ma la combinazione di più residui chimici presenti nello stesso alimento. L’esposizione simultanea a pesticidi diversi, definita effetto cocktail, può produrre interazioni complesse e amplificare i rischi per la salute.
Queste le parole di Gergely Simon, attivista di PAN Europe:
L’Autorità europea per la sicurezza alimentare è stata incaricata 20 anni fa di sviluppare una metodologia per regolamentare gli effetti combinati dei pesticidi, ma non ha ancora adempiuto a questo obbligo di legge. Le evidenze scientifiche collegano sempre più l’esposizione cronica ai pesticidi a problemi di infertilità e potenzialmente al cancro.
C’è spazio anche per un duro attacco verso le autorità che si occupano di regole e controlli, proveniente da Martin Dermine, il direttore esecutivo di PAN Europe:
Se la legge fosse applicata correttamente, una serie di pesticidi rilevati nelle mele sarebbe stata vietata molto tempo fa, come l’acetamiprid, tossico per lo sviluppo cerebrale, o il difenoconazolo, un interferente endocrino e neurotossico.
Il caso delle mele italiane
Il rapporto dedica un’attenzione specifica alla situazione italiana, con un focus sulla produzione dell’Alto Adige, area simbolo dell’eccellenza melicola nazionale. Le analisi hanno riguardato cinque campioni raccolti a settembre 2025 nei mercati contadini della Val Venosta, in località come Rabland ed Eyrs.
Il risultato appare tutt’altro che rassicurante, visto che l’80% delle mele italiane esaminate, appartenenti a varietà molto diffuse come Golden Delicious, Gala, Pinova, Jonagold e Sweetango, contiene residui di pesticidi. In tutti i campioni contaminati emerge la presenza di un mix di più sostanze contemporaneamente. Colpisce anche il contesto di vendita, dal momento che i campioni provengono da mercati contadini locali, luoghi che molti consumatori associano a freschezza, genuinità e minor impatto chimico.
Un ulteriore elemento di allarme riguarda la tipologia dei residui, perché il 100% delle mele italiane contaminate presenta pesticidi PFAS e sostanze classificate come “candidati alla sostituzione”.
L’unica differenza positiva rispetto ad altri Paesi europei riguarda l’assenza di pesticidi neurotossici nei campioni italiani analizzati.
In definitiva, solo una mela su cinque risulta completamente priva di tracce chimiche, un dato che conferma come la contaminazione rappresenti ormai la regola e non più l’eccezione.
Un paradosso normativo che riguarda anche i bambini
Il rapporto evidenzia un paradosso difficilmente ignorabile, in cui le stesse mele vendute liberamente ai consumatori adulti non potrebbero essere utilizzate per alimenti destinati ai bambini sotto i tre anni. La normativa europea impone infatti limiti molto più severi per i prodotti rivolti alla prima infanzia, riconoscendo i rischi legati all’esposizione ai pesticidi durante le fasi di sviluppo.
Molti genitori non sanno che offrire ai propri figli frutta e verdura fresca “convenzionale” può aumentare l’esposizione ai pesticidi anche di oltre 600 volte, rispetto, ad esempio, agli alimenti trasformati specificamente pensati per i neonati.
La proposta Omnibus e il rischio deregulation
A complicare ulteriormente il quadro interviene la recente proposta della Commissione europea, conosciuta come Omnibus, testo che punta ad una deregolamentazione del settore, con l’introduzione di periodi di approvazione illimitati per i pesticidi e l’eliminazione dell’obbligo di riesame ogni 10-15 anni alla luce delle nuove conoscenze scientifiche.
In concreto, gli Stati membri potrebbero autorizzare l’uso di determinate sostanze, ignorando gli studi più recenti sulla possibile pericolosità, una scelta folle che rappresenta un netto arretramento nella tutela della salute pubblica e dell’ambiente.
PAN Europe e le 13 organizzazioni partner coinvolte nell’indagine, tra cui Générations Futures, PAN Germany ed Ecologistas en Acción, esprimono una netta opposizione alla proposta e chiedono invece un’applicazione più rigorosa delle regole già esistenti.
Cosa possono fare i consumatori italiani
In attesa di interventi normativi più efficaci, PAN Europe suggerisce alcune pratiche precauzioni. La prima resta la scelta di mele biologiche, coltivate senza pesticidi di sintesi. Se acquistate prodotti convenzionali, sbucciateli per ridurre l’esposizione ai residui, che si concentrano soprattutto sulla buccia.
Resta evidente, però, che la responsabilità non possa più ricadere solo sulle scelte individuali. Il tema delle mele italiane, simbolo di salute e tradizione alimentare, chiama in causa un modello agricolo e normativo che dovrebbe mettere al centro la protezione dei cittadini e degli ecosistemi, prima degli interessi dell’industria agrochimica.
Il report completo è disponibile sul sito di PAN Europe.
Fonte: PAN Europe
Leggi anche:
- Troppi pesticidi nelle mele dell’Alto Adige: “fino a 25 trattamenti a raccolto”, lanciata la petizione per vietare i più pericolosi
- Sbucciate sempre le mele: lavarle non basta a rimuovere i pesticidi, lo conferma questo studio
- Non solo sui meleti, i pesticidi contaminano tutta la Val Venosta (cime delle montagne comprese)"
20260214123000,tech.everyeye.it,https://tech.everyeye.it/notizie/patologia-ritorna-paura-uomini-diagnosticava-subito-859651.html,EPU_CATS_MIGRATION_FEAR_FEAR;GENERAL_HEALTH;MEDICAL;TAX_FNCACT;TAX_FNCACT_DOCTORS;CRISISLEX_C03_WELLBEING_HEALTH;MILITARY;WB_855_LABOR_MARKETS;WB_1673_PASSIVE_LABOR_MARKETS_POLICIES;WB_1674_HEALTH_AND_SAFETY_CONDITIONS;WB_697_SOCIAL_PROTECTION_AND_LABOR;TAX_FNCACT_CITIZENS;TAX_DISEASE;TAX_DISEASE_DISEASES;WB_1406_DISEASES;WB_621_HEALTH_NUTRITION_AND_POPULATION;UNGP_HEALTHCARE;UNREST_BELLIGERENT;TAX_DISEASE_INFERTILITY;CRISISLEX_CRISISLEXREC;TAX_FNCACT_SURGEONS;TAX_FNCACT_DOCTOR;,1#Italy#IT#IT#42.833333#12.833333#IT,,,-2.54237288135593,srclc:ita;eng:GT-ITA 1.0,
20260214080000,tempi.it,https://www.tempi.it/auguri-e-figli-surgelati-la-risposta-francese-alla-denatalita-e-il-freezer/,TAX_ETHNICITY;TAX_ETHNICITY_FRENCH;TAX_WORLDLANGUAGES;TAX_WORLDLANGUAGES_FRENCH;TAX_DISEASE;TAX_DISEASE_INFERTILITY;CONSTITUTIONAL;TAX_FNCACT;TAX_FNCACT_CITIZENS;TAX_FNCACT_CHILDREN;GENERAL_GOVERNMENT;EPU_POLICY;EPU_POLICY_GOVERNMENT;ARMEDCONFLICT;EPU_CATS_NATIONAL_SECURITY;KILL;CRISISLEX_CRISISLEXREC;CRISISLEX_T02_INJURED;CRISISLEX_T03_DEAD;TAX_FNCACT_WOMAN;WB_1921_PRIVATE_SECTOR_DEVELOPMENT;WB_405_BUSINESS_CLIMATE;WB_2531_INSPECTIONS_LICENSING_AND_PERMITS;WB_2530_BUSINESS_ENVIRONMENT;TAX_FNCACT_MINISTER;GENERAL_HEALTH;MEDICAL;TAX_FNCACT_CHILD;USPEC_POLICY1;EPU_POLICY_POLICY;WB_2024_ANTI_CORRUPTION_AUTHORITIES;WB_696_PUBLIC_SECTOR_MANAGEMENT;WB_831_GOVERNANCE;WB_832_ANTI_CORRUPTION;WB_2026_PREVENTION;TAX_FNCACT_WOMEN;TAX_FOODSTAPLES;TAX_FOODSTAPLES_EGGS;WB_1305_HEALTH_SERVICES_DELIVERY;WB_621_HEALTH_NUTRITION_AND_POPULATION;TAX_ECON_PRICE;TAX_POLITICAL_PARTY;TAX_POLITICAL_PARTY_REPUBLICAN;USPEC_POLITICS_GENERAL1;TAX_DISEASE_SYNDROME;MEDIA_MSM;WB_1973_FINANCIAL_RISK_REDUCTION;WB_435_AGRICULTURE_AND_FOOD_SECURITY;WB_337_INSURANCE;WB_1967_AGRICULTURAL_RISK_AND_SECURITY;WB_2670_JOBS;WB_2048_COMPENSATION_CAREERS_AND_INCENTIVES;WB_723_PUBLIC_ADMINISTRATION;WB_724_HUMAN_RESOURCES_FOR_PUBLIC_SECTOR;DELAY;WB_137_WATER;NATURAL_DISASTER;NATURAL_DISASTER_ICE;EPU_CATS_MIGRATION_FEAR_FEAR;CRISISLEX_T11_UPDATESSYMPATHY;WB_678_DIGITAL_GOVERNMENT;WB_2943_SWITCHES;WB_667_ICT_INFRASTRUCTURE;WB_672_NETWORK_MANAGEMENT;WB_133_INFORMATION_AND_COMMUNICATION_TECHNOLOGIES;POVERTY;WB_695_POVERTY;,1#France#FR#FR#46#2#FR,,health service,0.645994832041344,srclc:ita;eng:GT-ITA 1.0,
