date_str,source,url,themes,locations,persons,organizations,tone,translation_info,full_text
20260220140000,zazoom.it,https://www.zazoom.it/2026-02-20/ssn-in-crisi-tra-invecchiamento-e-risorse-insufficienti-il-report/18693592/,CRISISLEX_CRISISLEXREC;UNGP_FORESTS_RIVERS_OCEANS;MEDIA_MSM;GENERAL_HEALTH;MEDICAL;WB_1305_HEALTH_SERVICES_DELIVERY;WB_621_HEALTH_NUTRITION_AND_POPULATION;SOC_AGINGPOPULATION;WB_1448_DEMOGRAPHIC_CHANGE;WB_643_AGING_POPULATION;WB_1609_FOOD_AND_IN_KIND_TRANSFERS;WB_1620_ELDERLY;WB_1466_SOCIAL_ASSISTANCE;WB_1618_FOOD_DISTRIBUTION;WB_697_SOCIAL_PROTECTION_AND_LABOR;WB_1331_HEALTH_TECHNOLOGIES;WB_1350_PHARMACEUTICALS;SHORTAGE;TAX_FNCACT;TAX_FNCACT_DOCTORS;CRISISLEX_C03_WELLBEING_HEALTH;WB_135_TRANSPORT;EPU_ECONOMY_HISTORIC;WB_1973_FINANCIAL_RISK_REDUCTION;WB_435_AGRICULTURE_AND_FOOD_SECURITY;WB_337_INSURANCE;WB_1967_AGRICULTURAL_RISK_AND_SECURITY;UNGP_CRIME_VIOLENCE;TAX_ETHNICITY;TAX_ETHNICITY_ITALIAN;TAX_WORLDLANGUAGES;TAX_WORLDLANGUAGES_ITALIAN;RESIGNATION;WB_2670_JOBS;EPU_ECONOMY;ECON_BUDGET_DEFICIT;ECON_DEBT;WB_1104_MACROECONOMIC_VULNERABILITY_AND_DEBT;WB_450_DEBT;TAX_FNCACT_DIRECTOR;MOVEMENT_GENERAL;TAX_FNCACT_CITIZENS;EPU_CATS_HEALTHCARE;,1#Italy#IT#IT#42.833333#12.833333#IT,,reuters;a health service national;a health service;health italian,-5.51558752997602,srclc:ita;eng:GT-ITA 1.0,"Ssn in crisi tra invecchiamento e risorse insufficienti il report
Il Servizio sanitario nazionale ha subito un duro colpo a causa dell’invecchiamento della popolazione e delle risorse limitate. Secondo un report recente, i fondi disponibili non bastano più a coprire le esigenze crescenti degli anziani e della medicina territoriale. La carenza di personale e i tagli hanno peggiorato la situazione, lasciando molte strutture in difficoltà. In alcune regioni, le liste d’attesa si allungano e i servizi di assistenza sono sempre più ridotti. La crisi si fa sentire in tutto il sistema sanitario.
(Adnkronos) – Il Servizio sanitario nazionale attraversa una crisi profonda, definita da molti osservatori un ""lento smantellamento"" del modello universalistico nato nel 1978. A fronte di una delle più alte speranze di vita in Europa, il sistema soffre di sottofinanziamento cronico – con una spesa pubblica pari a circa il 6,3% del Pil, inferiore alla . Potrebbe interessarti:. Medici famiglia, ‘tra 30-50enni tanti casi nausea e vomito, marzo mese difficile’.🔗 Leggi su Webmagazine24.it
Leggi anche: Il trasporto ferroviario in Campania: Un settore in crisi tra obsolescenza e investimenti insufficienti
Leggi anche: Sicilia, Ciclone Harry: Imprese Catania in crisi, tra danni, assicurazioni insufficienti e ristori a rischio.
Vedi altri contenuti disponibili per approfondire la notizia o scorri a sinistra ← per la prossima news.Argomenti discussi: Sanità italiana tra crisi e riforma: la sussidiarietà come chiave per salvare il SSN; Il fenomeno delle grandi dimissioni - Anaao su speciale TG1; Aaroi-Emac: Senza investimenti sulle persone il Ssn non regge; Criticità croniche professione infermieristica, tra fuga dal SSN e contratti bloccati.
Il Ssn tra crisi economica e autonomia differenziata: è il momento della responsabilitàil contesto socioeconomico nazionale degli ultimi anni è stato caratterizzato dalla necessità di contenimento dell’imponente debito pubblico a fronte di una domanda crescente dei bisogni sanitari. La ... quotidianosanita.it
Si può rendere fertile il dibattito sulla crisi del Ssn?Gentile Direttore, in Italia c’è un forte e diffuso movimento per la difesa del Ssn, che tutti sanno essere in grave crisi, crisi che preoccupa i cittadini tanto da rendere ormai il tema della salute ... quotidianosanita.it
#Sanità italiana tra crisi e riforma: la #sussidiarietà come chiave per salvare il #SSN helpconsumatori.it/diritti/sanita… via @HelpConsumatori x.com
Il Servizio Sanitario Nazionale è davvero in crisi E se sì, è una questione di risorse o di valori Se vi interessa capire cosa sta succedendo (davvero) al nostro SSN, non perdete la sessione pubblica online che apre il secondo modulo del Corso di perfezion - facebook.com facebook"
20260218083000,zazoom.it,https://www.zazoom.it/2026-02-18/decreto-flussi-click-day-per-13-600-lavoratori-domestici/18676856/,TAX_FNCACT;TAX_FNCACT_WORKERS;MEDIA_MSM;EPU_ECONOMY_HISTORIC;TAX_FNCACT_EMPLOYERS;WB_2690_CATEGORIES_OF_EMPLOYMENT;WB_2670_JOBS;WB_2689_JOBS_DIAGNOSTICS;WB_2704_EMPLOYER;TAX_FNCACT_CANDIDATE;TAX_FNCACT_CAREGIVERS;SOC_AGINGPOPULATION;WB_621_HEALTH_NUTRITION_AND_POPULATION;WB_1448_DEMOGRAPHIC_CHANGE;WB_643_AGING_POPULATION;ECON_UNIONS;USPEC_POLICY1;EPU_ECONOMY;TOURISM;WB_825_TOURISM;WB_1921_PRIVATE_SECTOR_DEVELOPMENT;WB_346_COMPETITIVE_INDUSTRIES;WB_818_INDUSTRY_POLICY_AND_REAL_SECTORS;WB_135_TRANSPORT;WB_1801_ROAD_TRANSPORT;WB_164_MODES_OF_TRANSPORT;GENERAL_GOVERNMENT;RECRUITMENT;,1#Italy#IT#IT#42.833333#12.833333#IT,,ministry the,0.91324200913242,srclc:ita;eng:GT-ITA 1.0,"Decreto flussi click day per 13.600 lavoratori domestici
Il decreto flussi ha portato all’apertura del click day per 13.600 lavoratori domestici, un’opportunità che interessa un settore da 17 miliardi di euro. Oggi, 18 febbraio 2026, i datori di lavoro possono candidarsi online per assumere colf e badanti, in una gara che si preannuncia intensa. La piattaforma resterà attiva fino a esaurimento delle quote, e questa misura mira a regolare l’ingresso di lavoratori stranieri in modo più rapido ed efficace.
Click Day per 13.600 Colf: Un Settore da 17 Miliardi alla Ricerca di Stabilità. Oggi, 18 febbraio 2026, apre la finestra online per l’assunzione di 13.600 lavoratori domestici stranieri in Italia. L’iniziativa, parte di un piano triennale, mira a rispondere alla crescente domanda di assistenza familiare in un Paese caratterizzato da un invecchiamento della popolazione e da una spesa per il lavoro di cura stimata a 17 miliardi di euro nel 2024. Tuttavia, associazioni di categoria e sindacati sottolineano come questa procedura, pur necessaria, non sia sufficiente a risolvere le problematiche strutturali di un settore cruciale per l’economia nazionale.🔗 Leggi su Ameve.eu
Decreto flussi, click day per 13.600 lavoratori domestici: il settore vale 17 miliardiIl decreto flussi ha aperto oggi il click day per 13.
Decreto Flussi 2026, parte il click day per i lavoratori subordinati non stagionali: ecco come inviare le domandeOggi inizia il click day per i lavoratori subordinati non stagionali, dopo che il Ministero ha aperto ufficialmente le iscrizioni per il 2026.
Vedi altri contenuti disponibili per approfondire la notizia o scorri a sinistra ← per la prossima news.Argomenti discussi: Decreto Flussi 2026, oggi click day per i lavoratori stagionali del turismo: come fare; Colf e badanti, click day 2026 il 18 febbraio: 13.600 posti disponibili ma ci sono 49.000 domande già pre-caricate, come funziona; Lavoratori domestici stranieri: 18 febbraio ultimo click day del 2026; Decreto Flussi 2026: il 16 febbraio è il click day per l’autotrasporto.
Decreto Flussi 2026, oggi click day per colf e badanti: come fareCome stabilito nel provvedimento approvato dal Parlamento lo scorso novembre, quest'anno è previsto l'ingresso di 13.600 lavoratori subordinati non stagionali nell’ambito dell’assistenza familiare, ch ... tg24.sky.it
Decreto flussi, click day per 13.600 lavoratori domestici: il settore vale 17 miliardiParte il piano triennale del decreto flussi per il lavoro domestico. Savia: La regolarità è un pilastro per l’economia della cura. Ecco come ... quifinanza.it
Click day 18 febbraio per assunzione di colf e badanti extra-UE secondo le quote del Decreto Flussi 2026. Procedura, lavoratori ammessi e istruzioni di domanda. facebook
Scatta il 18 febbraio il click day per il lavoro non stagionale, compresa l'assunzione di colf e badanti. Per questi ultimi le quote previste dal decreto Flussi 13.000 - Leggi e prassi / Pubblico, Ministero degli Interni x.com"
20260218060000,zazoom.it,https://www.zazoom.it/2026-02-18/senza-sanita-integrativa-7-milioni-di-visite-in-piu-allanno-per-il-ssn/18676524/,GENERAL_HEALTH;MEDICAL;MEDIA_MSM;WB_1305_HEALTH_SERVICES_DELIVERY;WB_621_HEALTH_NUTRITION_AND_POPULATION;CRISISLEX_C03_WELLBEING_HEALTH;TAX_FNCACT;TAX_FNCACT_SPECIALIST;WB_2024_ANTI_CORRUPTION_AUTHORITIES;WB_696_PUBLIC_SECTOR_MANAGEMENT;WB_840_JUSTICE;WB_2025_INVESTIGATION;WB_831_GOVERNANCE;WB_832_ANTI_CORRUPTION;WB_1014_CRIMINAL_JUSTICE;WB_2026_PREVENTION;SOC_AGINGPOPULATION;WB_1448_DEMOGRAPHIC_CHANGE;WB_643_AGING_POPULATION;UNGP_FORESTS_RIVERS_OCEANS;EDUCATION;SOC_POINTSOFINTEREST;SOC_POINTSOFINTEREST_SCHOOL;WB_1614_NUTRITIONAL_PROGRAMS;WB_1609_FOOD_AND_IN_KIND_TRANSFERS;WB_1616_SUPPLEMENTARY;WB_1466_SOCIAL_ASSISTANCE;WB_697_SOCIAL_PROTECTION_AND_LABOR;WB_1973_FINANCIAL_RISK_REDUCTION;WB_435_AGRICULTURE_AND_FOOD_SECURITY;WB_337_INSURANCE;WB_1967_AGRICULTURAL_RISK_AND_SECURITY;EPU_ECONOMY_HISTORIC;TAX_FNCACT_DOCTOR;USPEC_POLICY1;EPU_ECONOMY;TRANSPARENCY;TAX_DISEASE;TAX_DISEASE_FATIGUE;CRISISLEX_CRISISLEXREC;,,joseph bell,contract collective national supplementary;a new negotiable health;health system;health service,4.375,srclc:ita;eng:GT-ITA 1.0,"Senza sanità integrativa 7 milioni di visite in più all’anno per il Ssn
Ogni anno, senza la sanità integrativa, il Sistema sanitario nazionale dovrebbe gestire circa sette milioni di visite mediche, esami e prestazioni specialistiche in più. Questa situazione si tradurrebbe in un carico maggiore per le strutture pubbliche, che già affrontano lunghe liste d’attesa. Un esempio concreto è il caso di molte cliniche private che offrono servizi di diagnostica avanzata, riducendo così la pressione sui reparti pubblici.
Senza la sanità integrativa, 7 milioni di visite, accertamenti e prestazioni di alta diagnostica ricadrebbero ogni anno sul Servizio sanitario nazionale. Un dato significativo che sarà al centro della tavola rotonda promossa da Casagit Salute e Pmi Salute, ‘La psicologia dell’invecchiamento tra clinica, prevenzione e qualità della vita’. L’evento – previsto per il 23 febbraio alle 11 – sarà ospitato dalla sede romana di Casagit Salute. L’incontro nasce per affrontare una delle sfide decisive dei prossimi decenni: l’invecchiamento della popolazione e l a sostenibilità del sistema di welfare sanitario.🔗 Leggi su Lapresse.it
L'allarme di Gioffré e Campana sulla sanità: ""Tra un anno Calabria senza più servizio pubblico""Un allarme preoccupante sulla sanità calabrese emerge dalle parole di Santo Gioffré e Giuseppe Campana, che denunciano un progressivo impoverimento dei servizi pubblici.
Sanità integrativa per il personale scolastico: firmato il CCNI definitivo, ma resta l’incognita sui tempiÈ stato firmato il Contratto Collettivo Nazionale Integrativo (CCNI) che prevede l’introduzione di un’assicurazione sanitaria integrativa per il personale scolastico.
Vedi altri contenuti disponibili per approfondire la notizia o scorri a sinistra ← per la prossima news.Argomenti discussi: Senza sanità integrativa 7 milioni di visite in più all’anno per il Ssn; Assicurazione sanitaria per il personale scolastico, avviate le procedure. Ecco per cosa si potrà usare e per cosa non si potrà usare. Elenco completo; Ccnl Carta industria. Rinnovo; Serenis Medicina: un medico a disposizione per 24/7 365 giorni l’anno.
Senza sanità integrativa 7 milioni di visite in più all’anno per il SsnIl 23 febbraio l’evento che analizzerà il contributo della sanità integrativa alla tenuta del Ssn. lapresse.it
Sanità integrativa ed economia sociale: è il tempo della responsabilità condivisaIl Secondo pilastro vale tra i 4,5 e i 5 miliardi di euro annui: una massa critica che impone regole, trasparenza e responsabilità nella costruzione insieme al servizio sanitario pubblico di un sist ... ilsole24ore.com
Mobilità nel SSN: regole più chiare, tempi certi. Il nuovo CCNL Sanità 2022–2024 rafforza trasparenza e tutele per chi chiede il trasferimento tra Aziende ed Enti. Bandi annuali obbligatori Nessun nuovo periodo di prova Priorità per esigenze famili facebook
“Spesa sanitaria stabile sul Pil, ma il #Ssn fatica a recuperare”, l’allarme della Corte dei conti quotidianosanita.it/studi-e-analis… x.com"
20260219104500,leccotoday.it,https://www.leccotoday.it/attualita/emanuele-manzoni-presidente-welfare-anci-.html,LEADER;TAX_FNCACT;TAX_FNCACT_PRESIDENT;USPEC_POLITICS_GENERAL1;TAX_FNCACT_COMMISSIONER;TAX_FNCACT_BOARD_MEMBER;TAX_FNCACT_MAYOR;USPEC_POLICY1;TAX_FNCACT_OFFICIAL;TAX_ETHNICITY;TAX_ETHNICITY_ITALIAN;TAX_WORLDLANGUAGES;TAX_WORLDLANGUAGES_ITALIAN;WB_135_TRANSPORT;WB_1803_TRANSPORT_INFRASTRUCTURE;WB_167_PORTS;TAX_FNCACT_CHAIRMAN;TAX_FNCACT_CHAIRMAN_OF_THE_BOARD;CRISISLEX_T11_UPDATESSYMPATHY;TAX_FNCACT_PRESIDENTS;GENERAL_GOVERNMENT;EPU_POLICY;EPU_POLICY_CONGRESS;SOC_AGINGPOPULATION;WB_621_HEALTH_NUTRITION_AND_POPULATION;WB_1448_DEMOGRAPHIC_CHANGE;WB_643_AGING_POPULATION;DISCRIMINATION;UNGP_FREEDOM_FROM_DISCRIMINATION;WB_2670_JOBS;WB_2769_JOBS_STRATEGIES;WB_2840_INTEGRATION;WB_2836_MIGRATION_POLICIES_AND_JOBS;GENERAL_HEALTH;MEDICAL;EPU_CATS_HEALTHCARE;KILL;EPU_ECONOMY_HISTORIC;EDUCATION;SOC_POINTSOFINTEREST;SOC_POINTSOFINTEREST_SCHOOLS;WB_698_TRADE;ECON_UNIONS;WB_1668_LABOR_STANDARDS;WB_855_LABOR_MARKETS;WB_1670_TRADE_UNIONS;WB_697_SOCIAL_PROTECTION_AND_LABOR;,1#Italy#IT#IT#42.833333#12.833333#IT,emanuele manzoni,,3.65296803652968,srclc:ita;eng:GT-ITA 1.0,"Emanuele Manzoni nuovo presidente della commissione nazionale welfare dell'Anci
L'assessore lecchese: ""Tante le sfide che come comuni abbiamo davanti""
L'assessore al welfare del Comune di Lecco Emanuele Manzoni, già membro del Consiglio nazionale di Anci insieme al sindaco Mauro Gattinoni, è stato nominato presidente della commissione nazionale welfare e politiche sociali dell'Anci. La comunicazione ufficiale è stata trasmessa dai vertici nazionali della stessa Associazione nazionale comuni italiani e porta la firma del presidente Anci Gaetano Manfredi e del presidente del Consiglio nazionale Marco Fioravanti.
“Garantire qualità della vita ed efficaci politiche sociali”
“Ringrazio i presidenti Manfredi e Fioravanti per la fiducia accordatami e per avermi chiesto, a margine del congresso nazionale di Anci del novembre 2024, di ricoprire questo ruolo - è il commento dell'assessore - Sono tante le sfide che come comuni abbiamo davanti: garantire qualità di vita in un contesto di invecchiamento della popolazione, offrire medesime opportunità educative, formative e lavorative senza discriminazioni date dal nucleo familiare di provenienza o da condizioni fisiche e psichiche personali, superare le tante solitudini che abitano le nostre città, garantire l'accesso a una casa dignitosa per tutti, realizzare una reale integrazione tra le politiche sanitarie e sociali”.
""Mi metto al lavoro - conclude Manzoni - con spirito di servizio e con la consapevolezza che gli enti locali hanno come alleati il terzo settore, le istituzioni sanitarie, le scuole, le organizzazioni sindacali e la cittadinanza attiva.""
LeccoToday è anche su Mobile! Scarica l’App per rimanere sempre aggiornato."
20260219111500,merateonline.it,https://www.merateonline.it/notizie/153905/seminario-sul-sistema-territoriale-per-gli-anziani,WB_1609_FOOD_AND_IN_KIND_TRANSFERS;WB_1620_ELDERLY;WB_1466_SOCIAL_ASSISTANCE;WB_1618_FOOD_DISTRIBUTION;WB_697_SOCIAL_PROTECTION_AND_LABOR;TAX_FNCACT;TAX_FNCACT_CITIZENS;TAX_WORLDLANGUAGES;TAX_WORLDLANGUAGES_LOMBARD;LEADER;TAX_FNCACT_MAYORS;EPU_ECONOMY_HISTORIC;SOC_AGINGPOPULATION;WB_621_HEALTH_NUTRITION_AND_POPULATION;WB_1448_DEMOGRAPHIC_CHANGE;WB_643_AGING_POPULATION;USPEC_POLICY1;TAX_FNCACT_ADMINISTRATORS;TAX_FNCACT_EXECUTIVES;TAX_FNCACT_VOLUNTEERS;TAX_FNCACT_REPRESENTATIVES;KILL;TAX_FNCACT_KNIGHTS;WB_2936_GOLD;WB_507_ENERGY_AND_EXTRACTIVES;WB_895_MINING_SYSTEMS;WB_1699_METAL_ORE_MINING;GENERAL_HEALTH;MEDICAL;SOC_POINTSOFINTEREST;SOC_POINTSOFINTEREST_HOSPITAL;CRISISLEX_C03_WELLBEING_HEALTH;WB_2432_FRAGILITY_CONFLICT_AND_VIOLENCE;TAX_FNCACT_DIRECTORS;TAX_FNCACT_PRESIDENTS;TAX_FNCACT_CHAIRMAN;TAX_FNCACT_CHAIRMAN_OF_THE_BOARD;WB_1921_PRIVATE_SECTOR_DEVELOPMENT;WB_405_BUSINESS_CLIMATE;WB_2531_INSPECTIONS_LICENSING_AND_PERMITS;WB_2530_BUSINESS_ENVIRONMENT;UNGP_FORESTS_RIVERS_OCEANS;RESIGNATION;TAX_FNCACT_GUARD;WB_2024_ANTI_CORRUPTION_AUTHORITIES;WB_696_PUBLIC_SECTOR_MANAGEMENT;WB_831_GOVERNANCE;WB_832_ANTI_CORRUPTION;WB_2026_PREVENTION;,"4#Lecco, Lombardia, Italy#IT#IT09#45.85#9.38333#-119928;4#Monza, Lombardia, Italy#IT#IT09#45.5833#9.26667#-122630",,council of representation of mayors;office of footing;service epidemiology of brianza,0.213675213675214,srclc:ita;eng:GT-ITA 1.0,"Seminario sul sistema territoriale per gli anziani
La necessità di garantire una maggiore attenzione e un adeguato supporto ai bisogni della popolazione anziana della provincia di Lecco è un tema ormai all’ordine del giorno e dettato dall’evidenza: nel nostro + territorio le persone con più di 65 anni rappresentano il 26% della popolazione, con circa 44.000 cittadini che + hanno superato i 75 anni: una percentuale superiore alla media regionale lombarda, con una particolare concentrazione nell’area bellanese che comprende Lago e Valsassina.
Per avviare una risposta organica a questa evoluzione demografica, superando una gestione frammentata dei servizi in favore di una programmazione di sistema, il Consiglio di Rappresentanza dei Sindaci con gli Uffici di Piano, in accordo con ASST Lecco e ATS Brianza e con il coinvolgimento attivo del Terzo Settore, tra cui Uneba, Confcooperative, Auser, Anteas e Coop. Cosma, ha organizzato lo scorso 30 gennaio, un seminario di studio presso Officina Badoni a Lecco.
L’iniziativa ha avuto l’obiettivo di avviare un percorso strategico per il territorio lecchese nella risposta ai bisogni emergenti legati all’invecchiamento della popolazione, in coerenza con le normative nazionali e regionali, con i Piani di Zona adottati dai Comuni e con il Piano di sviluppo territoriale dell’ASST di Lecco. Al seminario hanno partecipato un centinaio di persone fra Operatori, Amministratori, Dirigenti, Volontari e rappresentanti di enti impegnati a vario titolo nel settore.
Il dr. Luca Cavalieri d’Oro (Servizio Epidemiologia di ATS Brianza) ha aggiornato sull’ evoluzione demografica della popolazione della provincia, e il prof. Giuseppe Bellelli (Geriatra Ospedale San Gerardo Monza) ha introdotto metodologie e possibili approcci per il monitoraggio delle fragilità, fornendo elementi preziosi di analisi e di intervento.
Il confronto attivo sviluppato nel seminario con direttori sociosanitari e responsabili di ATS e ASST, presidenti di Uneba, Auser, Confcooperative, responsabili degli Uffici di Piano e Presidente del Consiglio di Rappresentanza ha permesso di porre le premesse per accompagnare la ricchezza di esperienze e iniziative presenti nella ricerca di una architettura coordinata, capace di offrire un supporto integrato alle persone anziane e alle loro famiglie.
Il seminario ha rappresentato un punto di partenza importante: sono stati avviati tavoli di lavoro tematici che, nei prossimi mesi, svilupperanno proposte operative: tecnologie a servizio della cura, relazioni sociali come fattore determinante nel mantenimento di salute e vitalità, dimissioni e ammissioni protette, sostegno alla domiciliarità come area da presidiare a livello di sistema, supporto ai caregiver e prevenzione delle fragilità multifattoriali, sono solo alcuni dei temi su cui si concentrerà il lavoro.
Il primo passo è stato compiuto con la convergenza di intenti da parte di tutti gli enti e le realtà in campo, che hanno a più riprese espresso la necessità di adottare in modo coordinato un metodo di lavoro comune nella gestione dei servizi rivolti alla popolazione anziana del territorio. A breve i gruppi di lavoro saranno chiamati a individuare proposte concrete ed iniziative operative per individuare soluzioni organizzative che sollevino il compito della cura, ancor troppo sbilanciato su famiglie e caregiver.
Per avviare una risposta organica a questa evoluzione demografica, superando una gestione frammentata dei servizi in favore di una programmazione di sistema, il Consiglio di Rappresentanza dei Sindaci con gli Uffici di Piano, in accordo con ASST Lecco e ATS Brianza e con il coinvolgimento attivo del Terzo Settore, tra cui Uneba, Confcooperative, Auser, Anteas e Coop. Cosma, ha organizzato lo scorso 30 gennaio, un seminario di studio presso Officina Badoni a Lecco.
L’iniziativa ha avuto l’obiettivo di avviare un percorso strategico per il territorio lecchese nella risposta ai bisogni emergenti legati all’invecchiamento della popolazione, in coerenza con le normative nazionali e regionali, con i Piani di Zona adottati dai Comuni e con il Piano di sviluppo territoriale dell’ASST di Lecco. Al seminario hanno partecipato un centinaio di persone fra Operatori, Amministratori, Dirigenti, Volontari e rappresentanti di enti impegnati a vario titolo nel settore.
Il dr. Luca Cavalieri d’Oro (Servizio Epidemiologia di ATS Brianza) ha aggiornato sull’ evoluzione demografica della popolazione della provincia, e il prof. Giuseppe Bellelli (Geriatra Ospedale San Gerardo Monza) ha introdotto metodologie e possibili approcci per il monitoraggio delle fragilità, fornendo elementi preziosi di analisi e di intervento.
Il confronto attivo sviluppato nel seminario con direttori sociosanitari e responsabili di ATS e ASST, presidenti di Uneba, Auser, Confcooperative, responsabili degli Uffici di Piano e Presidente del Consiglio di Rappresentanza ha permesso di porre le premesse per accompagnare la ricchezza di esperienze e iniziative presenti nella ricerca di una architettura coordinata, capace di offrire un supporto integrato alle persone anziane e alle loro famiglie.
Il seminario ha rappresentato un punto di partenza importante: sono stati avviati tavoli di lavoro tematici che, nei prossimi mesi, svilupperanno proposte operative: tecnologie a servizio della cura, relazioni sociali come fattore determinante nel mantenimento di salute e vitalità, dimissioni e ammissioni protette, sostegno alla domiciliarità come area da presidiare a livello di sistema, supporto ai caregiver e prevenzione delle fragilità multifattoriali, sono solo alcuni dei temi su cui si concentrerà il lavoro.
Il primo passo è stato compiuto con la convergenza di intenti da parte di tutti gli enti e le realtà in campo, che hanno a più riprese espresso la necessità di adottare in modo coordinato un metodo di lavoro comune nella gestione dei servizi rivolti alla popolazione anziana del territorio. A breve i gruppi di lavoro saranno chiamati a individuare proposte concrete ed iniziative operative per individuare soluzioni organizzative che sollevino il compito della cura, ancor troppo sbilanciato su famiglie e caregiver.
Il tuo indirizzo email ed eventuali dati personali non verranno pubblicati."
